text,cmp_code,eu_code,pos,party,date,language,source,has_eu_code,is_primary_doc,may_contradict_core_dataset,md5sum_text,url_original,md5sum_original,annotations,handbook,is_copy_of,title,translation_en,id
Raise the professional status and training of care home managers through statutory licensing.,504,NA,977,51421,201505,english,MARPOR,FALSE,TRUE,FALSE,9f23c07a81e61778aec746491fd05e22,/down/originals/2016-1/51421_2015.pdf,912b1ac377993854fcd86a8f314dc18d,TRUE,4,NA,Manifesto 2015. Stronger Economy. Fairer Society. Opportunity for Everyone.,FALSE,51421_201505
Ensure those who work in the care sector are properly trained and suitable to practice by introducing a statutory code of conduct backed up by a care workers’ suitability register.,504,NA,978,51421,201505,english,MARPOR,FALSE,TRUE,FALSE,9f23c07a81e61778aec746491fd05e22,/down/originals/2016-1/51421_2015.pdf,912b1ac377993854fcd86a8f314dc18d,TRUE,4,NA,Manifesto 2015. Stronger Economy. Fairer Society. Opportunity for Everyone.,FALSE,51421_201505
Work with local government and providers to promote paying a Living Wage.,503,NA,979,51421,201505,english,MARPOR,FALSE,TRUE,FALSE,9f23c07a81e61778aec746491fd05e22,/down/originals/2016-1/51421_2015.pdf,912b1ac377993854fcd86a8f314dc18d,TRUE,4,NA,Manifesto 2015. Stronger Economy. Fairer Society. Opportunity for Everyone.,FALSE,51421_201505
`,NA,NA,980,51421,201505,english,MARPOR,FALSE,TRUE,FALSE,9f23c07a81e61778aec746491fd05e22,/down/originals/2016-1/51421_2015.pdf,912b1ac377993854fcd86a8f314dc18d,TRUE,4,NA,Manifesto 2015. Stronger Economy. Fairer Society. Opportunity for Everyone.,FALSE,51421_201505
"Better places  to live Communities, farming and the  natural environment",NA,NA,981,51421,201505,english,MARPOR,FALSE,TRUE,FALSE,9f23c07a81e61778aec746491fd05e22,/down/originals/2016-1/51421_2015.pdf,912b1ac377993854fcd86a8f314dc18d,TRUE,4,NA,Manifesto 2015. Stronger Economy. Fairer Society. Opportunity for Everyone.,FALSE,51421_201505
Liberal Democrats are the only major party that takes seriously the responsibility of protecting our natural environment.,501,NA,982,51421,201505,english,MARPOR,FALSE,TRUE,FALSE,9f23c07a81e61778aec746491fd05e22,/down/originals/2016-1/51421_2015.pdf,912b1ac377993854fcd86a8f314dc18d,TRUE,4,NA,Manifesto 2015. Stronger Economy. Fairer Society. Opportunity for Everyone.,FALSE,51421_201505
"We believe it is vital to make sure everyone has access to clean water, clean air and green spaces.",501,NA,983,51421,201505,english,MARPOR,FALSE,TRUE,FALSE,9f23c07a81e61778aec746491fd05e22,/down/originals/2016-1/51421_2015.pdf,912b1ac377993854fcd86a8f314dc18d,TRUE,4,NA,Manifesto 2015. Stronger Economy. Fairer Society. Opportunity for Everyone.,FALSE,51421_201505
We want to hand our countryside and green spaces on to the next generation in a better condition than when we were children.,501,NA,984,51421,201505,english,MARPOR,FALSE,TRUE,FALSE,9f23c07a81e61778aec746491fd05e22,/down/originals/2016-1/51421_2015.pdf,912b1ac377993854fcd86a8f314dc18d,TRUE,4,NA,Manifesto 2015. Stronger Economy. Fairer Society. Opportunity for Everyone.,FALSE,51421_201505
Liberal Democrats are the only major party that takes seriously the responsibility of protecting our natural environment.,501,NA,985,51421,201505,english,MARPOR,FALSE,TRUE,FALSE,9f23c07a81e61778aec746491fd05e22,/down/originals/2016-1/51421_2015.pdf,912b1ac377993854fcd86a8f314dc18d,TRUE,4,NA,Manifesto 2015. Stronger Economy. Fairer Society. Opportunity for Everyone.,FALSE,51421_201505
"We believe it is vital to make sure everyone has access to clean water, clean air and green spaces.",501,NA,986,51421,201505,english,MARPOR,FALSE,TRUE,FALSE,9f23c07a81e61778aec746491fd05e22,/down/originals/2016-1/51421_2015.pdf,912b1ac377993854fcd86a8f314dc18d,TRUE,4,NA,Manifesto 2015. Stronger Economy. Fairer Society. Opportunity for Everyone.,FALSE,51421_201505
We want to hand our countryside and green spaces on to the next generation in a better condition than when we were children.,501,NA,987,51421,201505,english,MARPOR,FALSE,TRUE,FALSE,9f23c07a81e61778aec746491fd05e22,/down/originals/2016-1/51421_2015.pdf,912b1ac377993854fcd86a8f314dc18d,TRUE,4,NA,Manifesto 2015. Stronger Economy. Fairer Society. Opportunity for Everyone.,FALSE,51421_201505
"That is why we have consistently defended the natural environment in government, bringing forward plans for a 5p charge for plastic bags,",501,NA,988,51421,201505,english,MARPOR,FALSE,TRUE,FALSE,9f23c07a81e61778aec746491fd05e22,/down/originals/2016-1/51421_2015.pdf,912b1ac377993854fcd86a8f314dc18d,TRUE,4,NA,Manifesto 2015. Stronger Economy. Fairer Society. Opportunity for Everyone.,FALSE,51421_201505
planting a million extra trees in England,501,NA,989,51421,201505,english,MARPOR,FALSE,TRUE,FALSE,9f23c07a81e61778aec746491fd05e22,/down/originals/2016-1/51421_2015.pdf,912b1ac377993854fcd86a8f314dc18d,TRUE,4,NA,Manifesto 2015. Stronger Economy. Fairer Society. Opportunity for Everyone.,FALSE,51421_201505
and ensuring Natural England remains a strong and independent organisation able to speak up for nature.,501,NA,990,51421,201505,english,MARPOR,FALSE,TRUE,FALSE,9f23c07a81e61778aec746491fd05e22,/down/originals/2016-1/51421_2015.pdf,912b1ac377993854fcd86a8f314dc18d,TRUE,4,NA,Manifesto 2015. Stronger Economy. Fairer Society. Opportunity for Everyone.,FALSE,51421_201505
"We have fought to protect the Green Belt and Areas of Outstanding Natural Beauty,",501,NA,991,51421,201505,english,MARPOR,FALSE,TRUE,FALSE,9f23c07a81e61778aec746491fd05e22,/down/originals/2016-1/51421_2015.pdf,912b1ac377993854fcd86a8f314dc18d,TRUE,4,NA,Manifesto 2015. Stronger Economy. Fairer Society. Opportunity for Everyone.,FALSE,51421_201505
and we have increased public access to our coastal paths.,501,NA,992,51421,201505,english,MARPOR,FALSE,TRUE,FALSE,9f23c07a81e61778aec746491fd05e22,/down/originals/2016-1/51421_2015.pdf,912b1ac377993854fcd86a8f314dc18d,TRUE,4,NA,Manifesto 2015. Stronger Economy. Fairer Society. Opportunity for Everyone.,FALSE,51421_201505
Liberal Democrats are proud to represent a large part of rural Britain and many farming constituencies.,703,NA,993,51421,201505,english,MARPOR,FALSE,TRUE,FALSE,9f23c07a81e61778aec746491fd05e22,/down/originals/2016-1/51421_2015.pdf,912b1ac377993854fcd86a8f314dc18d,TRUE,4,NA,Manifesto 2015. Stronger Economy. Fairer Society. Opportunity for Everyone.,FALSE,51421_201505
"We believe a fair society is one where people can afford to work and live in the countryside,",703,NA,994,51421,201505,english,MARPOR,FALSE,TRUE,FALSE,9f23c07a81e61778aec746491fd05e22,/down/originals/2016-1/51421_2015.pdf,912b1ac377993854fcd86a8f314dc18d,TRUE,4,NA,Manifesto 2015. Stronger Economy. Fairer Society. Opportunity for Everyone.,FALSE,51421_201505
and where farmers get the support they need.,703,NA,995,51421,201505,english,MARPOR,FALSE,TRUE,FALSE,9f23c07a81e61778aec746491fd05e22,/down/originals/2016-1/51421_2015.pdf,912b1ac377993854fcd86a8f314dc18d,TRUE,4,NA,Manifesto 2015. Stronger Economy. Fairer Society. Opportunity for Everyone.,FALSE,51421_201505
"We want them to have a prosperous, sustainable future, and help them cope with the challenges facing them, from floods to animal diseases.",703,NA,996,51421,201505,english,MARPOR,FALSE,TRUE,FALSE,9f23c07a81e61778aec746491fd05e22,/down/originals/2016-1/51421_2015.pdf,912b1ac377993854fcd86a8f314dc18d,TRUE,4,NA,Manifesto 2015. Stronger Economy. Fairer Society. Opportunity for Everyone.,FALSE,51421_201505
That is why we introduced the Groceries Code Adjudicator to ensure large supermarkets treat their suppliers lawfully and fairly.,703,NA,997,51421,201505,english,MARPOR,FALSE,TRUE,FALSE,9f23c07a81e61778aec746491fd05e22,/down/originals/2016-1/51421_2015.pdf,912b1ac377993854fcd86a8f314dc18d,TRUE,4,NA,Manifesto 2015. Stronger Economy. Fairer Society. Opportunity for Everyone.,FALSE,51421_201505
We have spent £3.2 billion on flood management and defences over the course of this Parliament.,703,NA,998,51421,201505,english,MARPOR,FALSE,TRUE,FALSE,9f23c07a81e61778aec746491fd05e22,/down/originals/2016-1/51421_2015.pdf,912b1ac377993854fcd86a8f314dc18d,TRUE,4,NA,Manifesto 2015. Stronger Economy. Fairer Society. Opportunity for Everyone.,FALSE,51421_201505
Liberal Democrats have kept farming and the natural environment at the top of the agenda over the past five years.,703,NA,999,51421,201505,english,MARPOR,FALSE,TRUE,FALSE,9f23c07a81e61778aec746491fd05e22,/down/originals/2016-1/51421_2015.pdf,912b1ac377993854fcd86a8f314dc18d,TRUE,4,NA,Manifesto 2015. Stronger Economy. Fairer Society. Opportunity for Everyone.,FALSE,51421_201505
We will ensure it remains a priority in the next Parliament.,703,NA,1000,51421,201505,english,MARPOR,FALSE,TRUE,FALSE,9f23c07a81e61778aec746491fd05e22,/down/originals/2016-1/51421_2015.pdf,912b1ac377993854fcd86a8f314dc18d,TRUE,4,NA,Manifesto 2015. Stronger Economy. Fairer Society. Opportunity for Everyone.,FALSE,51421_201505
A Record of Delivery,NA,NA,1001,51421,201505,english,MARPOR,FALSE,TRUE,FALSE,9f23c07a81e61778aec746491fd05e22,/down/originals/2016-1/51421_2015.pdf,912b1ac377993854fcd86a8f314dc18d,TRUE,4,NA,Manifesto 2015. Stronger Economy. Fairer Society. Opportunity for Everyone.,FALSE,51421_201505
Planted a million trees and protected our national forests by blocking plans to sell them off,501,NA,1002,51421,201505,english,MARPOR,FALSE,TRUE,FALSE,9f23c07a81e61778aec746491fd05e22,/down/originals/2016-1/51421_2015.pdf,912b1ac377993854fcd86a8f314dc18d,TRUE,4,NA,Manifesto 2015. Stronger Economy. Fairer Society. Opportunity for Everyone.,FALSE,51421_201505
Introduced a 5p charge on throwaway plastic bags to reduce waste,501,NA,1003,51421,201505,english,MARPOR,FALSE,TRUE,FALSE,9f23c07a81e61778aec746491fd05e22,/down/originals/2016-1/51421_2015.pdf,912b1ac377993854fcd86a8f314dc18d,TRUE,4,NA,Manifesto 2015. Stronger Economy. Fairer Society. Opportunity for Everyone.,FALSE,51421_201505
£500m investment package to promote Ultra Low Emission vehicles which will cut emissions and improve air quality,501,NA,1004,51421,201505,english,MARPOR,FALSE,TRUE,FALSE,9f23c07a81e61778aec746491fd05e22,/down/originals/2016-1/51421_2015.pdf,912b1ac377993854fcd86a8f314dc18d,TRUE,4,NA,Manifesto 2015. Stronger Economy. Fairer Society. Opportunity for Everyone.,FALSE,51421_201505
Halted the Post Office closure programme,503,NA,1005,51421,201505,english,MARPOR,FALSE,TRUE,FALSE,9f23c07a81e61778aec746491fd05e22,/down/originals/2016-1/51421_2015.pdf,912b1ac377993854fcd86a8f314dc18d,TRUE,4,NA,Manifesto 2015. Stronger Economy. Fairer Society. Opportunity for Everyone.,FALSE,51421_201505
and brought broadband to 80% of homes.,411,NA,1006,51421,201505,english,MARPOR,FALSE,TRUE,FALSE,9f23c07a81e61778aec746491fd05e22,/down/originals/2016-1/51421_2015.pdf,912b1ac377993854fcd86a8f314dc18d,TRUE,4,NA,Manifesto 2015. Stronger Economy. Fairer Society. Opportunity for Everyone.,FALSE,51421_201505
A Promise of More,NA,NA,1007,51421,201505,english,MARPOR,FALSE,TRUE,FALSE,9f23c07a81e61778aec746491fd05e22,/down/originals/2016-1/51421_2015.pdf,912b1ac377993854fcd86a8f314dc18d,TRUE,4,NA,Manifesto 2015. Stronger Economy. Fairer Society. Opportunity for Everyone.,FALSE,51421_201505
"Expand accessible green space with new National Nature Parks chosen by local communities,",501,NA,1008,51421,201505,english,MARPOR,FALSE,TRUE,FALSE,9f23c07a81e61778aec746491fd05e22,/down/originals/2016-1/51421_2015.pdf,912b1ac377993854fcd86a8f314dc18d,TRUE,4,NA,Manifesto 2015. Stronger Economy. Fairer Society. Opportunity for Everyone.,FALSE,51421_201505
and plant a tree for every child born,501,NA,1009,51421,201505,english,MARPOR,FALSE,TRUE,FALSE,9f23c07a81e61778aec746491fd05e22,/down/originals/2016-1/51421_2015.pdf,912b1ac377993854fcd86a8f314dc18d,TRUE,4,NA,Manifesto 2015. Stronger Economy. Fairer Society. Opportunity for Everyone.,FALSE,51421_201505
Drive up recycling to 70% of household waste and minimise landfill,501,NA,1010,51421,201505,english,MARPOR,FALSE,TRUE,FALSE,9f23c07a81e61778aec746491fd05e22,/down/originals/2016-1/51421_2015.pdf,912b1ac377993854fcd86a8f314dc18d,TRUE,4,NA,Manifesto 2015. Stronger Economy. Fairer Society. Opportunity for Everyone.,FALSE,51421_201505
"Save lives by cleaning up our air, with low emission zones in towns with a pollution problem",501,NA,1011,51421,201505,english,MARPOR,FALSE,TRUE,FALSE,9f23c07a81e61778aec746491fd05e22,/down/originals/2016-1/51421_2015.pdf,912b1ac377993854fcd86a8f314dc18d,TRUE,4,NA,Manifesto 2015. Stronger Economy. Fairer Society. Opportunity for Everyone.,FALSE,51421_201505
"Complete broadband rollout to every home,",411,NA,1012,51421,201505,english,MARPOR,FALSE,TRUE,FALSE,9f23c07a81e61778aec746491fd05e22,/down/originals/2016-1/51421_2015.pdf,912b1ac377993854fcd86a8f314dc18d,TRUE,4,NA,Manifesto 2015. Stronger Economy. Fairer Society. Opportunity for Everyone.,FALSE,51421_201505
"and create an innovation fund to help keep local GPs,",503,NA,1013,51421,201505,english,MARPOR,FALSE,TRUE,FALSE,9f23c07a81e61778aec746491fd05e22,/down/originals/2016-1/51421_2015.pdf,912b1ac377993854fcd86a8f314dc18d,TRUE,4,NA,Manifesto 2015. Stronger Economy. Fairer Society. Opportunity for Everyone.,FALSE,51421_201505
post offices,503,NA,1014,51421,201505,english,MARPOR,FALSE,TRUE,FALSE,9f23c07a81e61778aec746491fd05e22,/down/originals/2016-1/51421_2015.pdf,912b1ac377993854fcd86a8f314dc18d,TRUE,4,NA,Manifesto 2015. Stronger Economy. Fairer Society. Opportunity for Everyone.,FALSE,51421_201505
and libraries open,503,NA,1015,51421,201505,english,MARPOR,FALSE,TRUE,FALSE,9f23c07a81e61778aec746491fd05e22,/down/originals/2016-1/51421_2015.pdf,912b1ac377993854fcd86a8f314dc18d,TRUE,4,NA,Manifesto 2015. Stronger Economy. Fairer Society. Opportunity for Everyone.,FALSE,51421_201505
6.1 Protecting nature,NA,NA,1016,51421,201505,english,MARPOR,FALSE,TRUE,FALSE,9f23c07a81e61778aec746491fd05e22,/down/originals/2016-1/51421_2015.pdf,912b1ac377993854fcd86a8f314dc18d,TRUE,4,NA,Manifesto 2015. Stronger Economy. Fairer Society. Opportunity for Everyone.,FALSE,51421_201505
Britain’s natural environment is precious.,501,NA,1017,51421,201505,english,MARPOR,FALSE,TRUE,FALSE,9f23c07a81e61778aec746491fd05e22,/down/originals/2016-1/51421_2015.pdf,912b1ac377993854fcd86a8f314dc18d,TRUE,4,NA,Manifesto 2015. Stronger Economy. Fairer Society. Opportunity for Everyone.,FALSE,51421_201505
"Without our green spaces, we would live less satisfying lives; they are critical to health, wellbeing and our sense of community.",501,NA,1018,51421,201505,english,MARPOR,FALSE,TRUE,FALSE,9f23c07a81e61778aec746491fd05e22,/down/originals/2016-1/51421_2015.pdf,912b1ac377993854fcd86a8f314dc18d,TRUE,4,NA,Manifesto 2015. Stronger Economy. Fairer Society. Opportunity for Everyone.,FALSE,51421_201505
"Even in cash terms, short-term profits from exploiting the environment carry a longer-term penalty in squandered resources, clear-up costs and the impact on health.",416,NA,1019,51421,201505,english,MARPOR,FALSE,TRUE,FALSE,9f23c07a81e61778aec746491fd05e22,/down/originals/2016-1/51421_2015.pdf,912b1ac377993854fcd86a8f314dc18d,TRUE,4,NA,Manifesto 2015. Stronger Economy. Fairer Society. Opportunity for Everyone.,FALSE,51421_201505
We will ensure that protecting the natural environment becomes a core commitment of every government department and agency.,501,NA,1020,51421,201505,english,MARPOR,FALSE,TRUE,FALSE,9f23c07a81e61778aec746491fd05e22,/down/originals/2016-1/51421_2015.pdf,912b1ac377993854fcd86a8f314dc18d,TRUE,4,NA,Manifesto 2015. Stronger Economy. Fairer Society. Opportunity for Everyone.,FALSE,51421_201505
"We will: Pass a Nature Act to put the Natural Capital Committee (NCC) on a statutory footing,",501,NA,1021,51421,201505,english,MARPOR,FALSE,TRUE,FALSE,9f23c07a81e61778aec746491fd05e22,/down/originals/2016-1/51421_2015.pdf,912b1ac377993854fcd86a8f314dc18d,TRUE,4,NA,Manifesto 2015. Stronger Economy. Fairer Society. Opportunity for Everyone.,FALSE,51421_201505
"set natural capital targets, including on biodiversity, clean air and water,",501,NA,1022,51421,201505,english,MARPOR,FALSE,TRUE,FALSE,9f23c07a81e61778aec746491fd05e22,/down/originals/2016-1/51421_2015.pdf,912b1ac377993854fcd86a8f314dc18d,TRUE,4,NA,Manifesto 2015. Stronger Economy. Fairer Society. Opportunity for Everyone.,FALSE,51421_201505
and empower the NCC to recommend actions to meet these targets.,501,NA,1023,51421,201505,english,MARPOR,FALSE,TRUE,FALSE,9f23c07a81e61778aec746491fd05e22,/down/originals/2016-1/51421_2015.pdf,912b1ac377993854fcd86a8f314dc18d,TRUE,4,NA,Manifesto 2015. Stronger Economy. Fairer Society. Opportunity for Everyone.,FALSE,51421_201505
Significantly increase the amount of accessible green space.,501,NA,1024,51421,201505,english,MARPOR,FALSE,TRUE,FALSE,9f23c07a81e61778aec746491fd05e22,/down/originals/2016-1/51421_2015.pdf,912b1ac377993854fcd86a8f314dc18d,TRUE,4,NA,Manifesto 2015. Stronger Economy. Fairer Society. Opportunity for Everyone.,FALSE,51421_201505
"We will complete the coastal path,",501,NA,1025,51421,201505,english,MARPOR,FALSE,TRUE,FALSE,9f23c07a81e61778aec746491fd05e22,/down/originals/2016-1/51421_2015.pdf,912b1ac377993854fcd86a8f314dc18d,TRUE,4,NA,Manifesto 2015. Stronger Economy. Fairer Society. Opportunity for Everyone.,FALSE,51421_201505
introduce a fuller Right to Roam,501,NA,1026,51421,201505,english,MARPOR,FALSE,TRUE,FALSE,9f23c07a81e61778aec746491fd05e22,/down/originals/2016-1/51421_2015.pdf,912b1ac377993854fcd86a8f314dc18d,TRUE,4,NA,Manifesto 2015. Stronger Economy. Fairer Society. Opportunity for Everyone.,FALSE,51421_201505
and a new designation of National Nature Parks to protect up to a million acres of accessible green space valued by local communities.,501,NA,1027,51421,201505,english,MARPOR,FALSE,TRUE,FALSE,9f23c07a81e61778aec746491fd05e22,/down/originals/2016-1/51421_2015.pdf,912b1ac377993854fcd86a8f314dc18d,TRUE,4,NA,Manifesto 2015. Stronger Economy. Fairer Society. Opportunity for Everyone.,FALSE,51421_201505
"Place the management of public forests on a sustainable footing, in line with the recommendations of the Independent Panel on Forestry,",501,NA,1028,51421,201505,english,MARPOR,FALSE,TRUE,FALSE,9f23c07a81e61778aec746491fd05e22,/down/originals/2016-1/51421_2015.pdf,912b1ac377993854fcd86a8f314dc18d,TRUE,4,NA,Manifesto 2015. Stronger Economy. Fairer Society. Opportunity for Everyone.,FALSE,51421_201505
"and plant at least an additional tree for every child born – about 750,000 every year – as part of a major afforestation plan.",501,NA,1029,51421,201505,english,MARPOR,FALSE,TRUE,FALSE,9f23c07a81e61778aec746491fd05e22,/down/originals/2016-1/51421_2015.pdf,912b1ac377993854fcd86a8f314dc18d,TRUE,4,NA,Manifesto 2015. Stronger Economy. Fairer Society. Opportunity for Everyone.,FALSE,51421_201505
Tackle wildlife and environmental crime with increased enforcement of environmental regulations by all relevant authorities,501,NA,1030,51421,201505,english,MARPOR,FALSE,TRUE,FALSE,9f23c07a81e61778aec746491fd05e22,/down/originals/2016-1/51421_2015.pdf,912b1ac377993854fcd86a8f314dc18d,TRUE,4,NA,Manifesto 2015. Stronger Economy. Fairer Society. Opportunity for Everyone.,FALSE,51421_201505
and higher penalties to ensure environmental crime is not a financial risk worth taking.,501,NA,1031,51421,201505,english,MARPOR,FALSE,TRUE,FALSE,9f23c07a81e61778aec746491fd05e22,/down/originals/2016-1/51421_2015.pdf,912b1ac377993854fcd86a8f314dc18d,TRUE,4,NA,Manifesto 2015. Stronger Economy. Fairer Society. Opportunity for Everyone.,FALSE,51421_201505
Improve UK enforcement of the EU Birds and Habitats Directive.,501,NA,1032,51421,201505,english,MARPOR,FALSE,TRUE,FALSE,9f23c07a81e61778aec746491fd05e22,/down/originals/2016-1/51421_2015.pdf,912b1ac377993854fcd86a8f314dc18d,TRUE,4,NA,Manifesto 2015. Stronger Economy. Fairer Society. Opportunity for Everyone.,FALSE,51421_201505
"Bring forward a package of measures to protect bees and other pollinators, including legal protection for bumblebee nests.",501,NA,1033,51421,201505,english,MARPOR,FALSE,TRUE,FALSE,9f23c07a81e61778aec746491fd05e22,/down/originals/2016-1/51421_2015.pdf,912b1ac377993854fcd86a8f314dc18d,TRUE,4,NA,Manifesto 2015. Stronger Economy. Fairer Society. Opportunity for Everyone.,FALSE,51421_201505
Designate an ecologically coherent network of marine protected areas with appropriate management by 2020.,501,NA,1034,51421,201505,english,MARPOR,FALSE,TRUE,FALSE,9f23c07a81e61778aec746491fd05e22,/down/originals/2016-1/51421_2015.pdf,912b1ac377993854fcd86a8f314dc18d,TRUE,4,NA,Manifesto 2015. Stronger Economy. Fairer Society. Opportunity for Everyone.,FALSE,51421_201505
"Encourage the uptake of water metering, including introducing metering in all defined water-stressed areas by 2025,",501,NA,1035,51421,201505,english,MARPOR,FALSE,TRUE,FALSE,9f23c07a81e61778aec746491fd05e22,/down/originals/2016-1/51421_2015.pdf,912b1ac377993854fcd86a8f314dc18d,TRUE,4,NA,Manifesto 2015. Stronger Economy. Fairer Society. Opportunity for Everyone.,FALSE,51421_201505
coupled with the development of national social tariffs to protect low-income households.,503,NA,1036,51421,201505,english,MARPOR,FALSE,TRUE,FALSE,9f23c07a81e61778aec746491fd05e22,/down/originals/2016-1/51421_2015.pdf,912b1ac377993854fcd86a8f314dc18d,TRUE,4,NA,Manifesto 2015. Stronger Economy. Fairer Society. Opportunity for Everyone.,FALSE,51421_201505
Liberal Democrats believe in the highest standards of animal welfare.,501,NA,1037,51421,201505,english,MARPOR,FALSE,TRUE,FALSE,9f23c07a81e61778aec746491fd05e22,/down/originals/2016-1/51421_2015.pdf,912b1ac377993854fcd86a8f314dc18d,TRUE,4,NA,Manifesto 2015. Stronger Economy. Fairer Society. Opportunity for Everyone.,FALSE,51421_201505
We will review the rules surrounding the sale of pets to ensure they promote responsible breeding and sales,501,NA,1038,51421,201505,english,MARPOR,FALSE,TRUE,FALSE,9f23c07a81e61778aec746491fd05e22,/down/originals/2016-1/51421_2015.pdf,912b1ac377993854fcd86a8f314dc18d,TRUE,4,NA,Manifesto 2015. Stronger Economy. Fairer Society. Opportunity for Everyone.,FALSE,51421_201505
"and minimise the use of animals in scientific experimentation,",501,NA,1039,51421,201505,english,MARPOR,FALSE,TRUE,FALSE,9f23c07a81e61778aec746491fd05e22,/down/originals/2016-1/51421_2015.pdf,912b1ac377993854fcd86a8f314dc18d,TRUE,4,NA,Manifesto 2015. Stronger Economy. Fairer Society. Opportunity for Everyone.,FALSE,51421_201505
including by funding research into alternatives.,501,NA,1040,51421,201505,english,MARPOR,FALSE,TRUE,FALSE,9f23c07a81e61778aec746491fd05e22,/down/originals/2016-1/51421_2015.pdf,912b1ac377993854fcd86a8f314dc18d,TRUE,4,NA,Manifesto 2015. Stronger Economy. Fairer Society. Opportunity for Everyone.,FALSE,51421_201505
"We remain committed to the three Rs of humane animal research: Replace, Reduce, Refine.",501,NA,1041,51421,201505,english,MARPOR,FALSE,TRUE,FALSE,9f23c07a81e61778aec746491fd05e22,/down/originals/2016-1/51421_2015.pdf,912b1ac377993854fcd86a8f314dc18d,TRUE,4,NA,Manifesto 2015. Stronger Economy. Fairer Society. Opportunity for Everyone.,FALSE,51421_201505
"6.2 Waste not, want not: using our resources to generate lasting prosperity",NA,NA,1042,51421,201505,english,MARPOR,FALSE,TRUE,FALSE,9f23c07a81e61778aec746491fd05e22,/down/originals/2016-1/51421_2015.pdf,912b1ac377993854fcd86a8f314dc18d,TRUE,4,NA,Manifesto 2015. Stronger Economy. Fairer Society. Opportunity for Everyone.,FALSE,51421_201505
"The successful economies of the future will be ‘circular’ - where waste and the use of non-renewable resources are minimised and recovery, reuse and recycling are maximised.",416,NA,1043,51421,201505,english,MARPOR,FALSE,TRUE,FALSE,9f23c07a81e61778aec746491fd05e22,/down/originals/2016-1/51421_2015.pdf,912b1ac377993854fcd86a8f314dc18d,TRUE,4,NA,Manifesto 2015. Stronger Economy. Fairer Society. Opportunity for Everyone.,FALSE,51421_201505
"Britain has a real opportunity to lead the way, generating sustainable prosperity and jobs.",416,NA,1044,51421,201505,english,MARPOR,FALSE,TRUE,FALSE,9f23c07a81e61778aec746491fd05e22,/down/originals/2016-1/51421_2015.pdf,912b1ac377993854fcd86a8f314dc18d,TRUE,4,NA,Manifesto 2015. Stronger Economy. Fairer Society. Opportunity for Everyone.,FALSE,51421_201505
We will bring forward a comprehensive waste strategy to build a thriving reuse and recycling industry,416,NA,1045,51421,201505,english,MARPOR,FALSE,TRUE,FALSE,9f23c07a81e61778aec746491fd05e22,/down/originals/2016-1/51421_2015.pdf,912b1ac377993854fcd86a8f314dc18d,TRUE,4,NA,Manifesto 2015. Stronger Economy. Fairer Society. Opportunity for Everyone.,FALSE,51421_201505
"and pass a Resource Efficiency and Zero Waste Act to: Task the Natural Capital Committee with producing a ‘Stern report’ on resource use, identifying resources being used unsustainably and recommending legally binding targets for reducing their net consumption.",416,NA,1046,51421,201505,english,MARPOR,FALSE,TRUE,FALSE,9f23c07a81e61778aec746491fd05e22,/down/originals/2016-1/51421_2015.pdf,912b1ac377993854fcd86a8f314dc18d,TRUE,4,NA,Manifesto 2015. Stronger Economy. Fairer Society. Opportunity for Everyone.,FALSE,51421_201505
Use regulation both nationally and in the EU to promote sustainable design,416,NA,1047,51421,201505,english,MARPOR,FALSE,TRUE,FALSE,9f23c07a81e61778aec746491fd05e22,/down/originals/2016-1/51421_2015.pdf,912b1ac377993854fcd86a8f314dc18d,TRUE,4,NA,Manifesto 2015. Stronger Economy. Fairer Society. Opportunity for Everyone.,FALSE,51421_201505
"where reparability, reuse and recyclability are prioritised,",416,NA,1048,51421,201505,english,MARPOR,FALSE,TRUE,FALSE,9f23c07a81e61778aec746491fd05e22,/down/originals/2016-1/51421_2015.pdf,912b1ac377993854fcd86a8f314dc18d,TRUE,4,NA,Manifesto 2015. Stronger Economy. Fairer Society. Opportunity for Everyone.,FALSE,51421_201505
