text,cmp_code,eu_code,pos,party,date,language,source,has_eu_code,is_primary_doc,may_contradict_core_dataset,md5sum_text,url_original,md5sum_original,annotations,handbook,is_copy_of,title,translation_en,id
while getting them the help they need to get their first job.,701,NA,494,51421,201505,english,MARPOR,FALSE,TRUE,FALSE,9f23c07a81e61778aec746491fd05e22,/down/originals/2016-1/51421_2015.pdf,912b1ac377993854fcd86a8f314dc18d,TRUE,4,NA,Manifesto 2015. Stronger Economy. Fairer Society. Opportunity for Everyone.,FALSE,51421_201505
That means doubling the number of businesses that hire apprentices.,701,NA,495,51421,201505,english,MARPOR,FALSE,TRUE,FALSE,9f23c07a81e61778aec746491fd05e22,/down/originals/2016-1/51421_2015.pdf,912b1ac377993854fcd86a8f314dc18d,TRUE,4,NA,Manifesto 2015. Stronger Economy. Fairer Society. Opportunity for Everyone.,FALSE,51421_201505
"It also means providing support that has been proven to work, like work experience placements that help them get a first foot on the career ladder.",701,NA,496,51421,201505,english,MARPOR,FALSE,TRUE,FALSE,9f23c07a81e61778aec746491fd05e22,/down/originals/2016-1/51421_2015.pdf,912b1ac377993854fcd86a8f314dc18d,TRUE,4,NA,Manifesto 2015. Stronger Economy. Fairer Society. Opportunity for Everyone.,FALSE,51421_201505
These placements should be tailored for those with disabilities or mental health problems,503,NA,497,51421,201505,english,MARPOR,FALSE,TRUE,FALSE,9f23c07a81e61778aec746491fd05e22,/down/originals/2016-1/51421_2015.pdf,912b1ac377993854fcd86a8f314dc18d,TRUE,4,NA,Manifesto 2015. Stronger Economy. Fairer Society. Opportunity for Everyone.,FALSE,51421_201505
and those with parental responsibilities,503,NA,498,51421,201505,english,MARPOR,FALSE,TRUE,FALSE,9f23c07a81e61778aec746491fd05e22,/down/originals/2016-1/51421_2015.pdf,912b1ac377993854fcd86a8f314dc18d,TRUE,4,NA,Manifesto 2015. Stronger Economy. Fairer Society. Opportunity for Everyone.,FALSE,51421_201505
"and we will work to expand the availability of placements into new sectors including manufacturing, science and technology.",411,NA,499,51421,201505,english,MARPOR,FALSE,TRUE,FALSE,9f23c07a81e61778aec746491fd05e22,/down/originals/2016-1/51421_2015.pdf,912b1ac377993854fcd86a8f314dc18d,TRUE,4,NA,Manifesto 2015. Stronger Economy. Fairer Society. Opportunity for Everyone.,FALSE,51421_201505
3.4 Making welfare work,NA,NA,500,51421,201505,english,MARPOR,FALSE,TRUE,FALSE,9f23c07a81e61778aec746491fd05e22,/down/originals/2016-1/51421_2015.pdf,912b1ac377993854fcd86a8f314dc18d,TRUE,4,NA,Manifesto 2015. Stronger Economy. Fairer Society. Opportunity for Everyone.,FALSE,51421_201505
"Working-age benefits make up a significant proportion of public spending, and have long been in need of reform, which we have started in this Parliament.",505,NA,501,51421,201505,english,MARPOR,FALSE,TRUE,FALSE,9f23c07a81e61778aec746491fd05e22,/down/originals/2016-1/51421_2015.pdf,912b1ac377993854fcd86a8f314dc18d,TRUE,4,NA,Manifesto 2015. Stronger Economy. Fairer Society. Opportunity for Everyone.,FALSE,51421_201505
"Through tough choices, we have found savings in the welfare budget",505,NA,502,51421,201505,english,MARPOR,FALSE,TRUE,FALSE,9f23c07a81e61778aec746491fd05e22,/down/originals/2016-1/51421_2015.pdf,912b1ac377993854fcd86a8f314dc18d,TRUE,4,NA,Manifesto 2015. Stronger Economy. Fairer Society. Opportunity for Everyone.,FALSE,51421_201505
and we must continue to do so as we balance the books.,414,NA,503,51421,201505,english,MARPOR,FALSE,TRUE,FALSE,9f23c07a81e61778aec746491fd05e22,/down/originals/2016-1/51421_2015.pdf,912b1ac377993854fcd86a8f314dc18d,TRUE,4,NA,Manifesto 2015. Stronger Economy. Fairer Society. Opportunity for Everyone.,FALSE,51421_201505
"However, we do not support proposals for a lengthy freeze to working age benefits,",503,NA,504,51421,201505,english,MARPOR,FALSE,TRUE,FALSE,9f23c07a81e61778aec746491fd05e22,/down/originals/2016-1/51421_2015.pdf,912b1ac377993854fcd86a8f314dc18d,TRUE,4,NA,Manifesto 2015. Stronger Economy. Fairer Society. Opportunity for Everyone.,FALSE,51421_201505
and we will not protect benefits for the wealthiest pensioners at the expense of people working on low wages.,503,NA,505,51421,201505,english,MARPOR,FALSE,TRUE,FALSE,9f23c07a81e61778aec746491fd05e22,/down/originals/2016-1/51421_2015.pdf,912b1ac377993854fcd86a8f314dc18d,TRUE,4,NA,Manifesto 2015. Stronger Economy. Fairer Society. Opportunity for Everyone.,FALSE,51421_201505
"Our priority is to tackle the causes of rising benefit bills – high rents, low pay, sickness and unemployment.",503,NA,506,51421,201505,english,MARPOR,FALSE,TRUE,FALSE,9f23c07a81e61778aec746491fd05e22,/down/originals/2016-1/51421_2015.pdf,912b1ac377993854fcd86a8f314dc18d,TRUE,4,NA,Manifesto 2015. Stronger Economy. Fairer Society. Opportunity for Everyone.,FALSE,51421_201505
"We will: Introduce a 1% cap on the uprating of working-age benefits until the budget is balanced in 2017/18,",505,NA,507,51421,201505,english,MARPOR,FALSE,TRUE,FALSE,9f23c07a81e61778aec746491fd05e22,/down/originals/2016-1/51421_2015.pdf,912b1ac377993854fcd86a8f314dc18d,TRUE,4,NA,Manifesto 2015. Stronger Economy. Fairer Society. Opportunity for Everyone.,FALSE,51421_201505
after which they will rise with inflation once again.,504,NA,508,51421,201505,english,MARPOR,FALSE,TRUE,FALSE,9f23c07a81e61778aec746491fd05e22,/down/originals/2016-1/51421_2015.pdf,912b1ac377993854fcd86a8f314dc18d,TRUE,4,NA,Manifesto 2015. Stronger Economy. Fairer Society. Opportunity for Everyone.,FALSE,51421_201505
Disability and parental leave benefits will be exempt from this temporary cap.,503,NA,509,51421,201505,english,MARPOR,FALSE,TRUE,FALSE,9f23c07a81e61778aec746491fd05e22,/down/originals/2016-1/51421_2015.pdf,912b1ac377993854fcd86a8f314dc18d,TRUE,4,NA,Manifesto 2015. Stronger Economy. Fairer Society. Opportunity for Everyone.,FALSE,51421_201505
"Encourage landlords to lower their rent by paying them Housing Benefit directly, with tenants’ consent, in return for a fixed reduction.",503,NA,510,51421,201505,english,MARPOR,FALSE,TRUE,FALSE,9f23c07a81e61778aec746491fd05e22,/down/originals/2016-1/51421_2015.pdf,912b1ac377993854fcd86a8f314dc18d,TRUE,4,NA,Manifesto 2015. Stronger Economy. Fairer Society. Opportunity for Everyone.,FALSE,51421_201505
"Our plans for a major expansion of house building and new ‘family friendly’ tenancies, which limit annual rent increases, will also help reduce upward pressure on rents.",503,NA,511,51421,201505,english,MARPOR,FALSE,TRUE,FALSE,9f23c07a81e61778aec746491fd05e22,/down/originals/2016-1/51421_2015.pdf,912b1ac377993854fcd86a8f314dc18d,TRUE,4,NA,Manifesto 2015. Stronger Economy. Fairer Society. Opportunity for Everyone.,FALSE,51421_201505
"We will review the way the Shared Accommodation Rate in Local Housing Allowance is set,",503,NA,512,51421,201505,english,MARPOR,FALSE,TRUE,FALSE,9f23c07a81e61778aec746491fd05e22,/down/originals/2016-1/51421_2015.pdf,912b1ac377993854fcd86a8f314dc18d,TRUE,4,NA,Manifesto 2015. Stronger Economy. Fairer Society. Opportunity for Everyone.,FALSE,51421_201505
and review the Broad Rental Market Areas to ensure they fit with realistic travel patterns.,503,NA,513,51421,201505,english,MARPOR,FALSE,TRUE,FALSE,9f23c07a81e61778aec746491fd05e22,/down/originals/2016-1/51421_2015.pdf,912b1ac377993854fcd86a8f314dc18d,TRUE,4,NA,Manifesto 2015. Stronger Economy. Fairer Society. Opportunity for Everyone.,FALSE,51421_201505
Improve links between Jobcentres and Work Programme providers and the local NHS to ensure all those in receipt of health-related benefits are getting the care and support to which they are entitled.,503,NA,514,51421,201505,english,MARPOR,FALSE,TRUE,FALSE,9f23c07a81e61778aec746491fd05e22,/down/originals/2016-1/51421_2015.pdf,912b1ac377993854fcd86a8f314dc18d,TRUE,4,NA,Manifesto 2015. Stronger Economy. Fairer Society. Opportunity for Everyone.,FALSE,51421_201505
"In particular, as we expand access to talking therapies we expect many more people to recover and be able to seek work again.",503,NA,515,51421,201505,english,MARPOR,FALSE,TRUE,FALSE,9f23c07a81e61778aec746491fd05e22,/down/originals/2016-1/51421_2015.pdf,912b1ac377993854fcd86a8f314dc18d,TRUE,4,NA,Manifesto 2015. Stronger Economy. Fairer Society. Opportunity for Everyone.,FALSE,51421_201505
"Work with Local Authorities to tackle fraud and error in a more coordinated way, in particular on Housing Benefit.",303,NA,516,51421,201505,english,MARPOR,FALSE,TRUE,FALSE,9f23c07a81e61778aec746491fd05e22,/down/originals/2016-1/51421_2015.pdf,912b1ac377993854fcd86a8f314dc18d,TRUE,4,NA,Manifesto 2015. Stronger Economy. Fairer Society. Opportunity for Everyone.,FALSE,51421_201505
"Help everyone in work on a low wage step up the career ladder and increase their hours,",701,NA,517,51421,201505,english,MARPOR,FALSE,TRUE,FALSE,9f23c07a81e61778aec746491fd05e22,/down/originals/2016-1/51421_2015.pdf,912b1ac377993854fcd86a8f314dc18d,TRUE,4,NA,Manifesto 2015. Stronger Economy. Fairer Society. Opportunity for Everyone.,FALSE,51421_201505
"reducing their need for benefits,",701,NA,518,51421,201505,english,MARPOR,FALSE,TRUE,FALSE,9f23c07a81e61778aec746491fd05e22,/down/originals/2016-1/51421_2015.pdf,912b1ac377993854fcd86a8f314dc18d,TRUE,4,NA,Manifesto 2015. Stronger Economy. Fairer Society. Opportunity for Everyone.,FALSE,51421_201505
with tailored in-work careers and job search advice.,701,NA,519,51421,201505,english,MARPOR,FALSE,TRUE,FALSE,9f23c07a81e61778aec746491fd05e22,/down/originals/2016-1/51421_2015.pdf,912b1ac377993854fcd86a8f314dc18d,TRUE,4,NA,Manifesto 2015. Stronger Economy. Fairer Society. Opportunity for Everyone.,FALSE,51421_201505
Withdraw eligibility for the Winter Fuel Payment and free TV Licence from pensioners who pay tax at the higher rate (40%).,503,NA,520,51421,201505,english,MARPOR,FALSE,TRUE,FALSE,9f23c07a81e61778aec746491fd05e22,/down/originals/2016-1/51421_2015.pdf,912b1ac377993854fcd86a8f314dc18d,TRUE,4,NA,Manifesto 2015. Stronger Economy. Fairer Society. Opportunity for Everyone.,FALSE,51421_201505
We will retain the free bus pass for all pensioners.,504,NA,521,51421,201505,english,MARPOR,FALSE,TRUE,FALSE,9f23c07a81e61778aec746491fd05e22,/down/originals/2016-1/51421_2015.pdf,912b1ac377993854fcd86a8f314dc18d,TRUE,4,NA,Manifesto 2015. Stronger Economy. Fairer Society. Opportunity for Everyone.,FALSE,51421_201505
3.5 Flexibility at work and fair pay,NA,NA,522,51421,201505,english,MARPOR,FALSE,TRUE,FALSE,9f23c07a81e61778aec746491fd05e22,/down/originals/2016-1/51421_2015.pdf,912b1ac377993854fcd86a8f314dc18d,TRUE,4,NA,Manifesto 2015. Stronger Economy. Fairer Society. Opportunity for Everyone.,FALSE,51421_201505
"Britain’s employment laws are among the best in the world,",701,NA,523,51421,201505,english,MARPOR,FALSE,TRUE,FALSE,9f23c07a81e61778aec746491fd05e22,/down/originals/2016-1/51421_2015.pdf,912b1ac377993854fcd86a8f314dc18d,TRUE,4,NA,Manifesto 2015. Stronger Economy. Fairer Society. Opportunity for Everyone.,FALSE,51421_201505
balancing the needs of business for flexibility,402,NA,524,51421,201505,english,MARPOR,FALSE,TRUE,FALSE,9f23c07a81e61778aec746491fd05e22,/down/originals/2016-1/51421_2015.pdf,912b1ac377993854fcd86a8f314dc18d,TRUE,4,NA,Manifesto 2015. Stronger Economy. Fairer Society. Opportunity for Everyone.,FALSE,51421_201505
with the rights of staff to fair treatment.,701,NA,525,51421,201505,english,MARPOR,FALSE,TRUE,FALSE,9f23c07a81e61778aec746491fd05e22,/down/originals/2016-1/51421_2015.pdf,912b1ac377993854fcd86a8f314dc18d,TRUE,4,NA,Manifesto 2015. Stronger Economy. Fairer Society. Opportunity for Everyone.,FALSE,51421_201505
"Nonetheless there are still too many examples of low pay, exploitation, and bad practice, which contribute to unacceptable levels of inequality in our society.",503,NA,526,51421,201505,english,MARPOR,FALSE,TRUE,FALSE,9f23c07a81e61778aec746491fd05e22,/down/originals/2016-1/51421_2015.pdf,912b1ac377993854fcd86a8f314dc18d,TRUE,4,NA,Manifesto 2015. Stronger Economy. Fairer Society. Opportunity for Everyone.,FALSE,51421_201505
"This has to change: the more people earn a decent wage, the fewer will be dependent on benefits or stuck in poverty.",701,NA,527,51421,201505,english,MARPOR,FALSE,TRUE,FALSE,9f23c07a81e61778aec746491fd05e22,/down/originals/2016-1/51421_2015.pdf,912b1ac377993854fcd86a8f314dc18d,TRUE,4,NA,Manifesto 2015. Stronger Economy. Fairer Society. Opportunity for Everyone.,FALSE,51421_201505
"We will: Encourage employers to provide more flexible working,",701,NA,528,51421,201505,english,MARPOR,FALSE,TRUE,FALSE,9f23c07a81e61778aec746491fd05e22,/down/originals/2016-1/51421_2015.pdf,912b1ac377993854fcd86a8f314dc18d,TRUE,4,NA,Manifesto 2015. Stronger Economy. Fairer Society. Opportunity for Everyone.,FALSE,51421_201505
expanding Shared Parental Leave with an additional ‘use it or lose it’ month to encourage fathers to take time off with young children.,503,NA,529,51421,201505,english,MARPOR,FALSE,TRUE,FALSE,9f23c07a81e61778aec746491fd05e22,/down/originals/2016-1/51421_2015.pdf,912b1ac377993854fcd86a8f314dc18d,TRUE,4,NA,Manifesto 2015. Stronger Economy. Fairer Society. Opportunity for Everyone.,FALSE,51421_201505
"While changes to parental leave should be introduced slowly to give business time to adjust, our ambition is to see Paternity and Shared Parental Leave become a ‘day one’ right.",503,NA,530,51421,201505,english,MARPOR,FALSE,TRUE,FALSE,9f23c07a81e61778aec746491fd05e22,/down/originals/2016-1/51421_2015.pdf,912b1ac377993854fcd86a8f314dc18d,TRUE,4,NA,Manifesto 2015. Stronger Economy. Fairer Society. Opportunity for Everyone.,FALSE,51421_201505
Ensure swift implementation of the new rules requiring companies with more than 250 employees to publish details of the different pay levels of men and women in their organisation.,701,NA,531,51421,201505,english,MARPOR,FALSE,TRUE,FALSE,9f23c07a81e61778aec746491fd05e22,/down/originals/2016-1/51421_2015.pdf,912b1ac377993854fcd86a8f314dc18d,TRUE,4,NA,Manifesto 2015. Stronger Economy. Fairer Society. Opportunity for Everyone.,FALSE,51421_201505
"We will build on this platform and, by 2020, extend transparency requirements to include publishing the number of people paid less than the Living Wage",701,NA,532,51421,201505,english,MARPOR,FALSE,TRUE,FALSE,9f23c07a81e61778aec746491fd05e22,/down/originals/2016-1/51421_2015.pdf,912b1ac377993854fcd86a8f314dc18d,TRUE,4,NA,Manifesto 2015. Stronger Economy. Fairer Society. Opportunity for Everyone.,FALSE,51421_201505
and the ratio between top and median pay.,701,NA,533,51421,201505,english,MARPOR,FALSE,TRUE,FALSE,9f23c07a81e61778aec746491fd05e22,/down/originals/2016-1/51421_2015.pdf,912b1ac377993854fcd86a8f314dc18d,TRUE,4,NA,Manifesto 2015. Stronger Economy. Fairer Society. Opportunity for Everyone.,FALSE,51421_201505
"We will also consult on requirements for companies to conduct and publish a full equality pay review,",701,NA,534,51421,201505,english,MARPOR,FALSE,TRUE,FALSE,9f23c07a81e61778aec746491fd05e22,/down/originals/2016-1/51421_2015.pdf,912b1ac377993854fcd86a8f314dc18d,TRUE,4,NA,Manifesto 2015. Stronger Economy. Fairer Society. Opportunity for Everyone.,FALSE,51421_201505
and to consult staff on executive pay.,701,NA,535,51421,201505,english,MARPOR,FALSE,TRUE,FALSE,9f23c07a81e61778aec746491fd05e22,/down/originals/2016-1/51421_2015.pdf,912b1ac377993854fcd86a8f314dc18d,TRUE,4,NA,Manifesto 2015. Stronger Economy. Fairer Society. Opportunity for Everyone.,FALSE,51421_201505
"Ask the Low Pay Commission to look at ways of raising the National Minimum Wage, without damaging employment opportunities.",412,NA,536,51421,201505,english,MARPOR,FALSE,TRUE,FALSE,9f23c07a81e61778aec746491fd05e22,/down/originals/2016-1/51421_2015.pdf,912b1ac377993854fcd86a8f314dc18d,TRUE,4,NA,Manifesto 2015. Stronger Economy. Fairer Society. Opportunity for Everyone.,FALSE,51421_201505
We will improve enforcement action and clamp down on abuses by employers seeking to avoid paying the minimum wage by reviewing practices such as unpaid internships.,412,NA,537,51421,201505,english,MARPOR,FALSE,TRUE,FALSE,9f23c07a81e61778aec746491fd05e22,/down/originals/2016-1/51421_2015.pdf,912b1ac377993854fcd86a8f314dc18d,TRUE,4,NA,Manifesto 2015. Stronger Economy. Fairer Society. Opportunity for Everyone.,FALSE,51421_201505
Establish an independent review to consult on how to set a fair Living Wage across all sectors.,412,NA,538,51421,201505,english,MARPOR,FALSE,TRUE,FALSE,9f23c07a81e61778aec746491fd05e22,/down/originals/2016-1/51421_2015.pdf,912b1ac377993854fcd86a8f314dc18d,TRUE,4,NA,Manifesto 2015. Stronger Economy. Fairer Society. Opportunity for Everyone.,FALSE,51421_201505
"We will pay this Living Wage in all central government departments and their agencies from April 2016,",412,NA,539,51421,201505,english,MARPOR,FALSE,TRUE,FALSE,9f23c07a81e61778aec746491fd05e22,/down/originals/2016-1/51421_2015.pdf,912b1ac377993854fcd86a8f314dc18d,TRUE,4,NA,Manifesto 2015. Stronger Economy. Fairer Society. Opportunity for Everyone.,FALSE,51421_201505
and encourage other public sector employers to do likewise.,412,NA,540,51421,201505,english,MARPOR,FALSE,TRUE,FALSE,9f23c07a81e61778aec746491fd05e22,/down/originals/2016-1/51421_2015.pdf,912b1ac377993854fcd86a8f314dc18d,TRUE,4,NA,Manifesto 2015. Stronger Economy. Fairer Society. Opportunity for Everyone.,FALSE,51421_201505
"Improve the enforcement of employment rights, reviewing Employment Tribunal fees to ensure they are not a barrier.",412,NA,541,51421,201505,english,MARPOR,FALSE,TRUE,FALSE,9f23c07a81e61778aec746491fd05e22,/down/originals/2016-1/51421_2015.pdf,912b1ac377993854fcd86a8f314dc18d,TRUE,4,NA,Manifesto 2015. Stronger Economy. Fairer Society. Opportunity for Everyone.,FALSE,51421_201505
We will ensure employers cannot avoid giving their staff rights or paying the minimum wage by wrongly classifying them as workers or self-employed.,412,NA,542,51421,201505,english,MARPOR,FALSE,TRUE,FALSE,9f23c07a81e61778aec746491fd05e22,/down/originals/2016-1/51421_2015.pdf,912b1ac377993854fcd86a8f314dc18d,TRUE,4,NA,Manifesto 2015. Stronger Economy. Fairer Society. Opportunity for Everyone.,FALSE,51421_201505
Liberal Democrats understand that flexible employment contracts – including Zero Hours contracts – can work well for employees and businesses.,701,NA,543,51421,201505,english,MARPOR,FALSE,TRUE,FALSE,9f23c07a81e61778aec746491fd05e22,/down/originals/2016-1/51421_2015.pdf,912b1ac377993854fcd86a8f314dc18d,TRUE,4,NA,Manifesto 2015. Stronger Economy. Fairer Society. Opportunity for Everyone.,FALSE,51421_201505
But that is not always the case and we will continue to stamp out abuse.,701,NA,544,51421,201505,english,MARPOR,FALSE,TRUE,FALSE,9f23c07a81e61778aec746491fd05e22,/down/originals/2016-1/51421_2015.pdf,912b1ac377993854fcd86a8f314dc18d,TRUE,4,NA,Manifesto 2015. Stronger Economy. Fairer Society. Opportunity for Everyone.,FALSE,51421_201505
We will create a formal right to request a fixed contract,701,NA,545,51421,201505,english,MARPOR,FALSE,TRUE,FALSE,9f23c07a81e61778aec746491fd05e22,/down/originals/2016-1/51421_2015.pdf,912b1ac377993854fcd86a8f314dc18d,TRUE,4,NA,Manifesto 2015. Stronger Economy. Fairer Society. Opportunity for Everyone.,FALSE,51421_201505
and consult on introducing a right to make regular patterns of work contractual after a period of time.,701,NA,546,51421,201505,english,MARPOR,FALSE,TRUE,FALSE,9f23c07a81e61778aec746491fd05e22,/down/originals/2016-1/51421_2015.pdf,912b1ac377993854fcd86a8f314dc18d,TRUE,4,NA,Manifesto 2015. Stronger Economy. Fairer Society. Opportunity for Everyone.,FALSE,51421_201505
3.6 Improving support for the hardest to help,NA,NA,547,51421,201505,english,MARPOR,FALSE,TRUE,FALSE,9f23c07a81e61778aec746491fd05e22,/down/originals/2016-1/51421_2015.pdf,912b1ac377993854fcd86a8f314dc18d,TRUE,4,NA,Manifesto 2015. Stronger Economy. Fairer Society. Opportunity for Everyone.,FALSE,51421_201505
"For too long, sickness benefits were used as a way of parking people away from the unemployment statistics.",503,NA,548,51421,201505,english,MARPOR,FALSE,TRUE,FALSE,9f23c07a81e61778aec746491fd05e22,/down/originals/2016-1/51421_2015.pdf,912b1ac377993854fcd86a8f314dc18d,TRUE,4,NA,Manifesto 2015. Stronger Economy. Fairer Society. Opportunity for Everyone.,FALSE,51421_201505
"Our aim is to get everyone the support and help they need, both financially and in terms of advice and support.",503,NA,549,51421,201505,english,MARPOR,FALSE,TRUE,FALSE,9f23c07a81e61778aec746491fd05e22,/down/originals/2016-1/51421_2015.pdf,912b1ac377993854fcd86a8f314dc18d,TRUE,4,NA,Manifesto 2015. Stronger Economy. Fairer Society. Opportunity for Everyone.,FALSE,51421_201505
That does require a formal assessment: but these tests have to be fair and should not be an extra burden for vulnerable people.,503,NA,550,51421,201505,english,MARPOR,FALSE,TRUE,FALSE,9f23c07a81e61778aec746491fd05e22,/down/originals/2016-1/51421_2015.pdf,912b1ac377993854fcd86a8f314dc18d,TRUE,4,NA,Manifesto 2015. Stronger Economy. Fairer Society. Opportunity for Everyone.,FALSE,51421_201505
That is why we have made many improvements to the assessments introduced by the last government.,503,NA,551,51421,201505,english,MARPOR,FALSE,TRUE,FALSE,9f23c07a81e61778aec746491fd05e22,/down/originals/2016-1/51421_2015.pdf,912b1ac377993854fcd86a8f314dc18d,TRUE,4,NA,Manifesto 2015. Stronger Economy. Fairer Society. Opportunity for Everyone.,FALSE,51421_201505
"We want to aim even higher, ensuring assessments are truly fair, with quick access to financial help for those who cannot work, and support for those who can.",503,NA,552,51421,201505,english,MARPOR,FALSE,TRUE,FALSE,9f23c07a81e61778aec746491fd05e22,/down/originals/2016-1/51421_2015.pdf,912b1ac377993854fcd86a8f314dc18d,TRUE,4,NA,Manifesto 2015. Stronger Economy. Fairer Society. Opportunity for Everyone.,FALSE,51421_201505
"We will: Conduct a review of the Work Capability Assessment and Personal Independence Payment assessments to ensure they are fair, accurate and timely and evaluate the merits of a public sector provider.",503,NA,553,51421,201505,english,MARPOR,FALSE,TRUE,FALSE,9f23c07a81e61778aec746491fd05e22,/down/originals/2016-1/51421_2015.pdf,912b1ac377993854fcd86a8f314dc18d,TRUE,4,NA,Manifesto 2015. Stronger Economy. Fairer Society. Opportunity for Everyone.,FALSE,51421_201505
Invest to clear any backlog in assessments for Disability Living Allowance and Personal Independence Payment.,503,NA,554,51421,201505,english,MARPOR,FALSE,TRUE,FALSE,9f23c07a81e61778aec746491fd05e22,/down/originals/2016-1/51421_2015.pdf,912b1ac377993854fcd86a8f314dc18d,TRUE,4,NA,Manifesto 2015. Stronger Economy. Fairer Society. Opportunity for Everyone.,FALSE,51421_201505
"Simplify and streamline back-to-work support for people with disabilities, mental or physical health problems.",503,NA,555,51421,201505,english,MARPOR,FALSE,TRUE,FALSE,9f23c07a81e61778aec746491fd05e22,/down/originals/2016-1/51421_2015.pdf,912b1ac377993854fcd86a8f314dc18d,TRUE,4,NA,Manifesto 2015. Stronger Economy. Fairer Society. Opportunity for Everyone.,FALSE,51421_201505
We will aim for the goal of one assessment and one budget for disabled and sick people to give them more choice and control.,503,NA,556,51421,201505,english,MARPOR,FALSE,TRUE,FALSE,9f23c07a81e61778aec746491fd05e22,/down/originals/2016-1/51421_2015.pdf,912b1ac377993854fcd86a8f314dc18d,TRUE,4,NA,Manifesto 2015. Stronger Economy. Fairer Society. Opportunity for Everyone.,FALSE,51421_201505
"Raise awareness of, and seek to expand, Access to Work, which supports people with disabilities in work.",503,NA,557,51421,201505,english,MARPOR,FALSE,TRUE,FALSE,9f23c07a81e61778aec746491fd05e22,/down/originals/2016-1/51421_2015.pdf,912b1ac377993854fcd86a8f314dc18d,TRUE,4,NA,Manifesto 2015. Stronger Economy. Fairer Society. Opportunity for Everyone.,FALSE,51421_201505
Reform the policy to remove the spare room subsidy.,503,NA,558,51421,201505,english,MARPOR,FALSE,TRUE,FALSE,9f23c07a81e61778aec746491fd05e22,/down/originals/2016-1/51421_2015.pdf,912b1ac377993854fcd86a8f314dc18d,TRUE,4,NA,Manifesto 2015. Stronger Economy. Fairer Society. Opportunity for Everyone.,FALSE,51421_201505
Existing social tenants will not be subject to any housing benefit reduction until they have been offered reasonable alternative accommodation.,503,NA,559,51421,201505,english,MARPOR,FALSE,TRUE,FALSE,9f23c07a81e61778aec746491fd05e22,/down/originals/2016-1/51421_2015.pdf,912b1ac377993854fcd86a8f314dc18d,TRUE,4,NA,Manifesto 2015. Stronger Economy. Fairer Society. Opportunity for Everyone.,FALSE,51421_201505
"We will ensure tenants who need an extra bedroom for genuine medical reasons are entitled to one in any assessment of their Housing Benefit needs,",503,NA,560,51421,201505,english,MARPOR,FALSE,TRUE,FALSE,9f23c07a81e61778aec746491fd05e22,/down/originals/2016-1/51421_2015.pdf,912b1ac377993854fcd86a8f314dc18d,TRUE,4,NA,Manifesto 2015. Stronger Economy. Fairer Society. Opportunity for Everyone.,FALSE,51421_201505
and those whose homes are substantially adapted do not have their Housing Benefit reduced.,503,NA,561,51421,201505,english,MARPOR,FALSE,TRUE,FALSE,9f23c07a81e61778aec746491fd05e22,/down/originals/2016-1/51421_2015.pdf,912b1ac377993854fcd86a8f314dc18d,TRUE,4,NA,Manifesto 2015. Stronger Economy. Fairer Society. Opportunity for Everyone.,FALSE,51421_201505
3.7 Help to save for and enjoy your retirement,NA,NA,562,51421,201505,english,MARPOR,FALSE,TRUE,FALSE,9f23c07a81e61778aec746491fd05e22,/down/originals/2016-1/51421_2015.pdf,912b1ac377993854fcd86a8f314dc18d,TRUE,4,NA,Manifesto 2015. Stronger Economy. Fairer Society. Opportunity for Everyone.,FALSE,51421_201505
Life expectancy is increasing.,504,NA,563,51421,201505,english,MARPOR,FALSE,TRUE,FALSE,9f23c07a81e61778aec746491fd05e22,/down/originals/2016-1/51421_2015.pdf,912b1ac377993854fcd86a8f314dc18d,TRUE,4,NA,Manifesto 2015. Stronger Economy. Fairer Society. Opportunity for Everyone.,FALSE,51421_201505
