text,cmp_code,eu_code,pos,party,date,language,source,has_eu_code,is_primary_doc,may_contradict_core_dataset,md5sum_text,url_original,md5sum_original,annotations,handbook,is_copy_of,title,translation_en,id
We believe the police could be far more effective with proper support and shared best practice.,605,NA,1530,51421,201505,english,MARPOR,FALSE,TRUE,FALSE,9f23c07a81e61778aec746491fd05e22,/down/originals/2016-1/51421_2015.pdf,912b1ac377993854fcd86a8f314dc18d,TRUE,4,NA,Manifesto 2015. Stronger Economy. Fairer Society. Opportunity for Everyone.,FALSE,51421_201505
We will: Guarantee the police pursue the public’s priorities by replacing Police and Crime Commissioners with Police Boards made up of Councillors from across the force area.,605,NA,1531,51421,201505,english,MARPOR,FALSE,TRUE,FALSE,9f23c07a81e61778aec746491fd05e22,/down/originals/2016-1/51421_2015.pdf,912b1ac377993854fcd86a8f314dc18d,TRUE,4,NA,Manifesto 2015. Stronger Economy. Fairer Society. Opportunity for Everyone.,FALSE,51421_201505
"Encourage police forces and other emergency services to work together at a local, regional and national level to reduce back office costs and deliver efficiency savings.",605,NA,1532,51421,201505,english,MARPOR,FALSE,TRUE,FALSE,9f23c07a81e61778aec746491fd05e22,/down/originals/2016-1/51421_2015.pdf,912b1ac377993854fcd86a8f314dc18d,TRUE,4,NA,Manifesto 2015. Stronger Economy. Fairer Society. Opportunity for Everyone.,FALSE,51421_201505
"Support and expand Police Now, which is bringing high-flying graduates and skilled mid-career professionals into our police forces.",605,NA,1533,51421,201505,english,MARPOR,FALSE,TRUE,FALSE,9f23c07a81e61778aec746491fd05e22,/down/originals/2016-1/51421_2015.pdf,912b1ac377993854fcd86a8f314dc18d,TRUE,4,NA,Manifesto 2015. Stronger Economy. Fairer Society. Opportunity for Everyone.,FALSE,51421_201505
"Explore the case for transferring responsibility for more serious national crime to the National Crime Agency, enabling local police forces to focus on local crime and anti-social behaviour.",605,NA,1534,51421,201505,english,MARPOR,FALSE,TRUE,FALSE,9f23c07a81e61778aec746491fd05e22,/down/originals/2016-1/51421_2015.pdf,912b1ac377993854fcd86a8f314dc18d,TRUE,4,NA,Manifesto 2015. Stronger Economy. Fairer Society. Opportunity for Everyone.,FALSE,51421_201505
Step up our work with EU partners to tackle serious and organised crime.,108,NA,1535,51421,201505,english,MARPOR,FALSE,TRUE,FALSE,9f23c07a81e61778aec746491fd05e22,/down/originals/2016-1/51421_2015.pdf,912b1ac377993854fcd86a8f314dc18d,TRUE,4,NA,Manifesto 2015. Stronger Economy. Fairer Society. Opportunity for Everyone.,FALSE,51421_201505
9.3 Improve support for victims of crime,NA,NA,1536,51421,201505,english,MARPOR,FALSE,TRUE,FALSE,9f23c07a81e61778aec746491fd05e22,/down/originals/2016-1/51421_2015.pdf,912b1ac377993854fcd86a8f314dc18d,TRUE,4,NA,Manifesto 2015. Stronger Economy. Fairer Society. Opportunity for Everyone.,FALSE,51421_201505
The criminal justice system exists to protect the public from crime; where crime does occur victims are our first priority.,605,NA,1537,51421,201505,english,MARPOR,FALSE,TRUE,FALSE,9f23c07a81e61778aec746491fd05e22,/down/originals/2016-1/51421_2015.pdf,912b1ac377993854fcd86a8f314dc18d,TRUE,4,NA,Manifesto 2015. Stronger Economy. Fairer Society. Opportunity for Everyone.,FALSE,51421_201505
"We need to make sure they, and their families, are supported both in the aftermath of crimes and throughout the justice system.",605,NA,1538,51421,201505,english,MARPOR,FALSE,TRUE,FALSE,9f23c07a81e61778aec746491fd05e22,/down/originals/2016-1/51421_2015.pdf,912b1ac377993854fcd86a8f314dc18d,TRUE,4,NA,Manifesto 2015. Stronger Economy. Fairer Society. Opportunity for Everyone.,FALSE,51421_201505
We will: Enact a Victims’ Bill of Rights.,201,NA,1539,51421,201505,english,MARPOR,FALSE,TRUE,FALSE,9f23c07a81e61778aec746491fd05e22,/down/originals/2016-1/51421_2015.pdf,912b1ac377993854fcd86a8f314dc18d,TRUE,4,NA,Manifesto 2015. Stronger Economy. Fairer Society. Opportunity for Everyone.,FALSE,51421_201505
Create a single point of contact for victims to give early access to information and support.,201,NA,1540,51421,201505,english,MARPOR,FALSE,TRUE,FALSE,9f23c07a81e61778aec746491fd05e22,/down/originals/2016-1/51421_2015.pdf,912b1ac377993854fcd86a8f314dc18d,TRUE,4,NA,Manifesto 2015. Stronger Economy. Fairer Society. Opportunity for Everyone.,FALSE,51421_201505
Change sentencing guidelines to increase sentences available for hate crimes.,605,NA,1541,51421,201505,english,MARPOR,FALSE,TRUE,FALSE,9f23c07a81e61778aec746491fd05e22,/down/originals/2016-1/51421_2015.pdf,912b1ac377993854fcd86a8f314dc18d,TRUE,4,NA,Manifesto 2015. Stronger Economy. Fairer Society. Opportunity for Everyone.,FALSE,51421_201505
Give victims of crime a right to review what progress police have made to investigate the crime committed against them including cases where the police have declined to investigate.,201,NA,1542,51421,201505,english,MARPOR,FALSE,TRUE,FALSE,9f23c07a81e61778aec746491fd05e22,/down/originals/2016-1/51421_2015.pdf,912b1ac377993854fcd86a8f314dc18d,TRUE,4,NA,Manifesto 2015. Stronger Economy. Fairer Society. Opportunity for Everyone.,FALSE,51421_201505
Give victims a right to choose restorative justice.,201,NA,1543,51421,201505,english,MARPOR,FALSE,TRUE,FALSE,9f23c07a81e61778aec746491fd05e22,/down/originals/2016-1/51421_2015.pdf,912b1ac377993854fcd86a8f314dc18d,TRUE,4,NA,Manifesto 2015. Stronger Economy. Fairer Society. Opportunity for Everyone.,FALSE,51421_201505
Implement the Modern Slavery Strategy to reduce people trafficking and support victims.,201,NA,1544,51421,201505,english,MARPOR,FALSE,TRUE,FALSE,9f23c07a81e61778aec746491fd05e22,/down/originals/2016-1/51421_2015.pdf,912b1ac377993854fcd86a8f314dc18d,TRUE,4,NA,Manifesto 2015. Stronger Economy. Fairer Society. Opportunity for Everyone.,FALSE,51421_201505
9.4 Tackling violence against women and girls,NA,NA,1545,51421,201505,english,MARPOR,FALSE,TRUE,FALSE,9f23c07a81e61778aec746491fd05e22,/down/originals/2016-1/51421_2015.pdf,912b1ac377993854fcd86a8f314dc18d,TRUE,4,NA,Manifesto 2015. Stronger Economy. Fairer Society. Opportunity for Everyone.,FALSE,51421_201505
A fair society cannot tolerate today’s unacceptable level of violence against women and girls in Britain.,605,NA,1546,51421,201505,english,MARPOR,FALSE,TRUE,FALSE,9f23c07a81e61778aec746491fd05e22,/down/originals/2016-1/51421_2015.pdf,912b1ac377993854fcd86a8f314dc18d,TRUE,4,NA,Manifesto 2015. Stronger Economy. Fairer Society. Opportunity for Everyone.,FALSE,51421_201505
We have made progress since 2010 but we will not rest until women feel safe and respected.,605,NA,1547,51421,201505,english,MARPOR,FALSE,TRUE,FALSE,9f23c07a81e61778aec746491fd05e22,/down/originals/2016-1/51421_2015.pdf,912b1ac377993854fcd86a8f314dc18d,TRUE,4,NA,Manifesto 2015. Stronger Economy. Fairer Society. Opportunity for Everyone.,FALSE,51421_201505
"We will: Ensure teachers, social workers, police officers and health workers in areas where there is high prevalence of female genital mutilation or forced marriage are trained to help those at risk.",605,NA,1548,51421,201505,english,MARPOR,FALSE,TRUE,FALSE,9f23c07a81e61778aec746491fd05e22,/down/originals/2016-1/51421_2015.pdf,912b1ac377993854fcd86a8f314dc18d,TRUE,4,NA,Manifesto 2015. Stronger Economy. Fairer Society. Opportunity for Everyone.,FALSE,51421_201505
Require the teaching of sexual consent in schools as part of age-appropriate sex and relationships education.,605,NA,1549,51421,201505,english,MARPOR,FALSE,TRUE,FALSE,9f23c07a81e61778aec746491fd05e22,/down/originals/2016-1/51421_2015.pdf,912b1ac377993854fcd86a8f314dc18d,TRUE,4,NA,Manifesto 2015. Stronger Economy. Fairer Society. Opportunity for Everyone.,FALSE,51421_201505
Improve the provision of rape crisis centres and refuges for victims of domestic violence with a national network and national sources of funding.,605,NA,1550,51421,201505,english,MARPOR,FALSE,TRUE,FALSE,9f23c07a81e61778aec746491fd05e22,/down/originals/2016-1/51421_2015.pdf,912b1ac377993854fcd86a8f314dc18d,TRUE,4,NA,Manifesto 2015. Stronger Economy. Fairer Society. Opportunity for Everyone.,FALSE,51421_201505
Protect funding for tackling violence against women and girls and maintain the post of International Champion for preventing this violence.,605,NA,1551,51421,201505,english,MARPOR,FALSE,TRUE,FALSE,9f23c07a81e61778aec746491fd05e22,/down/originals/2016-1/51421_2015.pdf,912b1ac377993854fcd86a8f314dc18d,TRUE,4,NA,Manifesto 2015. Stronger Economy. Fairer Society. Opportunity for Everyone.,FALSE,51421_201505
"Create a national helpline for victims of domestic and sexual violence – regardless of gender – to provide support, encourage reporting and secure more convictions.",605,NA,1552,51421,201505,english,MARPOR,FALSE,TRUE,FALSE,9f23c07a81e61778aec746491fd05e22,/down/originals/2016-1/51421_2015.pdf,912b1ac377993854fcd86a8f314dc18d,TRUE,4,NA,Manifesto 2015. Stronger Economy. Fairer Society. Opportunity for Everyone.,FALSE,51421_201505
Work to ensure the whole criminal justice system updates practice in line with the Director of Public Prosecutions’ guidance on sexual consent.,605,NA,1553,51421,201505,english,MARPOR,FALSE,TRUE,FALSE,9f23c07a81e61778aec746491fd05e22,/down/originals/2016-1/51421_2015.pdf,912b1ac377993854fcd86a8f314dc18d,TRUE,4,NA,Manifesto 2015. Stronger Economy. Fairer Society. Opportunity for Everyone.,FALSE,51421_201505
9.5 Improving justice and rehabilitating offenders,NA,NA,1554,51421,201505,english,MARPOR,FALSE,TRUE,FALSE,9f23c07a81e61778aec746491fd05e22,/down/originals/2016-1/51421_2015.pdf,912b1ac377993854fcd86a8f314dc18d,TRUE,4,NA,Manifesto 2015. Stronger Economy. Fairer Society. Opportunity for Everyone.,FALSE,51421_201505
The criminal justice system can do more to turn people away from a life of crime.,000,NA,1555,51421,201505,english,MARPOR,FALSE,TRUE,FALSE,9f23c07a81e61778aec746491fd05e22,/down/originals/2016-1/51421_2015.pdf,912b1ac377993854fcd86a8f314dc18d,TRUE,4,NA,Manifesto 2015. Stronger Economy. Fairer Society. Opportunity for Everyone.,FALSE,51421_201505
"We have made progress in government, for the first time providing probation support for offenders serving sentences of less than twelve months.",605,NA,1556,51421,201505,english,MARPOR,FALSE,TRUE,FALSE,9f23c07a81e61778aec746491fd05e22,/down/originals/2016-1/51421_2015.pdf,912b1ac377993854fcd86a8f314dc18d,TRUE,4,NA,Manifesto 2015. Stronger Economy. Fairer Society. Opportunity for Everyone.,FALSE,51421_201505
"Yet still, far too many people are simply warehoused in prison, instead of learning skills that will enable them to earn an honest living when they are released.",000,NA,1557,51421,201505,english,MARPOR,FALSE,TRUE,FALSE,9f23c07a81e61778aec746491fd05e22,/down/originals/2016-1/51421_2015.pdf,912b1ac377993854fcd86a8f314dc18d,TRUE,4,NA,Manifesto 2015. Stronger Economy. Fairer Society. Opportunity for Everyone.,FALSE,51421_201505
"We believe that a large prison population is a sign of failure to rehabilitate, not a sign of success.",000,NA,1558,51421,201505,english,MARPOR,FALSE,TRUE,FALSE,9f23c07a81e61778aec746491fd05e22,/down/originals/2016-1/51421_2015.pdf,912b1ac377993854fcd86a8f314dc18d,TRUE,4,NA,Manifesto 2015. Stronger Economy. Fairer Society. Opportunity for Everyone.,FALSE,51421_201505
So our aim is to significantly reduce the prison population by using more effective alternative punishments and correcting offending behaviour.,605,NA,1559,51421,201505,english,MARPOR,FALSE,TRUE,FALSE,9f23c07a81e61778aec746491fd05e22,/down/originals/2016-1/51421_2015.pdf,912b1ac377993854fcd86a8f314dc18d,TRUE,4,NA,Manifesto 2015. Stronger Economy. Fairer Society. Opportunity for Everyone.,FALSE,51421_201505
"We will: Prioritise prison for dangerous offenders and those who commit the most serious offences with increased use of tough non-custodial punishments including weekend or evening custody, curfews, unpaid work in the community and GPS tagging.",605,NA,1560,51421,201505,english,MARPOR,FALSE,TRUE,FALSE,9f23c07a81e61778aec746491fd05e22,/down/originals/2016-1/51421_2015.pdf,912b1ac377993854fcd86a8f314dc18d,TRUE,4,NA,Manifesto 2015. Stronger Economy. Fairer Society. Opportunity for Everyone.,FALSE,51421_201505
This will enable us to introduce a presumption against short-term sentences that will help reduce the prison population and cut crime.,605,NA,1561,51421,201505,english,MARPOR,FALSE,TRUE,FALSE,9f23c07a81e61778aec746491fd05e22,/down/originals/2016-1/51421_2015.pdf,912b1ac377993854fcd86a8f314dc18d,TRUE,4,NA,Manifesto 2015. Stronger Economy. Fairer Society. Opportunity for Everyone.,FALSE,51421_201505
Promote Community Justice Panels and other local schemes designed to stop problems from escalating.,605,NA,1562,51421,201505,english,MARPOR,FALSE,TRUE,FALSE,9f23c07a81e61778aec746491fd05e22,/down/originals/2016-1/51421_2015.pdf,912b1ac377993854fcd86a8f314dc18d,TRUE,4,NA,Manifesto 2015. Stronger Economy. Fairer Society. Opportunity for Everyone.,FALSE,51421_201505
"Extend the role of the Youth Justice Board to all offenders aged under 21,",000,NA,1563,51421,201505,english,MARPOR,FALSE,TRUE,FALSE,9f23c07a81e61778aec746491fd05e22,/down/originals/2016-1/51421_2015.pdf,912b1ac377993854fcd86a8f314dc18d,TRUE,4,NA,Manifesto 2015. Stronger Economy. Fairer Society. Opportunity for Everyone.,FALSE,51421_201505
give them the power to commission mental health services,000,NA,1564,51421,201505,english,MARPOR,FALSE,TRUE,FALSE,9f23c07a81e61778aec746491fd05e22,/down/originals/2016-1/51421_2015.pdf,912b1ac377993854fcd86a8f314dc18d,TRUE,4,NA,Manifesto 2015. Stronger Economy. Fairer Society. Opportunity for Everyone.,FALSE,51421_201505
and devolve youth custody budgets to Local Authorities.,301,NA,1565,51421,201505,english,MARPOR,FALSE,TRUE,FALSE,9f23c07a81e61778aec746491fd05e22,/down/originals/2016-1/51421_2015.pdf,912b1ac377993854fcd86a8f314dc18d,TRUE,4,NA,Manifesto 2015. Stronger Economy. Fairer Society. Opportunity for Everyone.,FALSE,51421_201505
"Create a Women’s Justice Board, modelled on the Youth Justice Board, to improve rehabilitation of female offenders.",000,NA,1566,51421,201505,english,MARPOR,FALSE,TRUE,FALSE,9f23c07a81e61778aec746491fd05e22,/down/originals/2016-1/51421_2015.pdf,912b1ac377993854fcd86a8f314dc18d,TRUE,4,NA,Manifesto 2015. Stronger Economy. Fairer Society. Opportunity for Everyone.,FALSE,51421_201505
"Reform prisons so they become places of work, rehabilitation and learning, with offenders receiving an education and skills assessment within one week, starting a relevant course and programme of support within one month and able to complete courses on release.",000,NA,1567,51421,201505,english,MARPOR,FALSE,TRUE,FALSE,9f23c07a81e61778aec746491fd05e22,/down/originals/2016-1/51421_2015.pdf,912b1ac377993854fcd86a8f314dc18d,TRUE,4,NA,Manifesto 2015. Stronger Economy. Fairer Society. Opportunity for Everyone.,FALSE,51421_201505
Improve prison governance and accountability,303,NA,1568,51421,201505,english,MARPOR,FALSE,TRUE,FALSE,9f23c07a81e61778aec746491fd05e22,/down/originals/2016-1/51421_2015.pdf,912b1ac377993854fcd86a8f314dc18d,TRUE,4,NA,Manifesto 2015. Stronger Economy. Fairer Society. Opportunity for Everyone.,FALSE,51421_201505
"with a new value added measure to assess progress in reducing reoffending, providing education and tackling addiction and mental health issues,",000,NA,1569,51421,201505,english,MARPOR,FALSE,TRUE,FALSE,9f23c07a81e61778aec746491fd05e22,/down/originals/2016-1/51421_2015.pdf,912b1ac377993854fcd86a8f314dc18d,TRUE,4,NA,Manifesto 2015. Stronger Economy. Fairer Society. Opportunity for Everyone.,FALSE,51421_201505
enabling good prisons to earn greater autonomy.,301,NA,1570,51421,201505,english,MARPOR,FALSE,TRUE,FALSE,9f23c07a81e61778aec746491fd05e22,/down/originals/2016-1/51421_2015.pdf,912b1ac377993854fcd86a8f314dc18d,TRUE,4,NA,Manifesto 2015. Stronger Economy. Fairer Society. Opportunity for Everyone.,FALSE,51421_201505
We will strengthen the independence of the Chief Inspectors of Prisons and Probation.,303,NA,1571,51421,201505,english,MARPOR,FALSE,TRUE,FALSE,9f23c07a81e61778aec746491fd05e22,/down/originals/2016-1/51421_2015.pdf,912b1ac377993854fcd86a8f314dc18d,TRUE,4,NA,Manifesto 2015. Stronger Economy. Fairer Society. Opportunity for Everyone.,FALSE,51421_201505
Provide experts in courts and police stations to identify where mental health or a drug problem is behind an offender’s behaviour so they can be dealt with in a way that is appropriate.,000,NA,1572,51421,201505,english,MARPOR,FALSE,TRUE,FALSE,9f23c07a81e61778aec746491fd05e22,/down/originals/2016-1/51421_2015.pdf,912b1ac377993854fcd86a8f314dc18d,TRUE,4,NA,Manifesto 2015. Stronger Economy. Fairer Society. Opportunity for Everyone.,FALSE,51421_201505
We will pilot US-style drug and alcohol courts.,000,NA,1573,51421,201505,english,MARPOR,FALSE,TRUE,FALSE,9f23c07a81e61778aec746491fd05e22,/down/originals/2016-1/51421_2015.pdf,912b1ac377993854fcd86a8f314dc18d,TRUE,4,NA,Manifesto 2015. Stronger Economy. Fairer Society. Opportunity for Everyone.,FALSE,51421_201505
Strengthen the ‘realistic prospect of custody’ test to reduce the use of remand for suspected offenders who can be safely monitored in the community and are unlikely to receive a prison sentence if found guilty.,503,NA,1574,51421,201505,english,MARPOR,FALSE,TRUE,FALSE,9f23c07a81e61778aec746491fd05e22,/down/originals/2016-1/51421_2015.pdf,912b1ac377993854fcd86a8f314dc18d,TRUE,4,NA,Manifesto 2015. Stronger Economy. Fairer Society. Opportunity for Everyone.,FALSE,51421_201505
"Liberal Democrats will adopt the default position that – unless there are strong reasons to the contrary in specific cases – public servants rather than commercial organisations should provide detention, prison, immigration enforcement and secure units.",413,NA,1575,51421,201505,english,MARPOR,FALSE,TRUE,FALSE,9f23c07a81e61778aec746491fd05e22,/down/originals/2016-1/51421_2015.pdf,912b1ac377993854fcd86a8f314dc18d,TRUE,4,NA,Manifesto 2015. Stronger Economy. Fairer Society. Opportunity for Everyone.,FALSE,51421_201505
9.6 Ensuring access to justice,NA,NA,1576,51421,201505,english,MARPOR,FALSE,TRUE,FALSE,9f23c07a81e61778aec746491fd05e22,/down/originals/2016-1/51421_2015.pdf,912b1ac377993854fcd86a8f314dc18d,TRUE,4,NA,Manifesto 2015. Stronger Economy. Fairer Society. Opportunity for Everyone.,FALSE,51421_201505
Access to justice is an essential part of a free society and a functioning legal system.,202,NA,1577,51421,201505,english,MARPOR,FALSE,TRUE,FALSE,9f23c07a81e61778aec746491fd05e22,/down/originals/2016-1/51421_2015.pdf,912b1ac377993854fcd86a8f314dc18d,TRUE,4,NA,Manifesto 2015. Stronger Economy. Fairer Society. Opportunity for Everyone.,FALSE,51421_201505
"In this Parliament we have had to make significant savings from the Legal Aid budget,",414,NA,1578,51421,201505,english,MARPOR,FALSE,TRUE,FALSE,9f23c07a81e61778aec746491fd05e22,/down/originals/2016-1/51421_2015.pdf,912b1ac377993854fcd86a8f314dc18d,TRUE,4,NA,Manifesto 2015. Stronger Economy. Fairer Society. Opportunity for Everyone.,FALSE,51421_201505
"but in the next Parliament our priority for delivering efficiency in the Ministry of Justice should be prison and court reform, using technology and innovation to reduce costs.",303,NA,1579,51421,201505,english,MARPOR,FALSE,TRUE,FALSE,9f23c07a81e61778aec746491fd05e22,/down/originals/2016-1/51421_2015.pdf,912b1ac377993854fcd86a8f314dc18d,TRUE,4,NA,Manifesto 2015. Stronger Economy. Fairer Society. Opportunity for Everyone.,FALSE,51421_201505
We will: Review the criminal Legal Aid market and ensure there are no further savings without an impact assessment as to the viability of competitive and diverse market of Legal Aid providers.,303,NA,1580,51421,201505,english,MARPOR,FALSE,TRUE,FALSE,9f23c07a81e61778aec746491fd05e22,/down/originals/2016-1/51421_2015.pdf,912b1ac377993854fcd86a8f314dc18d,TRUE,4,NA,Manifesto 2015. Stronger Economy. Fairer Society. Opportunity for Everyone.,FALSE,51421_201505
Reduce pressure on the criminal Legal Aid budget by requiring company directors to take out insurance against prosecution for fraud and permitting the use of restrained assets to pay reasonable legal bills.,303,NA,1581,51421,201505,english,MARPOR,FALSE,TRUE,FALSE,9f23c07a81e61778aec746491fd05e22,/down/originals/2016-1/51421_2015.pdf,912b1ac377993854fcd86a8f314dc18d,TRUE,4,NA,Manifesto 2015. Stronger Economy. Fairer Society. Opportunity for Everyone.,FALSE,51421_201505
"Carry out an immediate review of civil Legal Aid, judicial review and court fees, in consultation with the judiciary, to ensure Legal Aid is available to all those who need it,",201,NA,1582,51421,201505,english,MARPOR,FALSE,TRUE,FALSE,9f23c07a81e61778aec746491fd05e22,/down/originals/2016-1/51421_2015.pdf,912b1ac377993854fcd86a8f314dc18d,TRUE,4,NA,Manifesto 2015. Stronger Economy. Fairer Society. Opportunity for Everyone.,FALSE,51421_201505
that those of modest means can bring applications for judicial review of allegedly unlawful government action,201,NA,1583,51421,201505,english,MARPOR,FALSE,TRUE,FALSE,9f23c07a81e61778aec746491fd05e22,/down/originals/2016-1/51421_2015.pdf,912b1ac377993854fcd86a8f314dc18d,TRUE,4,NA,Manifesto 2015. Stronger Economy. Fairer Society. Opportunity for Everyone.,FALSE,51421_201505
and that court and tribunal fees will not put justice beyond the reach of those who seek it.,201,NA,1584,51421,201505,english,MARPOR,FALSE,TRUE,FALSE,9f23c07a81e61778aec746491fd05e22,/down/originals/2016-1/51421_2015.pdf,912b1ac377993854fcd86a8f314dc18d,TRUE,4,NA,Manifesto 2015. Stronger Economy. Fairer Society. Opportunity for Everyone.,FALSE,51421_201505
"This will mean reversing any recent rises in up-front court fees that make justice unaffordable for many, and instead spreading the fee burden more fairly.",201,NA,1585,51421,201505,english,MARPOR,FALSE,TRUE,FALSE,9f23c07a81e61778aec746491fd05e22,/down/originals/2016-1/51421_2015.pdf,912b1ac377993854fcd86a8f314dc18d,TRUE,4,NA,Manifesto 2015. Stronger Economy. Fairer Society. Opportunity for Everyone.,FALSE,51421_201505
Retain access to recoverable success fees and insurance premiums in asbestosis claims,201,NA,1586,51421,201505,english,MARPOR,FALSE,TRUE,FALSE,9f23c07a81e61778aec746491fd05e22,/down/originals/2016-1/51421_2015.pdf,912b1ac377993854fcd86a8f314dc18d,TRUE,4,NA,Manifesto 2015. Stronger Economy. Fairer Society. Opportunity for Everyone.,FALSE,51421_201505
and where an individual is suing the police;,201,NA,1587,51421,201505,english,MARPOR,FALSE,TRUE,FALSE,9f23c07a81e61778aec746491fd05e22,/down/originals/2016-1/51421_2015.pdf,912b1ac377993854fcd86a8f314dc18d,TRUE,4,NA,Manifesto 2015. Stronger Economy. Fairer Society. Opportunity for Everyone.,FALSE,51421_201505
"and also for both claimant and defendant in publication and data protection claims, except where one party is significantly better resourced than the other.",201,NA,1588,51421,201505,english,MARPOR,FALSE,TRUE,FALSE,9f23c07a81e61778aec746491fd05e22,/down/originals/2016-1/51421_2015.pdf,912b1ac377993854fcd86a8f314dc18d,TRUE,4,NA,Manifesto 2015. Stronger Economy. Fairer Society. Opportunity for Everyone.,FALSE,51421_201505
Promote the use of alternative buildings for magistrates’ courts and local dispute resolution programmes like Community Justice Panels to bring justice back into the community.,606,NA,1589,51421,201505,english,MARPOR,FALSE,TRUE,FALSE,9f23c07a81e61778aec746491fd05e22,/down/originals/2016-1/51421_2015.pdf,912b1ac377993854fcd86a8f314dc18d,TRUE,4,NA,Manifesto 2015. Stronger Economy. Fairer Society. Opportunity for Everyone.,FALSE,51421_201505
Support innovation like the provision of civil justice online and expansion of alternative dispute resolution procedures.,606,NA,1590,51421,201505,english,MARPOR,FALSE,TRUE,FALSE,9f23c07a81e61778aec746491fd05e22,/down/originals/2016-1/51421_2015.pdf,912b1ac377993854fcd86a8f314dc18d,TRUE,4,NA,Manifesto 2015. Stronger Economy. Fairer Society. Opportunity for Everyone.,FALSE,51421_201505
"Encourage the widespread use of mediation for separating couples, while protecting access to the family courts where necessary",000,NA,1591,51421,201505,english,MARPOR,FALSE,TRUE,FALSE,9f23c07a81e61778aec746491fd05e22,/down/originals/2016-1/51421_2015.pdf,912b1ac377993854fcd86a8f314dc18d,TRUE,4,NA,Manifesto 2015. Stronger Economy. Fairer Society. Opportunity for Everyone.,FALSE,51421_201505
"Develop a strategy that will deliver advice and legal support to help people with everyday problems like personal debt and social welfare issues, working across government and involving non-profit advice agencies.",503,NA,1592,51421,201505,english,MARPOR,FALSE,TRUE,FALSE,9f23c07a81e61778aec746491fd05e22,/down/originals/2016-1/51421_2015.pdf,912b1ac377993854fcd86a8f314dc18d,TRUE,4,NA,Manifesto 2015. Stronger Economy. Fairer Society. Opportunity for Everyone.,FALSE,51421_201505
9.7 Tackling terrorism and violent extremism,NA,NA,1593,51421,201505,english,MARPOR,FALSE,TRUE,FALSE,9f23c07a81e61778aec746491fd05e22,/down/originals/2016-1/51421_2015.pdf,912b1ac377993854fcd86a8f314dc18d,TRUE,4,NA,Manifesto 2015. Stronger Economy. Fairer Society. Opportunity for Everyone.,FALSE,51421_201505
"Terrorism and violent extremism remain a serious threat to the United Kingdom, which requires a proportionate response.",605,NA,1594,51421,201505,english,MARPOR,FALSE,TRUE,FALSE,9f23c07a81e61778aec746491fd05e22,/down/originals/2016-1/51421_2015.pdf,912b1ac377993854fcd86a8f314dc18d,TRUE,4,NA,Manifesto 2015. Stronger Economy. Fairer Society. Opportunity for Everyone.,FALSE,51421_201505
"We will: Work with religious and community leaders, civil society groups and social media sites to counter the narratives put forward by extremists,",606,NA,1595,51421,201505,english,MARPOR,FALSE,TRUE,FALSE,9f23c07a81e61778aec746491fd05e22,/down/originals/2016-1/51421_2015.pdf,912b1ac377993854fcd86a8f314dc18d,TRUE,4,NA,Manifesto 2015. Stronger Economy. Fairer Society. Opportunity for Everyone.,FALSE,51421_201505
