text,cmp_code,eu_code,pos,party,date,language,source,has_eu_code,is_primary_doc,may_contradict_core_dataset,md5sum_text,url_original,md5sum_original,annotations,handbook,is_copy_of,title,translation_en,id
"Once we have got Brexit done, we will free our farmers from the bureaucratic Common Agricultural Policy and move to a system based on ‘public money for public goods’.",110,NA,944,51620,201912,english,MARPOR,FALSE,TRUE,FALSE,c5dacb307705350e33bd4ad598eb8010,/down/originals/2020-1/51620_2019.pdf,2352aedf22264cd0db0c2d2495b2238b,TRUE,5,NA,Get Brexit done. Unleash Britain's potential,FALSE,51620_201912
"To support this transition, we will guarantee the current annual budget to farmers in every year of the next Parliament.",703.1,NA,945,51620,201912,english,MARPOR,FALSE,TRUE,FALSE,c5dacb307705350e33bd4ad598eb8010,/down/originals/2020-1/51620_2019.pdf,2352aedf22264cd0db0c2d2495b2238b,TRUE,5,NA,Get Brexit done. Unleash Britain's potential,FALSE,51620_201912
"In return for funding, they must farm in a way that protects and enhances our natural environment,",501,NA,946,51620,201912,english,MARPOR,FALSE,TRUE,FALSE,c5dacb307705350e33bd4ad598eb8010,/down/originals/2020-1/51620_2019.pdf,2352aedf22264cd0db0c2d2495b2238b,TRUE,5,NA,Get Brexit done. Unleash Britain's potential,FALSE,51620_201912
as well as safeguarding high standards of animal welfare.,501,NA,947,51620,201912,english,MARPOR,FALSE,TRUE,FALSE,c5dacb307705350e33bd4ad598eb8010,/down/originals/2020-1/51620_2019.pdf,2352aedf22264cd0db0c2d2495b2238b,TRUE,5,NA,Get Brexit done. Unleash Britain's potential,FALSE,51620_201912
"When we leave the EU, we will be able to encourage the public sector to ‘Buy British’ to support our farmers by investing in clusters around world-leading universities and spreading knowledge.",406,NA,948,51620,201912,english,MARPOR,FALSE,TRUE,FALSE,c5dacb307705350e33bd4ad598eb8010,/down/originals/2020-1/51620_2019.pdf,2352aedf22264cd0db0c2d2495b2238b,TRUE,5,NA,Get Brexit done. Unleash Britain's potential,FALSE,51620_201912
and reduce environmental costs.,501,NA,949,51620,201912,english,MARPOR,FALSE,TRUE,FALSE,c5dacb307705350e33bd4ad598eb8010,/down/originals/2020-1/51620_2019.pdf,2352aedf22264cd0db0c2d2495b2238b,TRUE,5,NA,Get Brexit done. Unleash Britain's potential,FALSE,51620_201912
"We will increase the annual quota for the Seasonal Agricultural Workers Scheme we are piloting from 2,500 to 10,000.",703.1,NA,950,51620,201912,english,MARPOR,FALSE,TRUE,FALSE,c5dacb307705350e33bd4ad598eb8010,/down/originals/2020-1/51620_2019.pdf,2352aedf22264cd0db0c2d2495b2238b,TRUE,5,NA,Get Brexit done. Unleash Britain's potential,FALSE,51620_201912
A post-Brexit deal for fisheries,H,NA,951,51620,201912,english,MARPOR,FALSE,TRUE,FALSE,c5dacb307705350e33bd4ad598eb8010,/down/originals/2020-1/51620_2019.pdf,2352aedf22264cd0db0c2d2495b2238b,TRUE,5,NA,Get Brexit done. Unleash Britain's potential,FALSE,51620_201912
"Upon leaving the EU, we will leave the Common Fisheries Policy, becoming an independent coastal state and taking back control of our waters.",406,NA,952,51620,201912,english,MARPOR,FALSE,TRUE,FALSE,c5dacb307705350e33bd4ad598eb8010,/down/originals/2020-1/51620_2019.pdf,2352aedf22264cd0db0c2d2495b2238b,TRUE,5,NA,Get Brexit done. Unleash Britain's potential,FALSE,51620_201912
We will maintain funding for fisheries across the UK’s nations throughout the Parliament,406,NA,953,51620,201912,english,MARPOR,FALSE,TRUE,FALSE,c5dacb307705350e33bd4ad598eb8010,/down/originals/2020-1/51620_2019.pdf,2352aedf22264cd0db0c2d2495b2238b,TRUE,5,NA,Get Brexit done. Unleash Britain's potential,FALSE,51620_201912
and support the regeneration of our coastal communities.,406,NA,954,51620,201912,english,MARPOR,FALSE,TRUE,FALSE,c5dacb307705350e33bd4ad598eb8010,/down/originals/2020-1/51620_2019.pdf,2352aedf22264cd0db0c2d2495b2238b,TRUE,5,NA,Get Brexit done. Unleash Britain's potential,FALSE,51620_201912
There will be a legal commitment to fish sustainably,416.2,NA,955,51620,201912,english,MARPOR,FALSE,TRUE,FALSE,c5dacb307705350e33bd4ad598eb8010,/down/originals/2020-1/51620_2019.pdf,2352aedf22264cd0db0c2d2495b2238b,TRUE,5,NA,Get Brexit done. Unleash Britain's potential,FALSE,51620_201912
and a legal requirement for a plan to achieve maximum sustainable yield for each stock.,416.2,NA,956,51620,201912,english,MARPOR,FALSE,TRUE,FALSE,c5dacb307705350e33bd4ad598eb8010,/down/originals/2020-1/51620_2019.pdf,2352aedf22264cd0db0c2d2495b2238b,TRUE,5,NA,Get Brexit done. Unleash Britain's potential,FALSE,51620_201912
Support rural life and coastal communities,H,NA,957,51620,201912,english,MARPOR,FALSE,TRUE,FALSE,c5dacb307705350e33bd4ad598eb8010,/down/originals/2020-1/51620_2019.pdf,2352aedf22264cd0db0c2d2495b2238b,TRUE,5,NA,Get Brexit done. Unleash Britain's potential,FALSE,51620_201912
"Even as the UK forges ahead in the future, we must not forget those communities that have not shared fully in the growth generated by our economy.",503,NA,958,51620,201912,english,MARPOR,FALSE,TRUE,FALSE,c5dacb307705350e33bd4ad598eb8010,/down/originals/2020-1/51620_2019.pdf,2352aedf22264cd0db0c2d2495b2238b,TRUE,5,NA,Get Brexit done. Unleash Britain's potential,FALSE,51620_201912
This Government is committed to levelling up all parts of the United Kingdom,503,NA,959,51620,201912,english,MARPOR,FALSE,TRUE,FALSE,c5dacb307705350e33bd4ad598eb8010,/down/originals/2020-1/51620_2019.pdf,2352aedf22264cd0db0c2d2495b2238b,TRUE,5,NA,Get Brexit done. Unleash Britain's potential,FALSE,51620_201912
"– and getting Brexit done will enable us to give new support to people in rural and coastal communities,",503,NA,960,51620,201912,english,MARPOR,FALSE,TRUE,FALSE,c5dacb307705350e33bd4ad598eb8010,/down/originals/2020-1/51620_2019.pdf,2352aedf22264cd0db0c2d2495b2238b,TRUE,5,NA,Get Brexit done. Unleash Britain's potential,FALSE,51620_201912
and for our farming and fishing industries.,703.1,NA,961,51620,201912,english,MARPOR,FALSE,TRUE,FALSE,c5dacb307705350e33bd4ad598eb8010,/down/originals/2020-1/51620_2019.pdf,2352aedf22264cd0db0c2d2495b2238b,TRUE,5,NA,Get Brexit done. Unleash Britain's potential,FALSE,51620_201912
We intend to make their lives much easier.,703.1,NA,962,51620,201912,english,MARPOR,FALSE,TRUE,FALSE,c5dacb307705350e33bd4ad598eb8010,/down/originals/2020-1/51620_2019.pdf,2352aedf22264cd0db0c2d2495b2238b,TRUE,5,NA,Get Brexit done. Unleash Britain's potential,FALSE,51620_201912
"We want to roll out gigabit broadband across the country by 2025, with £5 billion in funding already promised,",411,NA,963,51620,201912,english,MARPOR,FALSE,TRUE,FALSE,c5dacb307705350e33bd4ad598eb8010,/down/originals/2020-1/51620_2019.pdf,2352aedf22264cd0db0c2d2495b2238b,TRUE,5,NA,Get Brexit done. Unleash Britain's potential,FALSE,51620_201912
and provide greater mobile coverage across the country.,411,NA,964,51620,201912,english,MARPOR,FALSE,TRUE,FALSE,c5dacb307705350e33bd4ad598eb8010,/down/originals/2020-1/51620_2019.pdf,2352aedf22264cd0db0c2d2495b2238b,TRUE,5,NA,Get Brexit done. Unleash Britain's potential,FALSE,51620_201912
We will use our additional police resources to tackle rural crime.,605.1,NA,965,51620,201912,english,MARPOR,FALSE,TRUE,FALSE,c5dacb307705350e33bd4ad598eb8010,/down/originals/2020-1/51620_2019.pdf,2352aedf22264cd0db0c2d2495b2238b,TRUE,5,NA,Get Brexit done. Unleash Britain's potential,FALSE,51620_201912
"For areas – such as some coastal towns – which have historically been poorly served in terms of education and public services (among much else), we will cement our Opportunity Areas programme to raise standards and support regeneration.",410,NA,966,51620,201912,english,MARPOR,FALSE,TRUE,FALSE,c5dacb307705350e33bd4ad598eb8010,/down/originals/2020-1/51620_2019.pdf,2352aedf22264cd0db0c2d2495b2238b,TRUE,5,NA,Get Brexit done. Unleash Britain's potential,FALSE,51620_201912
"We will also invest in the bus network to improve infrequent or non-existent services in the countryside, including more on-demand services",411,NA,967,51620,201912,english,MARPOR,FALSE,TRUE,FALSE,c5dacb307705350e33bd4ad598eb8010,/down/originals/2020-1/51620_2019.pdf,2352aedf22264cd0db0c2d2495b2238b,TRUE,5,NA,Get Brexit done. Unleash Britain's potential,FALSE,51620_201912
"Just as in the wider economy we can combine strong employment growth with high employment standards,",701,NA,968,51620,201912,english,MARPOR,FALSE,TRUE,FALSE,c5dacb307705350e33bd4ad598eb8010,/down/originals/2020-1/51620_2019.pdf,2352aedf22264cd0db0c2d2495b2238b,TRUE,5,NA,Get Brexit done. Unleash Britain's potential,FALSE,51620_201912
so we believe that British farmers and fishermen should be able to profit by producing food and fish that are the envy of the world – both for their quality and the high standards to which they were produced.,703.1,NA,969,51620,201912,english,MARPOR,FALSE,TRUE,FALSE,c5dacb307705350e33bd4ad598eb8010,/down/originals/2020-1/51620_2019.pdf,2352aedf22264cd0db0c2d2495b2238b,TRUE,5,NA,Get Brexit done. Unleash Britain's potential,FALSE,51620_201912
"We want people, both at home and abroad, to be lining up to buy British.",601.1,NA,970,51620,201912,english,MARPOR,FALSE,TRUE,FALSE,c5dacb307705350e33bd4ad598eb8010,/down/originals/2020-1/51620_2019.pdf,2352aedf22264cd0db0c2d2495b2238b,TRUE,5,NA,Get Brexit done. Unleash Britain's potential,FALSE,51620_201912
"And one of the great opportunities of Brexit is the chance to lead the world in the quality of our food, agriculture and land management – driven by science-led, evidence-based policy.",601.1,NA,971,51620,201912,english,MARPOR,FALSE,TRUE,FALSE,c5dacb307705350e33bd4ad598eb8010,/down/originals/2020-1/51620_2019.pdf,2352aedf22264cd0db0c2d2495b2238b,TRUE,5,NA,Get Brexit done. Unleash Britain's potential,FALSE,51620_201912
"And we want those same farmers and fishermen to act as the stewards of the natural world, preserving the UK’s countryside and oceans as they have for generations.",501,NA,972,51620,201912,english,MARPOR,FALSE,TRUE,FALSE,c5dacb307705350e33bd4ad598eb8010,/down/originals/2020-1/51620_2019.pdf,2352aedf22264cd0db0c2d2495b2238b,TRUE,5,NA,Get Brexit done. Unleash Britain's potential,FALSE,51620_201912
Stewards of our environment,H,NA,973,51620,201912,english,MARPOR,FALSE,TRUE,FALSE,c5dacb307705350e33bd4ad598eb8010,/down/originals/2020-1/51620_2019.pdf,2352aedf22264cd0db0c2d2495b2238b,TRUE,5,NA,Get Brexit done. Unleash Britain's potential,FALSE,51620_201912
Our Environment Bill will guarantee that we will protect and restore our natural environment after leaving the EU.,501,NA,974,51620,201912,english,MARPOR,FALSE,TRUE,FALSE,c5dacb307705350e33bd4ad598eb8010,/down/originals/2020-1/51620_2019.pdf,2352aedf22264cd0db0c2d2495b2238b,TRUE,5,NA,Get Brexit done. Unleash Britain's potential,FALSE,51620_201912
Because conservation has always been at the very heart of Conservatism.,501,NA,975,51620,201912,english,MARPOR,FALSE,TRUE,FALSE,c5dacb307705350e33bd4ad598eb8010,/down/originals/2020-1/51620_2019.pdf,2352aedf22264cd0db0c2d2495b2238b,TRUE,5,NA,Get Brexit done. Unleash Britain's potential,FALSE,51620_201912
We will set up a new independent Office For Environmental Protection,501,NA,976,51620,201912,english,MARPOR,FALSE,TRUE,FALSE,c5dacb307705350e33bd4ad598eb8010,/down/originals/2020-1/51620_2019.pdf,2352aedf22264cd0db0c2d2495b2238b,TRUE,5,NA,Get Brexit done. Unleash Britain's potential,FALSE,51620_201912
"and introduce our own legal targets, including for air quality.",501,NA,977,51620,201912,english,MARPOR,FALSE,TRUE,FALSE,c5dacb307705350e33bd4ad598eb8010,/down/originals/2020-1/51620_2019.pdf,2352aedf22264cd0db0c2d2495b2238b,TRUE,5,NA,Get Brexit done. Unleash Britain's potential,FALSE,51620_201912
"We will invest in nature, helping us to reach our Net Zero target with a £640 million new Nature for Climate fund.",501,NA,978,51620,201912,english,MARPOR,FALSE,TRUE,FALSE,c5dacb307705350e33bd4ad598eb8010,/down/originals/2020-1/51620_2019.pdf,2352aedf22264cd0db0c2d2495b2238b,TRUE,5,NA,Get Brexit done. Unleash Britain's potential,FALSE,51620_201912
"Building on our support for creating a Great Northumberland Forest, we will reach an additional 75,000 acres of trees a year by the end of the next Parliament,",501,NA,979,51620,201912,english,MARPOR,FALSE,TRUE,FALSE,c5dacb307705350e33bd4ad598eb8010,/down/originals/2020-1/51620_2019.pdf,2352aedf22264cd0db0c2d2495b2238b,TRUE,5,NA,Get Brexit done. Unleash Britain's potential,FALSE,51620_201912
as well as restoring our peatland.,501,NA,980,51620,201912,english,MARPOR,FALSE,TRUE,FALSE,c5dacb307705350e33bd4ad598eb8010,/down/originals/2020-1/51620_2019.pdf,2352aedf22264cd0db0c2d2495b2238b,TRUE,5,NA,Get Brexit done. Unleash Britain's potential,FALSE,51620_201912
"We welcome the Glover Review and will create new National Parks and Areas of Outstanding Natural Beauty,",501,NA,981,51620,201912,english,MARPOR,FALSE,TRUE,FALSE,c5dacb307705350e33bd4ad598eb8010,/down/originals/2020-1/51620_2019.pdf,2352aedf22264cd0db0c2d2495b2238b,TRUE,5,NA,Get Brexit done. Unleash Britain's potential,FALSE,51620_201912
"as well as making our most loved landscapes greener, happier, healthier and open to all.",501,NA,982,51620,201912,english,MARPOR,FALSE,TRUE,FALSE,c5dacb307705350e33bd4ad598eb8010,/down/originals/2020-1/51620_2019.pdf,2352aedf22264cd0db0c2d2495b2238b,TRUE,5,NA,Get Brexit done. Unleash Britain's potential,FALSE,51620_201912
We will make the coast to coast path across the most beautiful areas of the North a National Trail.,501,NA,983,51620,201912,english,MARPOR,FALSE,TRUE,FALSE,c5dacb307705350e33bd4ad598eb8010,/down/originals/2020-1/51620_2019.pdf,2352aedf22264cd0db0c2d2495b2238b,TRUE,5,NA,Get Brexit done. Unleash Britain's potential,FALSE,51620_201912
"We will continue to lead the world in tackling plastics pollution, both in the UK and internationally,",501,NA,984,51620,201912,english,MARPOR,FALSE,TRUE,FALSE,c5dacb307705350e33bd4ad598eb8010,/down/originals/2020-1/51620_2019.pdf,2352aedf22264cd0db0c2d2495b2238b,TRUE,5,NA,Get Brexit done. Unleash Britain's potential,FALSE,51620_201912
and will introduce a new levy to increase the proportion of recyclable plastics in packaging.,501,NA,985,51620,201912,english,MARPOR,FALSE,TRUE,FALSE,c5dacb307705350e33bd4ad598eb8010,/down/originals/2020-1/51620_2019.pdf,2352aedf22264cd0db0c2d2495b2238b,TRUE,5,NA,Get Brexit done. Unleash Britain's potential,FALSE,51620_201912
"We will introduce extended producer responsibility, so that producers pay the full costs of dealing with the waste they produce,",403,NA,986,51620,201912,english,MARPOR,FALSE,TRUE,FALSE,c5dacb307705350e33bd4ad598eb8010,/down/originals/2020-1/51620_2019.pdf,2352aedf22264cd0db0c2d2495b2238b,TRUE,5,NA,Get Brexit done. Unleash Britain's potential,FALSE,51620_201912
and boost domestic recycling.,501,NA,987,51620,201912,english,MARPOR,FALSE,TRUE,FALSE,c5dacb307705350e33bd4ad598eb8010,/down/originals/2020-1/51620_2019.pdf,2352aedf22264cd0db0c2d2495b2238b,TRUE,5,NA,Get Brexit done. Unleash Britain's potential,FALSE,51620_201912
"We will ban the export of plastic waste to non-OECD countries, consulting with industry, NGOs and local councils on the date by which this should be achieved.",403,NA,988,51620,201912,english,MARPOR,FALSE,TRUE,FALSE,c5dacb307705350e33bd4ad598eb8010,/down/originals/2020-1/51620_2019.pdf,2352aedf22264cd0db0c2d2495b2238b,TRUE,5,NA,Get Brexit done. Unleash Britain's potential,FALSE,51620_201912
We will crack down on the waste and carelessness that destroys our natural environment and kills marine life.,501,NA,989,51620,201912,english,MARPOR,FALSE,TRUE,FALSE,c5dacb307705350e33bd4ad598eb8010,/down/originals/2020-1/51620_2019.pdf,2352aedf22264cd0db0c2d2495b2238b,TRUE,5,NA,Get Brexit done. Unleash Britain's potential,FALSE,51620_201912
"We will increase penalties for fly-tipping,",605.1,NA,990,51620,201912,english,MARPOR,FALSE,TRUE,FALSE,c5dacb307705350e33bd4ad598eb8010,/down/originals/2020-1/51620_2019.pdf,2352aedf22264cd0db0c2d2495b2238b,TRUE,5,NA,Get Brexit done. Unleash Britain's potential,FALSE,51620_201912
"make those on community sentences clean up their parks and streets,",501,NA,991,51620,201912,english,MARPOR,FALSE,TRUE,FALSE,c5dacb307705350e33bd4ad598eb8010,/down/originals/2020-1/51620_2019.pdf,2352aedf22264cd0db0c2d2495b2238b,TRUE,5,NA,Get Brexit done. Unleash Britain's potential,FALSE,51620_201912
and introduce a deposit return scheme to incentivise people to recycle plastic and glass.,403,NA,992,51620,201912,english,MARPOR,FALSE,TRUE,FALSE,c5dacb307705350e33bd4ad598eb8010,/down/originals/2020-1/51620_2019.pdf,2352aedf22264cd0db0c2d2495b2238b,TRUE,5,NA,Get Brexit done. Unleash Britain's potential,FALSE,51620_201912
We will make no changes to the Hunting Act.,000,NA,993,51620,201912,english,MARPOR,FALSE,TRUE,FALSE,c5dacb307705350e33bd4ad598eb8010,/down/originals/2020-1/51620_2019.pdf,2352aedf22264cd0db0c2d2495b2238b,TRUE,5,NA,Get Brexit done. Unleash Britain's potential,FALSE,51620_201912
Strengthen our Union,H,NA,994,51620,201912,english,MARPOR,FALSE,TRUE,FALSE,c5dacb307705350e33bd4ad598eb8010,/down/originals/2020-1/51620_2019.pdf,2352aedf22264cd0db0c2d2495b2238b,TRUE,5,NA,Get Brexit done. Unleash Britain's potential,FALSE,51620_201912
The United Kingdom is the most successful political and economic union in history.,601.1,NA,995,51620,201912,english,MARPOR,FALSE,TRUE,FALSE,c5dacb307705350e33bd4ad598eb8010,/down/originals/2020-1/51620_2019.pdf,2352aedf22264cd0db0c2d2495b2238b,TRUE,5,NA,Get Brexit done. Unleash Britain's potential,FALSE,51620_201912
"Together, England, Scotland, Wales and Northern Ireland are safer, stronger and more prosperous.",601.1,NA,996,51620,201912,english,MARPOR,FALSE,TRUE,FALSE,c5dacb307705350e33bd4ad598eb8010,/down/originals/2020-1/51620_2019.pdf,2352aedf22264cd0db0c2d2495b2238b,TRUE,5,NA,Get Brexit done. Unleash Britain's potential,FALSE,51620_201912
"For more than 300 years, our people have built this great country together.",601.1,NA,997,51620,201912,english,MARPOR,FALSE,TRUE,FALSE,c5dacb307705350e33bd4ad598eb8010,/down/originals/2020-1/51620_2019.pdf,2352aedf22264cd0db0c2d2495b2238b,TRUE,5,NA,Get Brexit done. Unleash Britain's potential,FALSE,51620_201912
And we believe our best days lie ahead.,601.1,NA,998,51620,201912,english,MARPOR,FALSE,TRUE,FALSE,c5dacb307705350e33bd4ad598eb8010,/down/originals/2020-1/51620_2019.pdf,2352aedf22264cd0db0c2d2495b2238b,TRUE,5,NA,Get Brexit done. Unleash Britain's potential,FALSE,51620_201912
"By getting Brexit done, we will deliver certainty so that all four nations of the UK can move on together.",203,NA,999,51620,201912,english,MARPOR,FALSE,TRUE,FALSE,c5dacb307705350e33bd4ad598eb8010,/down/originals/2020-1/51620_2019.pdf,2352aedf22264cd0db0c2d2495b2238b,TRUE,5,NA,Get Brexit done. Unleash Britain's potential,FALSE,51620_201912
"This will allow us to strengthen the Union, by making it our mission as a Government to work for the whole of the United Kingdom, delivering for all of its people wherever they live.",203,NA,1000,51620,201912,english,MARPOR,FALSE,TRUE,FALSE,c5dacb307705350e33bd4ad598eb8010,/down/originals/2020-1/51620_2019.pdf,2352aedf22264cd0db0c2d2495b2238b,TRUE,5,NA,Get Brexit done. Unleash Britain's potential,FALSE,51620_201912
Investing across the Union,H,NA,1001,51620,201912,english,MARPOR,FALSE,TRUE,FALSE,c5dacb307705350e33bd4ad598eb8010,/down/originals/2020-1/51620_2019.pdf,2352aedf22264cd0db0c2d2495b2238b,TRUE,5,NA,Get Brexit done. Unleash Britain's potential,FALSE,51620_201912
"UK Shared Prosperity Fund: The UK Shared Prosperity Fund will be used to bind together the whole of the United Kingdom, tackling inequality and deprivation in each of our four nations.",301,NA,1002,51620,201912,english,MARPOR,FALSE,TRUE,FALSE,c5dacb307705350e33bd4ad598eb8010,/down/originals/2020-1/51620_2019.pdf,2352aedf22264cd0db0c2d2495b2238b,TRUE,5,NA,Get Brexit done. Unleash Britain's potential,FALSE,51620_201912
It will replace the overly bureaucratic EU Structural Funds,110,NA,1003,51620,201912,english,MARPOR,FALSE,TRUE,FALSE,c5dacb307705350e33bd4ad598eb8010,/down/originals/2020-1/51620_2019.pdf,2352aedf22264cd0db0c2d2495b2238b,TRUE,5,NA,Get Brexit done. Unleash Britain's potential,FALSE,51620_201912
"– and not only be better targeted at the UK’s specific needs, but at a minimum match the size of those funds in each nation.",301,NA,1004,51620,201912,english,MARPOR,FALSE,TRUE,FALSE,c5dacb307705350e33bd4ad598eb8010,/down/originals/2020-1/51620_2019.pdf,2352aedf22264cd0db0c2d2495b2238b,TRUE,5,NA,Get Brexit done. Unleash Britain's potential,FALSE,51620_201912
"Strengthening the Union: Conservatives have a proud history of upholding and strengthening the devolution settlements in Scotland, Wales and Northern Ireland.",301,NA,1005,51620,201912,english,MARPOR,FALSE,TRUE,FALSE,c5dacb307705350e33bd4ad598eb8010,/down/originals/2020-1/51620_2019.pdf,2352aedf22264cd0db0c2d2495b2238b,TRUE,5,NA,Get Brexit done. Unleash Britain's potential,FALSE,51620_201912
We also want to ensure that the UK Government and its institutions are working effectively to realise the benefits of four nations working together as one United Kingdom.,203,NA,1006,51620,201912,english,MARPOR,FALSE,TRUE,FALSE,c5dacb307705350e33bd4ad598eb8010,/down/originals/2020-1/51620_2019.pdf,2352aedf22264cd0db0c2d2495b2238b,TRUE,5,NA,Get Brexit done. Unleash Britain's potential,FALSE,51620_201912
We will carefully consider the recommendations of Lord Dunlop’s Independent Review into UK Government Union capability when it is published as we work to strengthen our Union going forward.,203,NA,1007,51620,201912,english,MARPOR,FALSE,TRUE,FALSE,c5dacb307705350e33bd4ad598eb8010,/down/originals/2020-1/51620_2019.pdf,2352aedf22264cd0db0c2d2495b2238b,TRUE,5,NA,Get Brexit done. Unleash Britain's potential,FALSE,51620_201912
Freeports: We will aim to ensure that our new freeports benefit the people in each of the four nations.,401,NA,1008,51620,201912,english,MARPOR,FALSE,TRUE,FALSE,c5dacb307705350e33bd4ad598eb8010,/down/originals/2020-1/51620_2019.pdf,2352aedf22264cd0db0c2d2495b2238b,TRUE,5,NA,Get Brexit done. Unleash Britain's potential,FALSE,51620_201912
We believe that there are many places across the United Kingdom that have the opportunity to be successful innovative hubs for global trade.,401,NA,1009,51620,201912,english,MARPOR,FALSE,TRUE,FALSE,c5dacb307705350e33bd4ad598eb8010,/down/originals/2020-1/51620_2019.pdf,2352aedf22264cd0db0c2d2495b2238b,TRUE,5,NA,Get Brexit done. Unleash Britain's potential,FALSE,51620_201912
Standing up for Northern Ireland,H,NA,1010,51620,201912,english,MARPOR,FALSE,TRUE,FALSE,c5dacb307705350e33bd4ad598eb8010,/down/originals/2020-1/51620_2019.pdf,2352aedf22264cd0db0c2d2495b2238b,TRUE,5,NA,Get Brexit done. Unleash Britain's potential,FALSE,51620_201912
Northern Ireland enjoys huge benefits from membership of the United Kingdom and our country is stronger and richer for Northern Ireland being part of it.,203,NA,1011,51620,201912,english,MARPOR,FALSE,TRUE,FALSE,c5dacb307705350e33bd4ad598eb8010,/down/originals/2020-1/51620_2019.pdf,2352aedf22264cd0db0c2d2495b2238b,TRUE,5,NA,Get Brexit done. Unleash Britain's potential,FALSE,51620_201912
"That is why we will never be neutral on the Union and why we stand for a proud, confident, inclusive and modern unionism that affords equal respect to all traditions and parts of the community.",203,NA,1012,51620,201912,english,MARPOR,FALSE,TRUE,FALSE,c5dacb307705350e33bd4ad598eb8010,/down/originals/2020-1/51620_2019.pdf,2352aedf22264cd0db0c2d2495b2238b,TRUE,5,NA,Get Brexit done. Unleash Britain's potential,FALSE,51620_201912
Our commitment to the 1998 Belfast Agreement and its successor agreements is unshakeable and we will not deviate from the principle of consent or the three-stranded approach.,301,NA,1013,51620,201912,english,MARPOR,FALSE,TRUE,FALSE,c5dacb307705350e33bd4ad598eb8010,/down/originals/2020-1/51620_2019.pdf,2352aedf22264cd0db0c2d2495b2238b,TRUE,5,NA,Get Brexit done. Unleash Britain's potential,FALSE,51620_201912
We will continue to work with all sides to re-establish the Northern Ireland Executive and Assembly so that the people of Northern Ireland can enjoy the full advantages of devolved government for the benefit of the whole community.,301,NA,1014,51620,201912,english,MARPOR,FALSE,TRUE,FALSE,c5dacb307705350e33bd4ad598eb8010,/down/originals/2020-1/51620_2019.pdf,2352aedf22264cd0db0c2d2495b2238b,TRUE,5,NA,Get Brexit done. Unleash Britain's potential,FALSE,51620_201912
Guaranteeing the full economic benefits of Brexit: Northern Ireland will enjoy the full economic benefits of Brexit including new free trade agreements with the rest of the world.,401,NA,1015,51620,201912,english,MARPOR,FALSE,TRUE,FALSE,c5dacb307705350e33bd4ad598eb8010,/down/originals/2020-1/51620_2019.pdf,2352aedf22264cd0db0c2d2495b2238b,TRUE,5,NA,Get Brexit done. Unleash Britain's potential,FALSE,51620_201912
We will ensure that Northern Ireland’s businesses and producers enjoy unfettered access to the rest of the UK,406,NA,1016,51620,201912,english,MARPOR,FALSE,TRUE,FALSE,c5dacb307705350e33bd4ad598eb8010,/down/originals/2020-1/51620_2019.pdf,2352aedf22264cd0db0c2d2495b2238b,TRUE,5,NA,Get Brexit done. Unleash Britain's potential,FALSE,51620_201912
"and that in the implementation of our Brexit deal, we maintain and strengthen the integrity and smooth operation of our internal market.",406,NA,1017,51620,201912,english,MARPOR,FALSE,TRUE,FALSE,c5dacb307705350e33bd4ad598eb8010,/down/originals/2020-1/51620_2019.pdf,2352aedf22264cd0db0c2d2495b2238b,TRUE,5,NA,Get Brexit done. Unleash Britain's potential,FALSE,51620_201912
"Turbocharging the Northern Ireland economy: After Brexit, we will support the Northern Ireland Executive to improve infrastructure,",411,NA,1018,51620,201912,english,MARPOR,FALSE,TRUE,FALSE,c5dacb307705350e33bd4ad598eb8010,/down/originals/2020-1/51620_2019.pdf,2352aedf22264cd0db0c2d2495b2238b,TRUE,5,NA,Get Brexit done. Unleash Britain's potential,FALSE,51620_201912
