text,cmp_code,eu_code,pos,party,date,language,source,has_eu_code,is_primary_doc,may_contradict_core_dataset,md5sum_text,url_original,md5sum_original,annotations,handbook,is_copy_of,title,translation_en,id
"As part of our efforts to empower and support disabled people,we will reduce the number of reassessments a disabled person must go through when a significant change in condition is unlikely – because you should not have to provide repeated proof of your disability in order to receive support.",503,NA,320,51620,201912,english,MARPOR,FALSE,TRUE,FALSE,c5dacb307705350e33bd4ad598eb8010,/down/originals/2020-1/51620_2019.pdf,2352aedf22264cd0db0c2d2495b2238b,TRUE,5,NA,Get Brexit done. Unleash Britain's potential,FALSE,51620_201912
We will publish a National Strategy for Disabled People before the end of 2020.,503,NA,321,51620,201912,english,MARPOR,FALSE,TRUE,FALSE,c5dacb307705350e33bd4ad598eb8010,/down/originals/2020-1/51620_2019.pdf,2352aedf22264cd0db0c2d2495b2238b,TRUE,5,NA,Get Brexit done. Unleash Britain's potential,FALSE,51620_201912
"This will look at ways to improve the benefits system, opportunities and access for disabled people in terms of housing, education, transport and jobs.",503,NA,322,51620,201912,english,MARPOR,FALSE,TRUE,FALSE,c5dacb307705350e33bd4ad598eb8010,/down/originals/2020-1/51620_2019.pdf,2352aedf22264cd0db0c2d2495b2238b,TRUE,5,NA,Get Brexit done. Unleash Britain's potential,FALSE,51620_201912
It will include our existing commitments to increase SEND funding,506,NA,323,51620,201912,english,MARPOR,FALSE,TRUE,FALSE,c5dacb307705350e33bd4ad598eb8010,/down/originals/2020-1/51620_2019.pdf,2352aedf22264cd0db0c2d2495b2238b,TRUE,5,NA,Get Brexit done. Unleash Britain's potential,FALSE,51620_201912
"and support pupils, students and adults to get careers advice,",506,NA,324,51620,201912,english,MARPOR,FALSE,TRUE,FALSE,c5dacb307705350e33bd4ad598eb8010,/down/originals/2020-1/51620_2019.pdf,2352aedf22264cd0db0c2d2495b2238b,TRUE,5,NA,Get Brexit done. Unleash Britain's potential,FALSE,51620_201912
"internships, and transition into work.",411,NA,325,51620,201912,english,MARPOR,FALSE,TRUE,FALSE,c5dacb307705350e33bd4ad598eb8010,/down/originals/2020-1/51620_2019.pdf,2352aedf22264cd0db0c2d2495b2238b,TRUE,5,NA,Get Brexit done. Unleash Britain's potential,FALSE,51620_201912
We will reduce the disability employment gap.,503,NA,326,51620,201912,english,MARPOR,FALSE,TRUE,FALSE,c5dacb307705350e33bd4ad598eb8010,/down/originals/2020-1/51620_2019.pdf,2352aedf22264cd0db0c2d2495b2238b,TRUE,5,NA,Get Brexit done. Unleash Britain's potential,FALSE,51620_201912
Make our country safer,H,NA,327,51620,201912,english,MARPOR,FALSE,TRUE,FALSE,c5dacb307705350e33bd4ad598eb8010,/down/originals/2020-1/51620_2019.pdf,2352aedf22264cd0db0c2d2495b2238b,TRUE,5,NA,Get Brexit done. Unleash Britain's potential,FALSE,51620_201912
Our first duty as a Government is to keep our country safe.,601.1,NA,328,51620,201912,english,MARPOR,FALSE,TRUE,FALSE,c5dacb307705350e33bd4ad598eb8010,/down/originals/2020-1/51620_2019.pdf,2352aedf22264cd0db0c2d2495b2238b,TRUE,5,NA,Get Brexit done. Unleash Britain's potential,FALSE,51620_201912
"One of Boris Johnson’s first actions as Prime Minister was to start recruiting 20,000 new police officers.",605.1,NA,329,51620,201912,english,MARPOR,FALSE,TRUE,FALSE,c5dacb307705350e33bd4ad598eb8010,/down/originals/2020-1/51620_2019.pdf,2352aedf22264cd0db0c2d2495b2238b,TRUE,5,NA,Get Brexit done. Unleash Britain's potential,FALSE,51620_201912
These new officers will take violent criminals off the streets and protect us and our country.,605.1,NA,330,51620,201912,english,MARPOR,FALSE,TRUE,FALSE,c5dacb307705350e33bd4ad598eb8010,/down/originals/2020-1/51620_2019.pdf,2352aedf22264cd0db0c2d2495b2238b,TRUE,5,NA,Get Brexit done. Unleash Britain's potential,FALSE,51620_201912
"The Conservatives will always back the brave men and women of our police and security services, which is why we will empower the police, backing the increased use of stop and search as long as it is fair and proportionate.",605.1,NA,331,51620,201912,english,MARPOR,FALSE,TRUE,FALSE,c5dacb307705350e33bd4ad598eb8010,/down/originals/2020-1/51620_2019.pdf,2352aedf22264cd0db0c2d2495b2238b,TRUE,5,NA,Get Brexit done. Unleash Britain's potential,FALSE,51620_201912
And we will provide them with the equipment they need.,605.1,NA,332,51620,201912,english,MARPOR,FALSE,TRUE,FALSE,c5dacb307705350e33bd4ad598eb8010,/down/originals/2020-1/51620_2019.pdf,2352aedf22264cd0db0c2d2495b2238b,TRUE,5,NA,Get Brexit done. Unleash Britain's potential,FALSE,51620_201912
"We need a fair justice system – one that stands for the law-abiding majority, not the criminal minority,",605.1,NA,333,51620,201912,english,MARPOR,FALSE,TRUE,FALSE,c5dacb307705350e33bd4ad598eb8010,/down/originals/2020-1/51620_2019.pdf,2352aedf22264cd0db0c2d2495b2238b,TRUE,5,NA,Get Brexit done. Unleash Britain's potential,FALSE,51620_201912
and that gives a second chance to those who have served their time and wish to make a fresh start.,605.2,NA,334,51620,201912,english,MARPOR,FALSE,TRUE,FALSE,c5dacb307705350e33bd4ad598eb8010,/down/originals/2020-1/51620_2019.pdf,2352aedf22264cd0db0c2d2495b2238b,TRUE,5,NA,Get Brexit done. Unleash Britain's potential,FALSE,51620_201912
Adam Wordsworth Candidate for Weaver Vale Former Police Officer,000,NA,335,51620,201912,english,MARPOR,FALSE,TRUE,FALSE,c5dacb307705350e33bd4ad598eb8010,/down/originals/2020-1/51620_2019.pdf,2352aedf22264cd0db0c2d2495b2238b,TRUE,5,NA,Get Brexit done. Unleash Britain's potential,FALSE,51620_201912
Our plan to cut crime,H,NA,336,51620,201912,english,MARPOR,FALSE,TRUE,FALSE,c5dacb307705350e33bd4ad598eb8010,/down/originals/2020-1/51620_2019.pdf,2352aedf22264cd0db0c2d2495b2238b,TRUE,5,NA,Get Brexit done. Unleash Britain's potential,FALSE,51620_201912
"We will back our police by equipping officers with the powers and tools they need to keep themselves and all of us safe, including tasers and body cameras.",605.1,NA,337,51620,201912,english,MARPOR,FALSE,TRUE,FALSE,c5dacb307705350e33bd4ad598eb8010,/down/originals/2020-1/51620_2019.pdf,2352aedf22264cd0db0c2d2495b2238b,TRUE,5,NA,Get Brexit done. Unleash Britain's potential,FALSE,51620_201912
We will put the Police Covenant into law to ensure they have the support they need.,605.1,NA,338,51620,201912,english,MARPOR,FALSE,TRUE,FALSE,c5dacb307705350e33bd4ad598eb8010,/down/originals/2020-1/51620_2019.pdf,2352aedf22264cd0db0c2d2495b2238b,TRUE,5,NA,Get Brexit done. Unleash Britain's potential,FALSE,51620_201912
"Police will be empowered by a new court order to target known knife carriers, making it easier for officers to stop and search those convicted of knife crime.",605.1,NA,339,51620,201912,english,MARPOR,FALSE,TRUE,FALSE,c5dacb307705350e33bd4ad598eb8010,/down/originals/2020-1/51620_2019.pdf,2352aedf22264cd0db0c2d2495b2238b,TRUE,5,NA,Get Brexit done. Unleash Britain's potential,FALSE,51620_201912
Anyone charged with knife possession will appear before magistrates within days not weeks.,605.1,NA,340,51620,201912,english,MARPOR,FALSE,TRUE,FALSE,c5dacb307705350e33bd4ad598eb8010,/down/originals/2020-1/51620_2019.pdf,2352aedf22264cd0db0c2d2495b2238b,TRUE,5,NA,Get Brexit done. Unleash Britain's potential,FALSE,51620_201912
Those who use a knife as a weapon should go to prison.,605.1,NA,341,51620,201912,english,MARPOR,FALSE,TRUE,FALSE,c5dacb307705350e33bd4ad598eb8010,/down/originals/2020-1/51620_2019.pdf,2352aedf22264cd0db0c2d2495b2238b,TRUE,5,NA,Get Brexit done. Unleash Britain's potential,FALSE,51620_201912
We will introduce tougher sentencing for the worst offenders,605.1,NA,342,51620,201912,english,MARPOR,FALSE,TRUE,FALSE,c5dacb307705350e33bd4ad598eb8010,/down/originals/2020-1/51620_2019.pdf,2352aedf22264cd0db0c2d2495b2238b,TRUE,5,NA,Get Brexit done. Unleash Britain's potential,FALSE,51620_201912
and end automatic halfway release from prison for serious crimes.,605.1,NA,343,51620,201912,english,MARPOR,FALSE,TRUE,FALSE,c5dacb307705350e33bd4ad598eb8010,/down/originals/2020-1/51620_2019.pdf,2352aedf22264cd0db0c2d2495b2238b,TRUE,5,NA,Get Brexit done. Unleash Britain's potential,FALSE,51620_201912
"For child murderers, there will be life imprisonment without parole.",605.1,NA,344,51620,201912,english,MARPOR,FALSE,TRUE,FALSE,c5dacb307705350e33bd4ad598eb8010,/down/originals/2020-1/51620_2019.pdf,2352aedf22264cd0db0c2d2495b2238b,TRUE,5,NA,Get Brexit done. Unleash Britain's potential,FALSE,51620_201912
We will use our new freedoms after Brexit to prevent more foreign national offenders entering our country.,110,NA,345,51620,201912,english,MARPOR,FALSE,TRUE,FALSE,c5dacb307705350e33bd4ad598eb8010,/down/originals/2020-1/51620_2019.pdf,2352aedf22264cd0db0c2d2495b2238b,TRUE,5,NA,Get Brexit done. Unleash Britain's potential,FALSE,51620_201912
"We will cut the number of foreign nationals in our prisons,",110,NA,346,51620,201912,english,MARPOR,FALSE,TRUE,FALSE,c5dacb307705350e33bd4ad598eb8010,/down/originals/2020-1/51620_2019.pdf,2352aedf22264cd0db0c2d2495b2238b,TRUE,5,NA,Get Brexit done. Unleash Britain's potential,FALSE,51620_201912
and increase penalties to stop them returning.,605.1,NA,347,51620,201912,english,MARPOR,FALSE,TRUE,FALSE,c5dacb307705350e33bd4ad598eb8010,/down/originals/2020-1/51620_2019.pdf,2352aedf22264cd0db0c2d2495b2238b,TRUE,5,NA,Get Brexit done. Unleash Britain's potential,FALSE,51620_201912
We will back all those who put their lives on the line to keep us safe – police and prison officers and emergency service workers.,605.1,NA,348,51620,201912,english,MARPOR,FALSE,TRUE,FALSE,c5dacb307705350e33bd4ad598eb8010,/down/originals/2020-1/51620_2019.pdf,2352aedf22264cd0db0c2d2495b2238b,TRUE,5,NA,Get Brexit done. Unleash Britain's potential,FALSE,51620_201912
We will pass the Police Protection Bill,605.1,NA,349,51620,201912,english,MARPOR,FALSE,TRUE,FALSE,c5dacb307705350e33bd4ad598eb8010,/down/originals/2020-1/51620_2019.pdf,2352aedf22264cd0db0c2d2495b2238b,TRUE,5,NA,Get Brexit done. Unleash Britain's potential,FALSE,51620_201912
"and consult on doubling the maximum sentence for assaulting workers in emergency services such as police officers, firefighters and paramedics.",605.1,NA,350,51620,201912,english,MARPOR,FALSE,TRUE,FALSE,c5dacb307705350e33bd4ad598eb8010,/down/originals/2020-1/51620_2019.pdf,2352aedf22264cd0db0c2d2495b2238b,TRUE,5,NA,Get Brexit done. Unleash Britain's potential,FALSE,51620_201912
We will strengthen the accountability of elected Police and Crime Commissioners and expand their role.,605.1,NA,351,51620,201912,english,MARPOR,FALSE,TRUE,FALSE,c5dacb307705350e33bd4ad598eb8010,/down/originals/2020-1/51620_2019.pdf,2352aedf22264cd0db0c2d2495b2238b,TRUE,5,NA,Get Brexit done. Unleash Britain's potential,FALSE,51620_201912
"People must have an accountable local leader delivering on their crime and justice priorities, who they can vote out.",202.1,NA,352,51620,201912,english,MARPOR,FALSE,TRUE,FALSE,c5dacb307705350e33bd4ad598eb8010,/down/originals/2020-1/51620_2019.pdf,2352aedf22264cd0db0c2d2495b2238b,TRUE,5,NA,Get Brexit done. Unleash Britain's potential,FALSE,51620_201912
"We will expand electronic tagging for criminals serving time outside jail,",605.1,NA,353,51620,201912,english,MARPOR,FALSE,TRUE,FALSE,c5dacb307705350e33bd4ad598eb8010,/down/originals/2020-1/51620_2019.pdf,2352aedf22264cd0db0c2d2495b2238b,TRUE,5,NA,Get Brexit done. Unleash Britain's potential,FALSE,51620_201912
including the use of sobriety tags for those whose offending is fuelled by alcohol.,605.1,NA,354,51620,201912,english,MARPOR,FALSE,TRUE,FALSE,c5dacb307705350e33bd4ad598eb8010,/down/originals/2020-1/51620_2019.pdf,2352aedf22264cd0db0c2d2495b2238b,TRUE,5,NA,Get Brexit done. Unleash Britain's potential,FALSE,51620_201912
"We will toughen community sentences, for example by tightening curfews and making those convicted do more hours of community payback to clean up our parks and streets.",605.1,NA,355,51620,201912,english,MARPOR,FALSE,TRUE,FALSE,c5dacb307705350e33bd4ad598eb8010,/down/originals/2020-1/51620_2019.pdf,2352aedf22264cd0db0c2d2495b2238b,TRUE,5,NA,Get Brexit done. Unleash Britain's potential,FALSE,51620_201912
We will embrace new technologies and crack down on online crimes.,605.1,NA,356,51620,201912,english,MARPOR,FALSE,TRUE,FALSE,c5dacb307705350e33bd4ad598eb8010,/down/originals/2020-1/51620_2019.pdf,2352aedf22264cd0db0c2d2495b2238b,TRUE,5,NA,Get Brexit done. Unleash Britain's potential,FALSE,51620_201912
"We will create a new national cyber crime force and empower the police to safely use new technologies like biometrics and artificial intelligence, along with the use of DNA, within a strict legal framework.",605.1,NA,357,51620,201912,english,MARPOR,FALSE,TRUE,FALSE,c5dacb307705350e33bd4ad598eb8010,/down/originals/2020-1/51620_2019.pdf,2352aedf22264cd0db0c2d2495b2238b,TRUE,5,NA,Get Brexit done. Unleash Britain's potential,FALSE,51620_201912
We will also create a world-class National Crime Laboratory.,605.1,NA,358,51620,201912,english,MARPOR,FALSE,TRUE,FALSE,c5dacb307705350e33bd4ad598eb8010,/down/originals/2020-1/51620_2019.pdf,2352aedf22264cd0db0c2d2495b2238b,TRUE,5,NA,Get Brexit done. Unleash Britain's potential,FALSE,51620_201912
We will counter the growing threat of serious and organised crime.,605.1,NA,359,51620,201912,english,MARPOR,FALSE,TRUE,FALSE,c5dacb307705350e33bd4ad598eb8010,/down/originals/2020-1/51620_2019.pdf,2352aedf22264cd0db0c2d2495b2238b,TRUE,5,NA,Get Brexit done. Unleash Britain's potential,FALSE,51620_201912
"We will strengthen the National Crime Agency so it can tackle the threats we face, from fraud, county lines gangs and child sexual abuse to illicit finance, modern slavery and people-trafficking.",605.1,NA,360,51620,201912,english,MARPOR,FALSE,TRUE,FALSE,c5dacb307705350e33bd4ad598eb8010,/down/originals/2020-1/51620_2019.pdf,2352aedf22264cd0db0c2d2495b2238b,TRUE,5,NA,Get Brexit done. Unleash Britain's potential,FALSE,51620_201912
"We will add 10,000 more prison places,",605.1,NA,361,51620,201912,english,MARPOR,FALSE,TRUE,FALSE,c5dacb307705350e33bd4ad598eb8010,/down/originals/2020-1/51620_2019.pdf,2352aedf22264cd0db0c2d2495b2238b,TRUE,5,NA,Get Brexit done. Unleash Britain's potential,FALSE,51620_201912
with £2.75 billion already committed to refurbishing and creating modern prisons.,411,NA,362,51620,201912,english,MARPOR,FALSE,TRUE,FALSE,c5dacb307705350e33bd4ad598eb8010,/down/originals/2020-1/51620_2019.pdf,2352aedf22264cd0db0c2d2495b2238b,TRUE,5,NA,Get Brexit done. Unleash Britain's potential,FALSE,51620_201912
We will maintain the ban on prisoners voting from jail.,605.1,NA,363,51620,201912,english,MARPOR,FALSE,TRUE,FALSE,c5dacb307705350e33bd4ad598eb8010,/down/originals/2020-1/51620_2019.pdf,2352aedf22264cd0db0c2d2495b2238b,TRUE,5,NA,Get Brexit done. Unleash Britain's potential,FALSE,51620_201912
"We will conduct a root-and-branch review of the parole system to improve accountability and public safety,",605.1,NA,364,51620,201912,english,MARPOR,FALSE,TRUE,FALSE,c5dacb307705350e33bd4ad598eb8010,/down/originals/2020-1/51620_2019.pdf,2352aedf22264cd0db0c2d2495b2238b,TRUE,5,NA,Get Brexit done. Unleash Britain's potential,FALSE,51620_201912
"giving victims the right to attend hearings for the first time,",503,NA,365,51620,201912,english,MARPOR,FALSE,TRUE,FALSE,c5dacb307705350e33bd4ad598eb8010,/down/originals/2020-1/51620_2019.pdf,2352aedf22264cd0db0c2d2495b2238b,TRUE,5,NA,Get Brexit done. Unleash Britain's potential,FALSE,51620_201912
and we will establish a Royal Commission on the criminal justice process.,605.1,NA,366,51620,201912,english,MARPOR,FALSE,TRUE,FALSE,c5dacb307705350e33bd4ad598eb8010,/down/originals/2020-1/51620_2019.pdf,2352aedf22264cd0db0c2d2495b2238b,TRUE,5,NA,Get Brexit done. Unleash Britain's potential,FALSE,51620_201912
We will combat extremism and do all we can to ensure that extremists never receive public money.,605.1,NA,367,51620,201912,english,MARPOR,FALSE,TRUE,FALSE,c5dacb307705350e33bd4ad598eb8010,/down/originals/2020-1/51620_2019.pdf,2352aedf22264cd0db0c2d2495b2238b,TRUE,5,NA,Get Brexit done. Unleash Britain's potential,FALSE,51620_201912
We will keep our country safe from terrorism.,605.1,NA,368,51620,201912,english,MARPOR,FALSE,TRUE,FALSE,c5dacb307705350e33bd4ad598eb8010,/down/originals/2020-1/51620_2019.pdf,2352aedf22264cd0db0c2d2495b2238b,TRUE,5,NA,Get Brexit done. Unleash Britain's potential,FALSE,51620_201912
We will invest in the police and security services and give them the powers they need to combat new threats.,605.1,NA,369,51620,201912,english,MARPOR,FALSE,TRUE,FALSE,c5dacb307705350e33bd4ad598eb8010,/down/originals/2020-1/51620_2019.pdf,2352aedf22264cd0db0c2d2495b2238b,TRUE,5,NA,Get Brexit done. Unleash Britain's potential,FALSE,51620_201912
"In the wake of the terrible events in Manchester in 2017, we will improve the safety and security of public venues.",605.1,NA,370,51620,201912,english,MARPOR,FALSE,TRUE,FALSE,c5dacb307705350e33bd4ad598eb8010,/down/originals/2020-1/51620_2019.pdf,2352aedf22264cd0db0c2d2495b2238b,TRUE,5,NA,Get Brexit done. Unleash Britain's potential,FALSE,51620_201912
We will tackle unauthorised traveller camps.,605.1,NA,371,51620,201912,english,MARPOR,FALSE,TRUE,FALSE,c5dacb307705350e33bd4ad598eb8010,/down/originals/2020-1/51620_2019.pdf,2352aedf22264cd0db0c2d2495b2238b,TRUE,5,NA,Get Brexit done. Unleash Britain's potential,FALSE,51620_201912
"We will give the police new powers to arrest and seize the property and vehicles of trespassers who set up unauthorised encampments, in order to protect our communities.",605.1,NA,372,51620,201912,english,MARPOR,FALSE,TRUE,FALSE,c5dacb307705350e33bd4ad598eb8010,/down/originals/2020-1/51620_2019.pdf,2352aedf22264cd0db0c2d2495b2238b,TRUE,5,NA,Get Brexit done. Unleash Britain's potential,FALSE,51620_201912
"We will make intentional trespass a criminal offence,",605.1,NA,373,51620,201912,english,MARPOR,FALSE,TRUE,FALSE,c5dacb307705350e33bd4ad598eb8010,/down/originals/2020-1/51620_2019.pdf,2352aedf22264cd0db0c2d2495b2238b,TRUE,5,NA,Get Brexit done. Unleash Britain's potential,FALSE,51620_201912
and we will also give councils greater powers within the planning system.,301,NA,374,51620,201912,english,MARPOR,FALSE,TRUE,FALSE,c5dacb307705350e33bd4ad598eb8010,/down/originals/2020-1/51620_2019.pdf,2352aedf22264cd0db0c2d2495b2238b,TRUE,5,NA,Get Brexit done. Unleash Britain's potential,FALSE,51620_201912
"In order to successfully keep our streets safe, we need to turn people away from crime and end the cycle of reoffending:",605.1,NA,375,51620,201912,english,MARPOR,FALSE,TRUE,FALSE,c5dacb307705350e33bd4ad598eb8010,/down/originals/2020-1/51620_2019.pdf,2352aedf22264cd0db0c2d2495b2238b,TRUE,5,NA,Get Brexit done. Unleash Britain's potential,FALSE,51620_201912
Youth offending,H,NA,376,51620,201912,english,MARPOR,FALSE,TRUE,FALSE,c5dacb307705350e33bd4ad598eb8010,/down/originals/2020-1/51620_2019.pdf,2352aedf22264cd0db0c2d2495b2238b,TRUE,5,NA,Get Brexit done. Unleash Britain's potential,FALSE,51620_201912
"Young people are less likely to get into trouble in a well-disciplined school, which is why we will back teachers to enforce discipline.",603,NA,377,51620,201912,english,MARPOR,FALSE,TRUE,FALSE,c5dacb307705350e33bd4ad598eb8010,/down/originals/2020-1/51620_2019.pdf,2352aedf22264cd0db0c2d2495b2238b,TRUE,5,NA,Get Brexit done. Unleash Britain's potential,FALSE,51620_201912
We are investing £500 million in youth services for young people.,706,NA,378,51620,201912,english,MARPOR,FALSE,TRUE,FALSE,c5dacb307705350e33bd4ad598eb8010,/down/originals/2020-1/51620_2019.pdf,2352aedf22264cd0db0c2d2495b2238b,TRUE,5,NA,Get Brexit done. Unleash Britain's potential,FALSE,51620_201912
"If they endanger others, we will put them in new alternative provision schools.",605.1,NA,379,51620,201912,english,MARPOR,FALSE,TRUE,FALSE,c5dacb307705350e33bd4ad598eb8010,/down/originals/2020-1/51620_2019.pdf,2352aedf22264cd0db0c2d2495b2238b,TRUE,5,NA,Get Brexit done. Unleash Britain's potential,FALSE,51620_201912
"If they are offenders, we are trialling Secure Schools.",605.1,NA,380,51620,201912,english,MARPOR,FALSE,TRUE,FALSE,c5dacb307705350e33bd4ad598eb8010,/down/originals/2020-1/51620_2019.pdf,2352aedf22264cd0db0c2d2495b2238b,TRUE,5,NA,Get Brexit done. Unleash Britain's potential,FALSE,51620_201912
"New laws will require schools, police, councils and health authorities to work together through Violence Reduction Units to prevent serious crime.",605.1,NA,381,51620,201912,english,MARPOR,FALSE,TRUE,FALSE,c5dacb307705350e33bd4ad598eb8010,/down/originals/2020-1/51620_2019.pdf,2352aedf22264cd0db0c2d2495b2238b,TRUE,5,NA,Get Brexit done. Unleash Britain's potential,FALSE,51620_201912
Addiction,H,NA,382,51620,201912,english,MARPOR,FALSE,TRUE,FALSE,c5dacb307705350e33bd4ad598eb8010,/down/originals/2020-1/51620_2019.pdf,2352aedf22264cd0db0c2d2495b2238b,TRUE,5,NA,Get Brexit done. Unleash Britain's potential,FALSE,51620_201912
"Drug addiction fuels crime, violence and family breakdown – and new dangerous substances are driving an increase in deaths from drug abuse.",605.1,NA,383,51620,201912,english,MARPOR,FALSE,TRUE,FALSE,c5dacb307705350e33bd4ad598eb8010,/down/originals/2020-1/51620_2019.pdf,2352aedf22264cd0db0c2d2495b2238b,TRUE,5,NA,Get Brexit done. Unleash Britain's potential,FALSE,51620_201912
"We will tackle drug-related crime,",605.1,NA,384,51620,201912,english,MARPOR,FALSE,TRUE,FALSE,c5dacb307705350e33bd4ad598eb8010,/down/originals/2020-1/51620_2019.pdf,2352aedf22264cd0db0c2d2495b2238b,TRUE,5,NA,Get Brexit done. Unleash Britain's potential,FALSE,51620_201912
and at the same time take a new approach to treatment so we can reduce drug deaths,605.2,NA,385,51620,201912,english,MARPOR,FALSE,TRUE,FALSE,c5dacb307705350e33bd4ad598eb8010,/down/originals/2020-1/51620_2019.pdf,2352aedf22264cd0db0c2d2495b2238b,TRUE,5,NA,Get Brexit done. Unleash Britain's potential,FALSE,51620_201912
and break the cycle of crime linked to addiction.,605.2,NA,386,51620,201912,english,MARPOR,FALSE,TRUE,FALSE,c5dacb307705350e33bd4ad598eb8010,/down/originals/2020-1/51620_2019.pdf,2352aedf22264cd0db0c2d2495b2238b,TRUE,5,NA,Get Brexit done. Unleash Britain's potential,FALSE,51620_201912
Rehabilitation,H,NA,387,51620,201912,english,MARPOR,FALSE,TRUE,FALSE,c5dacb307705350e33bd4ad598eb8010,/down/originals/2020-1/51620_2019.pdf,2352aedf22264cd0db0c2d2495b2238b,TRUE,5,NA,Get Brexit done. Unleash Britain's potential,FALSE,51620_201912
We will create a prisoner education service focused on work-based training and skills.,605.2,NA,388,51620,201912,english,MARPOR,FALSE,TRUE,FALSE,c5dacb307705350e33bd4ad598eb8010,/down/originals/2020-1/51620_2019.pdf,2352aedf22264cd0db0c2d2495b2238b,TRUE,5,NA,Get Brexit done. Unleash Britain's potential,FALSE,51620_201912
"We will improve employment opportunities for ex-offenders, including a job coach in each prison.",605.2,NA,389,51620,201912,english,MARPOR,FALSE,TRUE,FALSE,c5dacb307705350e33bd4ad598eb8010,/down/originals/2020-1/51620_2019.pdf,2352aedf22264cd0db0c2d2495b2238b,TRUE,5,NA,Get Brexit done. Unleash Britain's potential,FALSE,51620_201912
This approach is proven to reduce reoffending.,605.2,NA,390,51620,201912,english,MARPOR,FALSE,TRUE,FALSE,c5dacb307705350e33bd4ad598eb8010,/down/originals/2020-1/51620_2019.pdf,2352aedf22264cd0db0c2d2495b2238b,TRUE,5,NA,Get Brexit done. Unleash Britain's potential,FALSE,51620_201912
"We are improving prison security to protect staff, stop drug smuggling and reduce violence.",605.1,NA,391,51620,201912,english,MARPOR,FALSE,TRUE,FALSE,c5dacb307705350e33bd4ad598eb8010,/down/originals/2020-1/51620_2019.pdf,2352aedf22264cd0db0c2d2495b2238b,TRUE,5,NA,Get Brexit done. Unleash Britain's potential,FALSE,51620_201912
Supporting all victims of crime,H,NA,392,51620,201912,english,MARPOR,FALSE,TRUE,FALSE,c5dacb307705350e33bd4ad598eb8010,/down/originals/2020-1/51620_2019.pdf,2352aedf22264cd0db0c2d2495b2238b,TRUE,5,NA,Get Brexit done. Unleash Britain's potential,FALSE,51620_201912
"Delivering justice does not just mean treating defendants fairly, but doing right by victims.",605.1,NA,393,51620,201912,english,MARPOR,FALSE,TRUE,FALSE,c5dacb307705350e33bd4ad598eb8010,/down/originals/2020-1/51620_2019.pdf,2352aedf22264cd0db0c2d2495b2238b,TRUE,5,NA,Get Brexit done. Unleash Britain's potential,FALSE,51620_201912
So we will pass and implement a Victims’ Law that guarantees victims’ rights and the level of support they can expect.,201.2,NA,394,51620,201912,english,MARPOR,FALSE,TRUE,FALSE,c5dacb307705350e33bd4ad598eb8010,/down/originals/2020-1/51620_2019.pdf,2352aedf22264cd0db0c2d2495b2238b,TRUE,5,NA,Get Brexit done. Unleash Britain's potential,FALSE,51620_201912
We will support all victims of domestic abuse and pass the Domestic Abuse Bill.,605.1,NA,395,51620,201912,english,MARPOR,FALSE,TRUE,FALSE,c5dacb307705350e33bd4ad598eb8010,/down/originals/2020-1/51620_2019.pdf,2352aedf22264cd0db0c2d2495b2238b,TRUE,5,NA,Get Brexit done. Unleash Britain's potential,FALSE,51620_201912
We will increase support for refuges and community support for victims of rape and sexual abuse.,605.1,NA,396,51620,201912,english,MARPOR,FALSE,TRUE,FALSE,c5dacb307705350e33bd4ad598eb8010,/down/originals/2020-1/51620_2019.pdf,2352aedf22264cd0db0c2d2495b2238b,TRUE,5,NA,Get Brexit done. Unleash Britain's potential,FALSE,51620_201912
We will pilot integrated domestic abuse courts that address criminal and family matters in parallel.,605.1,NA,397,51620,201912,english,MARPOR,FALSE,TRUE,FALSE,c5dacb307705350e33bd4ad598eb8010,/down/originals/2020-1/51620_2019.pdf,2352aedf22264cd0db0c2d2495b2238b,TRUE,5,NA,Get Brexit done. Unleash Britain's potential,FALSE,51620_201912
"We will continue to fight crime against women and girls, including rape, Female Genital Mutilation and forced marriage.",605.1,NA,398,51620,201912,english,MARPOR,FALSE,TRUE,FALSE,c5dacb307705350e33bd4ad598eb8010,/down/originals/2020-1/51620_2019.pdf,2352aedf22264cd0db0c2d2495b2238b,TRUE,5,NA,Get Brexit done. Unleash Britain's potential,FALSE,51620_201912
