text,cmp_code,eu_code,pos,party,date,language,source,has_eu_code,is_primary_doc,may_contradict_core_dataset,md5sum_text,url_original,md5sum_original,annotations,handbook,is_copy_of,title,translation_en,id
Get Brexit Done,H,NA,1,51620,201912,english,MARPOR,FALSE,TRUE,FALSE,c5dacb307705350e33bd4ad598eb8010,/down/originals/2020-1/51620_2019.pdf,2352aedf22264cd0db0c2d2495b2238b,TRUE,5,NA,Get Brexit done. Unleash Britain's potential,FALSE,51620_201912
"When the new Government entered Downing Street, the Prime Minister made a simple promise: to get Brexit done.",110,NA,2,51620,201912,english,MARPOR,FALSE,TRUE,FALSE,c5dacb307705350e33bd4ad598eb8010,/down/originals/2020-1/51620_2019.pdf,2352aedf22264cd0db0c2d2495b2238b,TRUE,5,NA,Get Brexit done. Unleash Britain's potential,FALSE,51620_201912
Many said it would be impossible.,305.1,NA,3,51620,201912,english,MARPOR,FALSE,TRUE,FALSE,c5dacb307705350e33bd4ad598eb8010,/down/originals/2020-1/51620_2019.pdf,2352aedf22264cd0db0c2d2495b2238b,TRUE,5,NA,Get Brexit done. Unleash Britain's potential,FALSE,51620_201912
But he swiftly negotiated a great new deal – despite Parliament’s best efforts to block his progress.,305.1,NA,4,51620,201912,english,MARPOR,FALSE,TRUE,FALSE,c5dacb307705350e33bd4ad598eb8010,/down/originals/2020-1/51620_2019.pdf,2352aedf22264cd0db0c2d2495b2238b,TRUE,5,NA,Get Brexit done. Unleash Britain's potential,FALSE,51620_201912
"And then, when he put it to MPs, they insisted on yet more delay.",305.1,NA,5,51620,201912,english,MARPOR,FALSE,TRUE,FALSE,c5dacb307705350e33bd4ad598eb8010,/down/originals/2020-1/51620_2019.pdf,2352aedf22264cd0db0c2d2495b2238b,TRUE,5,NA,Get Brexit done. Unleash Britain's potential,FALSE,51620_201912
We must move on.,110,NA,6,51620,201912,english,MARPOR,FALSE,TRUE,FALSE,c5dacb307705350e33bd4ad598eb8010,/down/originals/2020-1/51620_2019.pdf,2352aedf22264cd0db0c2d2495b2238b,TRUE,5,NA,Get Brexit done. Unleash Britain's potential,FALSE,51620_201912
No more renegotiations.,110,NA,7,51620,201912,english,MARPOR,FALSE,TRUE,FALSE,c5dacb307705350e33bd4ad598eb8010,/down/originals/2020-1/51620_2019.pdf,2352aedf22264cd0db0c2d2495b2238b,TRUE,5,NA,Get Brexit done. Unleash Britain's potential,FALSE,51620_201912
No more referendums.,110,NA,8,51620,201912,english,MARPOR,FALSE,TRUE,FALSE,c5dacb307705350e33bd4ad598eb8010,/down/originals/2020-1/51620_2019.pdf,2352aedf22264cd0db0c2d2495b2238b,TRUE,5,NA,Get Brexit done. Unleash Britain's potential,FALSE,51620_201912
Every week is costing us.,110,NA,9,51620,201912,english,MARPOR,FALSE,TRUE,FALSE,c5dacb307705350e33bd4ad598eb8010,/down/originals/2020-1/51620_2019.pdf,2352aedf22264cd0db0c2d2495b2238b,TRUE,5,NA,Get Brexit done. Unleash Britain's potential,FALSE,51620_201912
Investment is waiting to come into the country.,110,NA,10,51620,201912,english,MARPOR,FALSE,TRUE,FALSE,c5dacb307705350e33bd4ad598eb8010,/down/originals/2020-1/51620_2019.pdf,2352aedf22264cd0db0c2d2495b2238b,TRUE,5,NA,Get Brexit done. Unleash Britain's potential,FALSE,51620_201912
Families and businesses cannot make vital decisions.,110,NA,11,51620,201912,english,MARPOR,FALSE,TRUE,FALSE,c5dacb307705350e33bd4ad598eb8010,/down/originals/2020-1/51620_2019.pdf,2352aedf22264cd0db0c2d2495b2238b,TRUE,5,NA,Get Brexit done. Unleash Britain's potential,FALSE,51620_201912
The public services cannot get the attention they deserve.,110,NA,12,51620,201912,english,MARPOR,FALSE,TRUE,FALSE,c5dacb307705350e33bd4ad598eb8010,/down/originals/2020-1/51620_2019.pdf,2352aedf22264cd0db0c2d2495b2238b,TRUE,5,NA,Get Brexit done. Unleash Britain's potential,FALSE,51620_201912
Our priority as Conservatives is to get Brexit done,110,NA,13,51620,201912,english,MARPOR,FALSE,TRUE,FALSE,c5dacb307705350e33bd4ad598eb8010,/down/originals/2020-1/51620_2019.pdf,2352aedf22264cd0db0c2d2495b2238b,TRUE,5,NA,Get Brexit done. Unleash Britain's potential,FALSE,51620_201912
– so that we can unleash the potential of this great country.,601.1,NA,14,51620,201912,english,MARPOR,FALSE,TRUE,FALSE,c5dacb307705350e33bd4ad598eb8010,/down/originals/2020-1/51620_2019.pdf,2352aedf22264cd0db0c2d2495b2238b,TRUE,5,NA,Get Brexit done. Unleash Britain's potential,FALSE,51620_201912
So that we can push past the obstacles that other parties have put in our country’s way.,305.1,NA,15,51620,201912,english,MARPOR,FALSE,TRUE,FALSE,c5dacb307705350e33bd4ad598eb8010,/down/originals/2020-1/51620_2019.pdf,2352aedf22264cd0db0c2d2495b2238b,TRUE,5,NA,Get Brexit done. Unleash Britain's potential,FALSE,51620_201912
So that we can deliver on the people’s decision in 2016,202.1,NA,16,51620,201912,english,MARPOR,FALSE,TRUE,FALSE,c5dacb307705350e33bd4ad598eb8010,/down/originals/2020-1/51620_2019.pdf,2352aedf22264cd0db0c2d2495b2238b,TRUE,5,NA,Get Brexit done. Unleash Britain's potential,FALSE,51620_201912
and use our new post-Brexit freedoms to transform the UK for the better by focusing on your priorities.,110,NA,17,51620,201912,english,MARPOR,FALSE,TRUE,FALSE,c5dacb307705350e33bd4ad598eb8010,/down/originals/2020-1/51620_2019.pdf,2352aedf22264cd0db0c2d2495b2238b,TRUE,5,NA,Get Brexit done. Unleash Britain's potential,FALSE,51620_201912
"If we elect a majority of Conservative MPs to Parliament, we will start putting our deal through Parliament before Christmas and we will leave the European Union in January.",110,NA,18,51620,201912,english,MARPOR,FALSE,TRUE,FALSE,c5dacb307705350e33bd4ad598eb8010,/down/originals/2020-1/51620_2019.pdf,2352aedf22264cd0db0c2d2495b2238b,TRUE,5,NA,Get Brexit done. Unleash Britain's potential,FALSE,51620_201912
Boris Johnson’s new deal takes the whole country out of the EU as one United Kingdom.,110,NA,19,51620,201912,english,MARPOR,FALSE,TRUE,FALSE,c5dacb307705350e33bd4ad598eb8010,/down/originals/2020-1/51620_2019.pdf,2352aedf22264cd0db0c2d2495b2238b,TRUE,5,NA,Get Brexit done. Unleash Britain's potential,FALSE,51620_201912
"It takes us out of the customs union,",407,NA,20,51620,201912,english,MARPOR,FALSE,TRUE,FALSE,c5dacb307705350e33bd4ad598eb8010,/down/originals/2020-1/51620_2019.pdf,2352aedf22264cd0db0c2d2495b2238b,TRUE,5,NA,Get Brexit done. Unleash Britain's potential,FALSE,51620_201912
allowing us to set our own tariffs,406,NA,21,51620,201912,english,MARPOR,FALSE,TRUE,FALSE,c5dacb307705350e33bd4ad598eb8010,/down/originals/2020-1/51620_2019.pdf,2352aedf22264cd0db0c2d2495b2238b,TRUE,5,NA,Get Brexit done. Unleash Britain's potential,FALSE,51620_201912
and do our own trade deals.,406,NA,22,51620,201912,english,MARPOR,FALSE,TRUE,FALSE,c5dacb307705350e33bd4ad598eb8010,/down/originals/2020-1/51620_2019.pdf,2352aedf22264cd0db0c2d2495b2238b,TRUE,5,NA,Get Brexit done. Unleash Britain's potential,FALSE,51620_201912
It allows us to pass our own laws and ensures that it is our courts that enforce them.,601.1,NA,23,51620,201912,english,MARPOR,FALSE,TRUE,FALSE,c5dacb307705350e33bd4ad598eb8010,/down/originals/2020-1/51620_2019.pdf,2352aedf22264cd0db0c2d2495b2238b,TRUE,5,NA,Get Brexit done. Unleash Britain's potential,FALSE,51620_201912
Our deal is the only one on the table.,305.1,NA,24,51620,201912,english,MARPOR,FALSE,TRUE,FALSE,c5dacb307705350e33bd4ad598eb8010,/down/originals/2020-1/51620_2019.pdf,2352aedf22264cd0db0c2d2495b2238b,TRUE,5,NA,Get Brexit done. Unleash Britain's potential,FALSE,51620_201912
"It is signed, sealed and ready.",305.1,NA,25,51620,201912,english,MARPOR,FALSE,TRUE,FALSE,c5dacb307705350e33bd4ad598eb8010,/down/originals/2020-1/51620_2019.pdf,2352aedf22264cd0db0c2d2495b2238b,TRUE,5,NA,Get Brexit done. Unleash Britain's potential,FALSE,51620_201912
It puts the whole country on a path to a new free trade agreement with the EU.,407,NA,26,51620,201912,english,MARPOR,FALSE,TRUE,FALSE,c5dacb307705350e33bd4ad598eb8010,/down/originals/2020-1/51620_2019.pdf,2352aedf22264cd0db0c2d2495b2238b,TRUE,5,NA,Get Brexit done. Unleash Britain's potential,FALSE,51620_201912
"This will be a new relationship based on free trade and friendly cooperation,",407,NA,27,51620,201912,english,MARPOR,FALSE,TRUE,FALSE,c5dacb307705350e33bd4ad598eb8010,/down/originals/2020-1/51620_2019.pdf,2352aedf22264cd0db0c2d2495b2238b,TRUE,5,NA,Get Brexit done. Unleash Britain's potential,FALSE,51620_201912
not on the EU’s treaties,110,NA,28,51620,201912,english,MARPOR,FALSE,TRUE,FALSE,c5dacb307705350e33bd4ad598eb8010,/down/originals/2020-1/51620_2019.pdf,2352aedf22264cd0db0c2d2495b2238b,TRUE,5,NA,Get Brexit done. Unleash Britain's potential,FALSE,51620_201912
or EU law.,110,NA,29,51620,201912,english,MARPOR,FALSE,TRUE,FALSE,c5dacb307705350e33bd4ad598eb8010,/down/originals/2020-1/51620_2019.pdf,2352aedf22264cd0db0c2d2495b2238b,TRUE,5,NA,Get Brexit done. Unleash Britain's potential,FALSE,51620_201912
There will be no political alignment with the EU.,110,NA,30,51620,201912,english,MARPOR,FALSE,TRUE,FALSE,c5dacb307705350e33bd4ad598eb8010,/down/originals/2020-1/51620_2019.pdf,2352aedf22264cd0db0c2d2495b2238b,TRUE,5,NA,Get Brexit done. Unleash Britain's potential,FALSE,51620_201912
"We will keep the UK out of the single market,",110,NA,31,51620,201912,english,MARPOR,FALSE,TRUE,FALSE,c5dacb307705350e33bd4ad598eb8010,/down/originals/2020-1/51620_2019.pdf,2352aedf22264cd0db0c2d2495b2238b,TRUE,5,NA,Get Brexit done. Unleash Britain's potential,FALSE,51620_201912
"out of any form of customs union,",110,NA,32,51620,201912,english,MARPOR,FALSE,TRUE,FALSE,c5dacb307705350e33bd4ad598eb8010,/down/originals/2020-1/51620_2019.pdf,2352aedf22264cd0db0c2d2495b2238b,TRUE,5,NA,Get Brexit done. Unleash Britain's potential,FALSE,51620_201912
and end the role of the European Court of Justice.,110,NA,33,51620,201912,english,MARPOR,FALSE,TRUE,FALSE,c5dacb307705350e33bd4ad598eb8010,/down/originals/2020-1/51620_2019.pdf,2352aedf22264cd0db0c2d2495b2238b,TRUE,5,NA,Get Brexit done. Unleash Britain's potential,FALSE,51620_201912
This future relationship will be one that allows us to: Take back control of our laws.,601.1,NA,34,51620,201912,english,MARPOR,FALSE,TRUE,FALSE,c5dacb307705350e33bd4ad598eb8010,/down/originals/2020-1/51620_2019.pdf,2352aedf22264cd0db0c2d2495b2238b,TRUE,5,NA,Get Brexit done. Unleash Britain's potential,FALSE,51620_201912
Take back control of our money.,401,NA,35,51620,201912,english,MARPOR,FALSE,TRUE,FALSE,c5dacb307705350e33bd4ad598eb8010,/down/originals/2020-1/51620_2019.pdf,2352aedf22264cd0db0c2d2495b2238b,TRUE,5,NA,Get Brexit done. Unleash Britain's potential,FALSE,51620_201912
Control our own trade policy.,401,NA,36,51620,201912,english,MARPOR,FALSE,TRUE,FALSE,c5dacb307705350e33bd4ad598eb8010,/down/originals/2020-1/51620_2019.pdf,2352aedf22264cd0db0c2d2495b2238b,TRUE,5,NA,Get Brexit done. Unleash Britain's potential,FALSE,51620_201912
Introduce an Australian-style points-based immigration system.,601.2,NA,37,51620,201912,english,MARPOR,FALSE,TRUE,FALSE,c5dacb307705350e33bd4ad598eb8010,/down/originals/2020-1/51620_2019.pdf,2352aedf22264cd0db0c2d2495b2238b,TRUE,5,NA,Get Brexit done. Unleash Britain's potential,FALSE,51620_201912
"Raise standards in areas like workers’ rights,",701,NA,38,51620,201912,english,MARPOR,FALSE,TRUE,FALSE,c5dacb307705350e33bd4ad598eb8010,/down/originals/2020-1/51620_2019.pdf,2352aedf22264cd0db0c2d2495b2238b,TRUE,5,NA,Get Brexit done. Unleash Britain's potential,FALSE,51620_201912
"animal welfare,",501,NA,39,51620,201912,english,MARPOR,FALSE,TRUE,FALSE,c5dacb307705350e33bd4ad598eb8010,/down/originals/2020-1/51620_2019.pdf,2352aedf22264cd0db0c2d2495b2238b,TRUE,5,NA,Get Brexit done. Unleash Britain's potential,FALSE,51620_201912
agriculture,703.1,NA,40,51620,201912,english,MARPOR,FALSE,TRUE,FALSE,c5dacb307705350e33bd4ad598eb8010,/down/originals/2020-1/51620_2019.pdf,2352aedf22264cd0db0c2d2495b2238b,TRUE,5,NA,Get Brexit done. Unleash Britain's potential,FALSE,51620_201912
and the environment.,501,NA,41,51620,201912,english,MARPOR,FALSE,TRUE,FALSE,c5dacb307705350e33bd4ad598eb8010,/down/originals/2020-1/51620_2019.pdf,2352aedf22264cd0db0c2d2495b2238b,TRUE,5,NA,Get Brexit done. Unleash Britain's potential,FALSE,51620_201912
Ensure we are in full control of our fishing waters.,406,NA,42,51620,201912,english,MARPOR,FALSE,TRUE,FALSE,c5dacb307705350e33bd4ad598eb8010,/down/originals/2020-1/51620_2019.pdf,2352aedf22264cd0db0c2d2495b2238b,TRUE,5,NA,Get Brexit done. Unleash Britain's potential,FALSE,51620_201912
We will negotiate a trade agreement next year,407,NA,43,51620,201912,english,MARPOR,FALSE,TRUE,FALSE,c5dacb307705350e33bd4ad598eb8010,/down/originals/2020-1/51620_2019.pdf,2352aedf22264cd0db0c2d2495b2238b,TRUE,5,NA,Get Brexit done. Unleash Britain's potential,FALSE,51620_201912
– one that will strengthen our Union –,601.1,NA,44,51620,201912,english,MARPOR,FALSE,TRUE,FALSE,c5dacb307705350e33bd4ad598eb8010,/down/originals/2020-1/51620_2019.pdf,2352aedf22264cd0db0c2d2495b2238b,TRUE,5,NA,Get Brexit done. Unleash Britain's potential,FALSE,51620_201912
and we will not extend the implementation period beyond December 2020.,110,NA,45,51620,201912,english,MARPOR,FALSE,TRUE,FALSE,c5dacb307705350e33bd4ad598eb8010,/down/originals/2020-1/51620_2019.pdf,2352aedf22264cd0db0c2d2495b2238b,TRUE,5,NA,Get Brexit done. Unleash Britain's potential,FALSE,51620_201912
"In parallel, we will legislate to ensure high standards of workers’ rights,",701,NA,46,51620,201912,english,MARPOR,FALSE,TRUE,FALSE,c5dacb307705350e33bd4ad598eb8010,/down/originals/2020-1/51620_2019.pdf,2352aedf22264cd0db0c2d2495b2238b,TRUE,5,NA,Get Brexit done. Unleash Britain's potential,FALSE,51620_201912
environmental protection,501,NA,47,51620,201912,english,MARPOR,FALSE,TRUE,FALSE,c5dacb307705350e33bd4ad598eb8010,/down/originals/2020-1/51620_2019.pdf,2352aedf22264cd0db0c2d2495b2238b,TRUE,5,NA,Get Brexit done. Unleash Britain's potential,FALSE,51620_201912
and consumer rights.,403,NA,48,51620,201912,english,MARPOR,FALSE,TRUE,FALSE,c5dacb307705350e33bd4ad598eb8010,/down/originals/2020-1/51620_2019.pdf,2352aedf22264cd0db0c2d2495b2238b,TRUE,5,NA,Get Brexit done. Unleash Britain's potential,FALSE,51620_201912
The only way to deliver Brexit is with a Conservative majority in Parliament.,110,NA,49,51620,201912,english,MARPOR,FALSE,TRUE,FALSE,c5dacb307705350e33bd4ad598eb8010,/down/originals/2020-1/51620_2019.pdf,2352aedf22264cd0db0c2d2495b2238b,TRUE,5,NA,Get Brexit done. Unleash Britain's potential,FALSE,51620_201912
A vote for any other party or candidate is a vote for Jeremy Corbyn,305.2,NA,50,51620,201912,english,MARPOR,FALSE,TRUE,FALSE,c5dacb307705350e33bd4ad598eb8010,/down/originals/2020-1/51620_2019.pdf,2352aedf22264cd0db0c2d2495b2238b,TRUE,5,NA,Get Brexit done. Unleash Britain's potential,FALSE,51620_201912
– and a vote for more chaos.,305.3,NA,51,51620,201912,english,MARPOR,FALSE,TRUE,FALSE,c5dacb307705350e33bd4ad598eb8010,/down/originals/2020-1/51620_2019.pdf,2352aedf22264cd0db0c2d2495b2238b,TRUE,5,NA,Get Brexit done. Unleash Britain's potential,FALSE,51620_201912
Unleash Britain’s Potential,H,NA,52,51620,201912,english,MARPOR,FALSE,TRUE,FALSE,c5dacb307705350e33bd4ad598eb8010,/down/originals/2020-1/51620_2019.pdf,2352aedf22264cd0db0c2d2495b2238b,TRUE,5,NA,Get Brexit done. Unleash Britain's potential,FALSE,51620_201912
"For the past nine years, the Conservatives have been cleaning up Labour’s mess.",305.1,NA,53,51620,201912,english,MARPOR,FALSE,TRUE,FALSE,c5dacb307705350e33bd4ad598eb8010,/down/originals/2020-1/51620_2019.pdf,2352aedf22264cd0db0c2d2495b2238b,TRUE,5,NA,Get Brexit done. Unleash Britain's potential,FALSE,51620_201912
"Because of the tough decisions that our party made and our success in bringing down the deficit ,",414,NA,54,51620,201912,english,MARPOR,FALSE,TRUE,FALSE,c5dacb307705350e33bd4ad598eb8010,/down/originals/2020-1/51620_2019.pdf,2352aedf22264cd0db0c2d2495b2238b,TRUE,5,NA,Get Brexit done. Unleash Britain's potential,FALSE,51620_201912
"the economy has continued to grow ,",410,NA,55,51620,201912,english,MARPOR,FALSE,TRUE,FALSE,c5dacb307705350e33bd4ad598eb8010,/down/originals/2020-1/51620_2019.pdf,2352aedf22264cd0db0c2d2495b2238b,TRUE,5,NA,Get Brexit done. Unleash Britain's potential,FALSE,51620_201912
and the public finances have been restored.,414,NA,56,51620,201912,english,MARPOR,FALSE,TRUE,FALSE,c5dacb307705350e33bd4ad598eb8010,/down/originals/2020-1/51620_2019.pdf,2352aedf22264cd0db0c2d2495b2238b,TRUE,5,NA,Get Brexit done. Unleash Britain's potential,FALSE,51620_201912
"Thanks to Conservative policies, employment is at a near-record high.",701,NA,57,51620,201912,english,MARPOR,FALSE,TRUE,FALSE,c5dacb307705350e33bd4ad598eb8010,/down/originals/2020-1/51620_2019.pdf,2352aedf22264cd0db0c2d2495b2238b,TRUE,5,NA,Get Brexit done. Unleash Britain's potential,FALSE,51620_201912
"We’ve helped millions of people into work, halving the unemployment rate.",701,NA,58,51620,201912,english,MARPOR,FALSE,TRUE,FALSE,c5dacb307705350e33bd4ad598eb8010,/down/originals/2020-1/51620_2019.pdf,2352aedf22264cd0db0c2d2495b2238b,TRUE,5,NA,Get Brexit done. Unleash Britain's potential,FALSE,51620_201912
"We’ve doubled the personal allowance to £12,500, meaning that every worker gets to keep more of what they earn.",401,NA,59,51620,201912,english,MARPOR,FALSE,TRUE,FALSE,c5dacb307705350e33bd4ad598eb8010,/down/originals/2020-1/51620_2019.pdf,2352aedf22264cd0db0c2d2495b2238b,TRUE,5,NA,Get Brexit done. Unleash Britain's potential,FALSE,51620_201912
We’ve introduced and consistently raised the National Living Wage,412,NA,60,51620,201912,english,MARPOR,FALSE,TRUE,FALSE,c5dacb307705350e33bd4ad598eb8010,/down/originals/2020-1/51620_2019.pdf,2352aedf22264cd0db0c2d2495b2238b,TRUE,5,NA,Get Brexit done. Unleash Britain's potential,FALSE,51620_201912
– and will raise it still further.,412,NA,61,51620,201912,english,MARPOR,FALSE,TRUE,FALSE,c5dacb307705350e33bd4ad598eb8010,/down/originals/2020-1/51620_2019.pdf,2352aedf22264cd0db0c2d2495b2238b,TRUE,5,NA,Get Brexit done. Unleash Britain's potential,FALSE,51620_201912
The strength of the UK’s balance sheet – the hard work done by all of us in this country – means that we are now in a position to invest properly in our future.,414,NA,62,51620,201912,english,MARPOR,FALSE,TRUE,FALSE,c5dacb307705350e33bd4ad598eb8010,/down/originals/2020-1/51620_2019.pdf,2352aedf22264cd0db0c2d2495b2238b,TRUE,5,NA,Get Brexit done. Unleash Britain's potential,FALSE,51620_201912
"A Conservative Government will give the public services the resources they need, supporting our hospitals,",504,NA,63,51620,201912,english,MARPOR,FALSE,TRUE,FALSE,c5dacb307705350e33bd4ad598eb8010,/down/originals/2020-1/51620_2019.pdf,2352aedf22264cd0db0c2d2495b2238b,TRUE,5,NA,Get Brexit done. Unleash Britain's potential,FALSE,51620_201912
our schools,506,NA,64,51620,201912,english,MARPOR,FALSE,TRUE,FALSE,c5dacb307705350e33bd4ad598eb8010,/down/originals/2020-1/51620_2019.pdf,2352aedf22264cd0db0c2d2495b2238b,TRUE,5,NA,Get Brexit done. Unleash Britain's potential,FALSE,51620_201912
and our police.,605.1,NA,65,51620,201912,english,MARPOR,FALSE,TRUE,FALSE,c5dacb307705350e33bd4ad598eb8010,/down/originals/2020-1/51620_2019.pdf,2352aedf22264cd0db0c2d2495b2238b,TRUE,5,NA,Get Brexit done. Unleash Britain's potential,FALSE,51620_201912
We will help people and families throughout their lives by bringing down the cost of living,503,NA,66,51620,201912,english,MARPOR,FALSE,TRUE,FALSE,c5dacb307705350e33bd4ad598eb8010,/down/originals/2020-1/51620_2019.pdf,2352aedf22264cd0db0c2d2495b2238b,TRUE,5,NA,Get Brexit done. Unleash Britain's potential,FALSE,51620_201912
and making sure that work always pays.,701,NA,67,51620,201912,english,MARPOR,FALSE,TRUE,FALSE,c5dacb307705350e33bd4ad598eb8010,/down/originals/2020-1/51620_2019.pdf,2352aedf22264cd0db0c2d2495b2238b,TRUE,5,NA,Get Brexit done. Unleash Britain's potential,FALSE,51620_201912
We will keep costs down for small businesses – rather than hiking their taxes and crushing Britain’s prosperity.,403,NA,68,51620,201912,english,MARPOR,FALSE,TRUE,FALSE,c5dacb307705350e33bd4ad598eb8010,/down/originals/2020-1/51620_2019.pdf,2352aedf22264cd0db0c2d2495b2238b,TRUE,5,NA,Get Brexit done. Unleash Britain's potential,FALSE,51620_201912
"We will not borrow to fund day-to-day spending,",414,NA,69,51620,201912,english,MARPOR,FALSE,TRUE,FALSE,c5dacb307705350e33bd4ad598eb8010,/down/originals/2020-1/51620_2019.pdf,2352aedf22264cd0db0c2d2495b2238b,TRUE,5,NA,Get Brexit done. Unleash Britain's potential,FALSE,51620_201912
but will invest thoughtfully and responsibly in infrastructure right across our country,411,NA,70,51620,201912,english,MARPOR,FALSE,TRUE,FALSE,c5dacb307705350e33bd4ad598eb8010,/down/originals/2020-1/51620_2019.pdf,2352aedf22264cd0db0c2d2495b2238b,TRUE,5,NA,Get Brexit done. Unleash Britain's potential,FALSE,51620_201912
in order to increase productivity and,410,NA,71,51620,201912,english,MARPOR,FALSE,TRUE,FALSE,c5dacb307705350e33bd4ad598eb8010,/down/originals/2020-1/51620_2019.pdf,2352aedf22264cd0db0c2d2495b2238b,TRUE,5,NA,Get Brexit done. Unleash Britain's potential,FALSE,51620_201912
wages.,701,NA,72,51620,201912,english,MARPOR,FALSE,TRUE,FALSE,c5dacb307705350e33bd4ad598eb8010,/down/originals/2020-1/51620_2019.pdf,2352aedf22264cd0db0c2d2495b2238b,TRUE,5,NA,Get Brexit done. Unleash Britain's potential,FALSE,51620_201912
"Our fiscal rules mean that public sector net investment will not average more than 3 per cent of GDP,",414,NA,73,51620,201912,english,MARPOR,FALSE,TRUE,FALSE,c5dacb307705350e33bd4ad598eb8010,/down/originals/2020-1/51620_2019.pdf,2352aedf22264cd0db0c2d2495b2238b,TRUE,5,NA,Get Brexit done. Unleash Britain's potential,FALSE,51620_201912
"and that if debt interest reaches 6 per cent of revenue, we will reassess our plans to keep debt under control.",414,NA,74,51620,201912,english,MARPOR,FALSE,TRUE,FALSE,c5dacb307705350e33bd4ad598eb8010,/down/originals/2020-1/51620_2019.pdf,2352aedf22264cd0db0c2d2495b2238b,TRUE,5,NA,Get Brexit done. Unleash Britain's potential,FALSE,51620_201912
This means that debt will be lower at the end of the Parliament –,414,NA,75,51620,201912,english,MARPOR,FALSE,TRUE,FALSE,c5dacb307705350e33bd4ad598eb8010,/down/originals/2020-1/51620_2019.pdf,2352aedf22264cd0db0c2d2495b2238b,TRUE,5,NA,Get Brexit done. Unleash Britain's potential,FALSE,51620_201912
rather than spiralling out of control under Labour.,305.1,NA,76,51620,201912,english,MARPOR,FALSE,TRUE,FALSE,c5dacb307705350e33bd4ad598eb8010,/down/originals/2020-1/51620_2019.pdf,2352aedf22264cd0db0c2d2495b2238b,TRUE,5,NA,Get Brexit done. Unleash Britain's potential,FALSE,51620_201912
"And we will use this investment prudently and strategically to level up every part of the United Kingdom,",414,NA,77,51620,201912,english,MARPOR,FALSE,TRUE,FALSE,c5dacb307705350e33bd4ad598eb8010,/down/originals/2020-1/51620_2019.pdf,2352aedf22264cd0db0c2d2495b2238b,TRUE,5,NA,Get Brexit done. Unleash Britain's potential,FALSE,51620_201912
while strengthening the ties that bind it together.,601.1,NA,78,51620,201912,english,MARPOR,FALSE,TRUE,FALSE,c5dacb307705350e33bd4ad598eb8010,/down/originals/2020-1/51620_2019.pdf,2352aedf22264cd0db0c2d2495b2238b,TRUE,5,NA,Get Brexit done. Unleash Britain's potential,FALSE,51620_201912
"We will also prioritise the environment in the next Budget,",501,NA,79,51620,201912,english,MARPOR,FALSE,TRUE,FALSE,c5dacb307705350e33bd4ad598eb8010,/down/originals/2020-1/51620_2019.pdf,2352aedf22264cd0db0c2d2495b2238b,TRUE,5,NA,Get Brexit done. Unleash Britain's potential,FALSE,51620_201912
"investing in the infrastructure, science and research that will deliver economic growth, not just through the 2020s, but for decades to come.",411,NA,80,51620,201912,english,MARPOR,FALSE,TRUE,FALSE,c5dacb307705350e33bd4ad598eb8010,/down/originals/2020-1/51620_2019.pdf,2352aedf22264cd0db0c2d2495b2238b,TRUE,5,NA,Get Brexit done. Unleash Britain's potential,FALSE,51620_201912
"Above all, we will listen to the people who have felt left behind by the last few decades of economic growth and want to have more control of their future.",503,NA,81,51620,201912,english,MARPOR,FALSE,TRUE,FALSE,c5dacb307705350e33bd4ad598eb8010,/down/originals/2020-1/51620_2019.pdf,2352aedf22264cd0db0c2d2495b2238b,TRUE,5,NA,Get Brexit done. Unleash Britain's potential,FALSE,51620_201912
"We will get Brexit done, so we can unleash Britain’s potential.",110,NA,82,51620,201912,english,MARPOR,FALSE,TRUE,FALSE,c5dacb307705350e33bd4ad598eb8010,/down/originals/2020-1/51620_2019.pdf,2352aedf22264cd0db0c2d2495b2238b,TRUE,5,NA,Get Brexit done. Unleash Britain's potential,FALSE,51620_201912
so we can unleash Britain’s potential.,601.1,NA,83,51620,201912,english,MARPOR,FALSE,TRUE,FALSE,c5dacb307705350e33bd4ad598eb8010,/down/originals/2020-1/51620_2019.pdf,2352aedf22264cd0db0c2d2495b2238b,TRUE,5,NA,Get Brexit done. Unleash Britain's potential,FALSE,51620_201912
We Will Focus On Your Priorities,H,NA,84,51620,201912,english,MARPOR,FALSE,TRUE,FALSE,c5dacb307705350e33bd4ad598eb8010,/down/originals/2020-1/51620_2019.pdf,2352aedf22264cd0db0c2d2495b2238b,TRUE,5,NA,Get Brexit done. Unleash Britain's potential,FALSE,51620_201912
"In his first months in office, the Prime Minister has shown how he intends to make life better for everyone in the UK.",503,NA,85,51620,201912,english,MARPOR,FALSE,TRUE,FALSE,c5dacb307705350e33bd4ad598eb8010,/down/originals/2020-1/51620_2019.pdf,2352aedf22264cd0db0c2d2495b2238b,TRUE,5,NA,Get Brexit done. Unleash Britain's potential,FALSE,51620_201912
Supporting our police.,605.1,NA,86,51620,201912,english,MARPOR,FALSE,TRUE,FALSE,c5dacb307705350e33bd4ad598eb8010,/down/originals/2020-1/51620_2019.pdf,2352aedf22264cd0db0c2d2495b2238b,TRUE,5,NA,Get Brexit done. Unleash Britain's potential,FALSE,51620_201912
Increasing funding for our schools.,505,NA,87,51620,201912,english,MARPOR,FALSE,TRUE,FALSE,c5dacb307705350e33bd4ad598eb8010,/down/originals/2020-1/51620_2019.pdf,2352aedf22264cd0db0c2d2495b2238b,TRUE,5,NA,Get Brexit done. Unleash Britain's potential,FALSE,51620_201912
