text,cmp_code,eu_code,pos,party,date,language,source,has_eu_code,is_primary_doc,may_contradict_core_dataset,md5sum_text,url_original,md5sum_original,annotations,handbook,is_copy_of,title,translation_en,id
and providing necessary mechanisms of redress for tenants.,403,NA,630,51620,201912,english,MARPOR,FALSE,TRUE,FALSE,c5dacb307705350e33bd4ad598eb8010,/down/originals/2020-1/51620_2019.pdf,2352aedf22264cd0db0c2d2495b2238b,TRUE,5,NA,Get Brexit done. Unleash Britain's potential,FALSE,51620_201912
"We will bring in a Better Deal for Renters, including abolishing ‘no fault’ evictions",403,NA,631,51620,201912,english,MARPOR,FALSE,TRUE,FALSE,c5dacb307705350e33bd4ad598eb8010,/down/originals/2020-1/51620_2019.pdf,2352aedf22264cd0db0c2d2495b2238b,TRUE,5,NA,Get Brexit done. Unleash Britain's potential,FALSE,51620_201912
and only requiring one ‘lifetime’ deposit which moves with the tenant.,403,NA,632,51620,201912,english,MARPOR,FALSE,TRUE,FALSE,c5dacb307705350e33bd4ad598eb8010,/down/originals/2020-1/51620_2019.pdf,2352aedf22264cd0db0c2d2495b2238b,TRUE,5,NA,Get Brexit done. Unleash Britain's potential,FALSE,51620_201912
This will create a fairer rental market:,403,NA,633,51620,201912,english,MARPOR,FALSE,TRUE,FALSE,c5dacb307705350e33bd4ad598eb8010,/down/originals/2020-1/51620_2019.pdf,2352aedf22264cd0db0c2d2495b2238b,TRUE,5,NA,Get Brexit done. Unleash Britain's potential,FALSE,51620_201912
"if you’re a tenant, you will be protected from revenge evictions and rogue landlords,",403,NA,634,51620,201912,english,MARPOR,FALSE,TRUE,FALSE,c5dacb307705350e33bd4ad598eb8010,/down/originals/2020-1/51620_2019.pdf,2352aedf22264cd0db0c2d2495b2238b,TRUE,5,NA,Get Brexit done. Unleash Britain's potential,FALSE,51620_201912
"and if you’re one of the many good landlords, we will strengthen your rights of possession.",201.1,NA,635,51620,201912,english,MARPOR,FALSE,TRUE,FALSE,c5dacb307705350e33bd4ad598eb8010,/down/originals/2020-1/51620_2019.pdf,2352aedf22264cd0db0c2d2495b2238b,TRUE,5,NA,Get Brexit done. Unleash Britain's potential,FALSE,51620_201912
Deliver the housing people need,H,NA,636,51620,201912,english,MARPOR,FALSE,TRUE,FALSE,c5dacb307705350e33bd4ad598eb8010,/down/originals/2020-1/51620_2019.pdf,2352aedf22264cd0db0c2d2495b2238b,TRUE,5,NA,Get Brexit done. Unleash Britain's potential,FALSE,51620_201912
Home ownership is one of the most fundamental Conservative values.,401,NA,637,51620,201912,english,MARPOR,FALSE,TRUE,FALSE,c5dacb307705350e33bd4ad598eb8010,/down/originals/2020-1/51620_2019.pdf,2352aedf22264cd0db0c2d2495b2238b,TRUE,5,NA,Get Brexit done. Unleash Britain's potential,FALSE,51620_201912
"People are happier, more secure and more rooted in their communities when they own their own home – and know that they can pass it on to future generations.",401,NA,638,51620,201912,english,MARPOR,FALSE,TRUE,FALSE,c5dacb307705350e33bd4ad598eb8010,/down/originals/2020-1/51620_2019.pdf,2352aedf22264cd0db0c2d2495b2238b,TRUE,5,NA,Get Brexit done. Unleash Britain's potential,FALSE,51620_201912
"For the UK to unleash its potential, young people need the security of knowing that home ownership is within their reach – that they too can have a tangible stake in society,",403,NA,639,51620,201912,english,MARPOR,FALSE,TRUE,FALSE,c5dacb307705350e33bd4ad598eb8010,/down/originals/2020-1/51620_2019.pdf,2352aedf22264cd0db0c2d2495b2238b,TRUE,5,NA,Get Brexit done. Unleash Britain's potential,FALSE,51620_201912
can be rooted in their communities,606.1,NA,640,51620,201912,english,MARPOR,FALSE,TRUE,FALSE,c5dacb307705350e33bd4ad598eb8010,/down/originals/2020-1/51620_2019.pdf,2352aedf22264cd0db0c2d2495b2238b,TRUE,5,NA,Get Brexit done. Unleash Britain's potential,FALSE,51620_201912
and have a place to raise a family.,603,NA,641,51620,201912,english,MARPOR,FALSE,TRUE,FALSE,c5dacb307705350e33bd4ad598eb8010,/down/originals/2020-1/51620_2019.pdf,2352aedf22264cd0db0c2d2495b2238b,TRUE,5,NA,Get Brexit done. Unleash Britain's potential,FALSE,51620_201912
A majority Conservative Government will continue to increase the number of homes being built.,410,NA,642,51620,201912,english,MARPOR,FALSE,TRUE,FALSE,c5dacb307705350e33bd4ad598eb8010,/down/originals/2020-1/51620_2019.pdf,2352aedf22264cd0db0c2d2495b2238b,TRUE,5,NA,Get Brexit done. Unleash Britain's potential,FALSE,51620_201912
But we must also rebalance the housing market towards more home ownership –,401,NA,643,51620,201912,english,MARPOR,FALSE,TRUE,FALSE,c5dacb307705350e33bd4ad598eb8010,/down/originals/2020-1/51620_2019.pdf,2352aedf22264cd0db0c2d2495b2238b,TRUE,5,NA,Get Brexit done. Unleash Britain's potential,FALSE,51620_201912
while ensuring fairness for the new generation of renters.,403,NA,644,51620,201912,english,MARPOR,FALSE,TRUE,FALSE,c5dacb307705350e33bd4ad598eb8010,/down/originals/2020-1/51620_2019.pdf,2352aedf22264cd0db0c2d2495b2238b,TRUE,5,NA,Get Brexit done. Unleash Britain's potential,FALSE,51620_201912
"While we want to encourage as many people as possible into home ownership,",401,NA,645,51620,201912,english,MARPOR,FALSE,TRUE,FALSE,c5dacb307705350e33bd4ad598eb8010,/down/originals/2020-1/51620_2019.pdf,2352aedf22264cd0db0c2d2495b2238b,TRUE,5,NA,Get Brexit done. Unleash Britain's potential,FALSE,51620_201912
"we recognise that not everyone can afford their own home – and that those in social housing deserve the same dignity, respect and fair treatment as private renters.",503,NA,646,51620,201912,english,MARPOR,FALSE,TRUE,FALSE,c5dacb307705350e33bd4ad598eb8010,/down/originals/2020-1/51620_2019.pdf,2352aedf22264cd0db0c2d2495b2238b,TRUE,5,NA,Get Brexit done. Unleash Britain's potential,FALSE,51620_201912
"As Boris Johnson has promised, we will bring forward a Social Housing White Paper which will set out further measures to empower tenants and support the continued supply of social homes.",504,NA,647,51620,201912,english,MARPOR,FALSE,TRUE,FALSE,c5dacb307705350e33bd4ad598eb8010,/down/originals/2020-1/51620_2019.pdf,2352aedf22264cd0db0c2d2495b2238b,TRUE,5,NA,Get Brexit done. Unleash Britain's potential,FALSE,51620_201912
"This will include measures to provide greater redress,",403,NA,648,51620,201912,english,MARPOR,FALSE,TRUE,FALSE,c5dacb307705350e33bd4ad598eb8010,/down/originals/2020-1/51620_2019.pdf,2352aedf22264cd0db0c2d2495b2238b,TRUE,5,NA,Get Brexit done. Unleash Britain's potential,FALSE,51620_201912
better regulation,403,NA,649,51620,201912,english,MARPOR,FALSE,TRUE,FALSE,c5dacb307705350e33bd4ad598eb8010,/down/originals/2020-1/51620_2019.pdf,2352aedf22264cd0db0c2d2495b2238b,TRUE,5,NA,Get Brexit done. Unleash Britain's potential,FALSE,51620_201912
and improve the quality of social housing.,504,NA,650,51620,201912,english,MARPOR,FALSE,TRUE,FALSE,c5dacb307705350e33bd4ad598eb8010,/down/originals/2020-1/51620_2019.pdf,2352aedf22264cd0db0c2d2495b2238b,TRUE,5,NA,Get Brexit done. Unleash Britain's potential,FALSE,51620_201912
"We will also commit to renewing the Affordable Homes Programme, in order to support the delivery of hundreds of thousands of affordable homes.",403,NA,651,51620,201912,english,MARPOR,FALSE,TRUE,FALSE,c5dacb307705350e33bd4ad598eb8010,/down/originals/2020-1/51620_2019.pdf,2352aedf22264cd0db0c2d2495b2238b,TRUE,5,NA,Get Brexit done. Unleash Britain's potential,FALSE,51620_201912
"This is a key part of our efforts to prevent people from falling into homelessness,",504,NA,652,51620,201912,english,MARPOR,FALSE,TRUE,FALSE,c5dacb307705350e33bd4ad598eb8010,/down/originals/2020-1/51620_2019.pdf,2352aedf22264cd0db0c2d2495b2238b,TRUE,5,NA,Get Brexit done. Unleash Britain's potential,FALSE,51620_201912
along with fully enforcing the Homelessness Reduction Act.,504,NA,653,51620,201912,english,MARPOR,FALSE,TRUE,FALSE,c5dacb307705350e33bd4ad598eb8010,/down/originals/2020-1/51620_2019.pdf,2352aedf22264cd0db0c2d2495b2238b,TRUE,5,NA,Get Brexit done. Unleash Britain's potential,FALSE,51620_201912
"We will also end the blight of rough sleeping by the end of the next Parliament by expanding successful pilots and programmes such as the Rough Sleeping Initiative and Housing First,",504,NA,654,51620,201912,english,MARPOR,FALSE,TRUE,FALSE,c5dacb307705350e33bd4ad598eb8010,/down/originals/2020-1/51620_2019.pdf,2352aedf22264cd0db0c2d2495b2238b,TRUE,5,NA,Get Brexit done. Unleash Britain's potential,FALSE,51620_201912
and working to bring together local services to meet the health and housing needs of people sleeping on the streets.,504,NA,655,51620,201912,english,MARPOR,FALSE,TRUE,FALSE,c5dacb307705350e33bd4ad598eb8010,/down/originals/2020-1/51620_2019.pdf,2352aedf22264cd0db0c2d2495b2238b,TRUE,5,NA,Get Brexit done. Unleash Britain's potential,FALSE,51620_201912
We will help pay for this by bringing in a stamp duty surcharge on non-UK resident buyers.,403,NA,656,51620,201912,english,MARPOR,FALSE,TRUE,FALSE,c5dacb307705350e33bd4ad598eb8010,/down/originals/2020-1/51620_2019.pdf,2352aedf22264cd0db0c2d2495b2238b,TRUE,5,NA,Get Brexit done. Unleash Britain's potential,FALSE,51620_201912
Places we want to live in,H,NA,657,51620,201912,english,MARPOR,FALSE,TRUE,FALSE,c5dacb307705350e33bd4ad598eb8010,/down/originals/2020-1/51620_2019.pdf,2352aedf22264cd0db0c2d2495b2238b,TRUE,5,NA,Get Brexit done. Unleash Britain's potential,FALSE,51620_201912
Since 2010 there has been a considerable increase in homebuilding.,404,NA,658,51620,201912,english,MARPOR,FALSE,TRUE,FALSE,c5dacb307705350e33bd4ad598eb8010,/down/originals/2020-1/51620_2019.pdf,2352aedf22264cd0db0c2d2495b2238b,TRUE,5,NA,Get Brexit done. Unleash Britain's potential,FALSE,51620_201912
We have delivered a million homes in the last five years in England:,404,NA,659,51620,201912,english,MARPOR,FALSE,TRUE,FALSE,c5dacb307705350e33bd4ad598eb8010,/down/originals/2020-1/51620_2019.pdf,2352aedf22264cd0db0c2d2495b2238b,TRUE,5,NA,Get Brexit done. Unleash Britain's potential,FALSE,51620_201912
"last year, we delivered the highest number of homes for almost 30 years.",404,NA,660,51620,201912,english,MARPOR,FALSE,TRUE,FALSE,c5dacb307705350e33bd4ad598eb8010,/down/originals/2020-1/51620_2019.pdf,2352aedf22264cd0db0c2d2495b2238b,TRUE,5,NA,Get Brexit done. Unleash Britain's potential,FALSE,51620_201912
But it still isn’t enough.,404,NA,661,51620,201912,english,MARPOR,FALSE,TRUE,FALSE,c5dacb307705350e33bd4ad598eb8010,/down/originals/2020-1/51620_2019.pdf,2352aedf22264cd0db0c2d2495b2238b,TRUE,5,NA,Get Brexit done. Unleash Britain's potential,FALSE,51620_201912
"That is why we will continue our progress towards our target of 300,000 homes a year by the mid-2020s.",404,NA,662,51620,201912,english,MARPOR,FALSE,TRUE,FALSE,c5dacb307705350e33bd4ad598eb8010,/down/originals/2020-1/51620_2019.pdf,2352aedf22264cd0db0c2d2495b2238b,TRUE,5,NA,Get Brexit done. Unleash Britain's potential,FALSE,51620_201912
"This will see us build at least a million more homes, of all tenures, over the next Parliament – in the areas that really need them.",403,NA,663,51620,201912,english,MARPOR,FALSE,TRUE,FALSE,c5dacb307705350e33bd4ad598eb8010,/down/originals/2020-1/51620_2019.pdf,2352aedf22264cd0db0c2d2495b2238b,TRUE,5,NA,Get Brexit done. Unleash Britain's potential,FALSE,51620_201912
"And we will make the planning system simpler for the public and small builders,",303,NA,664,51620,201912,english,MARPOR,FALSE,TRUE,FALSE,c5dacb307705350e33bd4ad598eb8010,/down/originals/2020-1/51620_2019.pdf,2352aedf22264cd0db0c2d2495b2238b,TRUE,5,NA,Get Brexit done. Unleash Britain's potential,FALSE,51620_201912
and support modern methods of construction.,411,NA,665,51620,201912,english,MARPOR,FALSE,TRUE,FALSE,c5dacb307705350e33bd4ad598eb8010,/down/originals/2020-1/51620_2019.pdf,2352aedf22264cd0db0c2d2495b2238b,TRUE,5,NA,Get Brexit done. Unleash Britain's potential,FALSE,51620_201912
"Crucially, however, we need to make sure homes are built in a way that makes sense for the people already living in the area and for the families moving in:",416.2,NA,666,51620,201912,english,MARPOR,FALSE,TRUE,FALSE,c5dacb307705350e33bd4ad598eb8010,/down/originals/2020-1/51620_2019.pdf,2352aedf22264cd0db0c2d2495b2238b,TRUE,5,NA,Get Brexit done. Unleash Britain's potential,FALSE,51620_201912
Infrastructure first.,H,NA,667,51620,201912,english,MARPOR,FALSE,TRUE,FALSE,c5dacb307705350e33bd4ad598eb8010,/down/originals/2020-1/51620_2019.pdf,2352aedf22264cd0db0c2d2495b2238b,TRUE,5,NA,Get Brexit done. Unleash Britain's potential,FALSE,51620_201912
"We will amend planning rules so that the infrastructure – roads, schools, GP surgeries – comes before people move into new homes.",411,NA,668,51620,201912,english,MARPOR,FALSE,TRUE,FALSE,c5dacb307705350e33bd4ad598eb8010,/down/originals/2020-1/51620_2019.pdf,2352aedf22264cd0db0c2d2495b2238b,TRUE,5,NA,Get Brexit done. Unleash Britain's potential,FALSE,51620_201912
And our new £10 billion Single Housing Infrastructure Fund will help deliver it faster.,411,NA,669,51620,201912,english,MARPOR,FALSE,TRUE,FALSE,c5dacb307705350e33bd4ad598eb8010,/down/originals/2020-1/51620_2019.pdf,2352aedf22264cd0db0c2d2495b2238b,TRUE,5,NA,Get Brexit done. Unleash Britain's potential,FALSE,51620_201912
"Beautiful, high-quality homes.",H,NA,670,51620,201912,english,MARPOR,FALSE,TRUE,FALSE,c5dacb307705350e33bd4ad598eb8010,/down/originals/2020-1/51620_2019.pdf,2352aedf22264cd0db0c2d2495b2238b,TRUE,5,NA,Get Brexit done. Unleash Britain's potential,FALSE,51620_201912
"We will ask every community to decide on its own design standards for new development, allowing residents a greater say on the style and design of development in their area,",416.2,NA,671,51620,201912,english,MARPOR,FALSE,TRUE,FALSE,c5dacb307705350e33bd4ad598eb8010,/down/originals/2020-1/51620_2019.pdf,2352aedf22264cd0db0c2d2495b2238b,TRUE,5,NA,Get Brexit done. Unleash Britain's potential,FALSE,51620_201912
with local councils encouraged to build more beautiful architecture.,416.2,NA,672,51620,201912,english,MARPOR,FALSE,TRUE,FALSE,c5dacb307705350e33bd4ad598eb8010,/down/originals/2020-1/51620_2019.pdf,2352aedf22264cd0db0c2d2495b2238b,TRUE,5,NA,Get Brexit done. Unleash Britain's potential,FALSE,51620_201912
Building safety.,H,NA,673,51620,201912,english,MARPOR,FALSE,TRUE,FALSE,c5dacb307705350e33bd4ad598eb8010,/down/originals/2020-1/51620_2019.pdf,2352aedf22264cd0db0c2d2495b2238b,TRUE,5,NA,Get Brexit done. Unleash Britain's potential,FALSE,51620_201912
Following the Grenfell tragedy there has rightly been a focus on building safety.,403,NA,674,51620,201912,english,MARPOR,FALSE,TRUE,FALSE,c5dacb307705350e33bd4ad598eb8010,/down/originals/2020-1/51620_2019.pdf,2352aedf22264cd0db0c2d2495b2238b,TRUE,5,NA,Get Brexit done. Unleash Britain's potential,FALSE,51620_201912
"No report or review can truly capture the heartache, sorrow, anger and grief that many people feel.",503,NA,675,51620,201912,english,MARPOR,FALSE,TRUE,FALSE,c5dacb307705350e33bd4ad598eb8010,/down/originals/2020-1/51620_2019.pdf,2352aedf22264cd0db0c2d2495b2238b,TRUE,5,NA,Get Brexit done. Unleash Britain's potential,FALSE,51620_201912
We have already committed to implementing and legislating for all the recommendations of the Hackitt Review and the first phase of the independent inquiry.,403,NA,676,51620,201912,english,MARPOR,FALSE,TRUE,FALSE,c5dacb307705350e33bd4ad598eb8010,/down/originals/2020-1/51620_2019.pdf,2352aedf22264cd0db0c2d2495b2238b,TRUE,5,NA,Get Brexit done. Unleash Britain's potential,FALSE,51620_201912
"We will continue to work with industry, housing associations and individuals to ensure every home is safe and secure.",403,NA,677,51620,201912,english,MARPOR,FALSE,TRUE,FALSE,c5dacb307705350e33bd4ad598eb8010,/down/originals/2020-1/51620_2019.pdf,2352aedf22264cd0db0c2d2495b2238b,TRUE,5,NA,Get Brexit done. Unleash Britain's potential,FALSE,51620_201912
"And we will support high rise residential residents with the removal of unsafe cladding,",403,NA,678,51620,201912,english,MARPOR,FALSE,TRUE,FALSE,c5dacb307705350e33bd4ad598eb8010,/down/originals/2020-1/51620_2019.pdf,2352aedf22264cd0db0c2d2495b2238b,TRUE,5,NA,Get Brexit done. Unleash Britain's potential,FALSE,51620_201912
and continue with our rigorous process of materials testing.,403,NA,679,51620,201912,english,MARPOR,FALSE,TRUE,FALSE,c5dacb307705350e33bd4ad598eb8010,/down/originals/2020-1/51620_2019.pdf,2352aedf22264cd0db0c2d2495b2238b,TRUE,5,NA,Get Brexit done. Unleash Britain's potential,FALSE,51620_201912
Community housing and self-build.,H,NA,680,51620,201912,english,MARPOR,FALSE,TRUE,FALSE,c5dacb307705350e33bd4ad598eb8010,/down/originals/2020-1/51620_2019.pdf,2352aedf22264cd0db0c2d2495b2238b,TRUE,5,NA,Get Brexit done. Unleash Britain's potential,FALSE,51620_201912
We will support community housing by helping people who want to build their own homes find plots of land and access the Help to Buy scheme.,401,NA,681,51620,201912,english,MARPOR,FALSE,TRUE,FALSE,c5dacb307705350e33bd4ad598eb8010,/down/originals/2020-1/51620_2019.pdf,2352aedf22264cd0db0c2d2495b2238b,TRUE,5,NA,Get Brexit done. Unleash Britain's potential,FALSE,51620_201912
We will also support communities living on council estates who want to take ownership of the land and buildings they live in.,505,NA,682,51620,201912,english,MARPOR,FALSE,TRUE,FALSE,c5dacb307705350e33bd4ad598eb8010,/down/originals/2020-1/51620_2019.pdf,2352aedf22264cd0db0c2d2495b2238b,TRUE,5,NA,Get Brexit done. Unleash Britain's potential,FALSE,51620_201912
Environmentally friendly homes.,H,NA,683,51620,201912,english,MARPOR,FALSE,TRUE,FALSE,c5dacb307705350e33bd4ad598eb8010,/down/originals/2020-1/51620_2019.pdf,2352aedf22264cd0db0c2d2495b2238b,TRUE,5,NA,Get Brexit done. Unleash Britain's potential,FALSE,51620_201912
We will support the creation of new kinds of homes that have low energy bills,416.2,NA,684,51620,201912,english,MARPOR,FALSE,TRUE,FALSE,c5dacb307705350e33bd4ad598eb8010,/down/originals/2020-1/51620_2019.pdf,2352aedf22264cd0db0c2d2495b2238b,TRUE,5,NA,Get Brexit done. Unleash Britain's potential,FALSE,51620_201912
and which support our environmental targets,501,NA,685,51620,201912,english,MARPOR,FALSE,TRUE,FALSE,c5dacb307705350e33bd4ad598eb8010,/down/originals/2020-1/51620_2019.pdf,2352aedf22264cd0db0c2d2495b2238b,TRUE,5,NA,Get Brexit done. Unleash Britain's potential,FALSE,51620_201912
and will expect all new streets to be lined with trees.,501,NA,686,51620,201912,english,MARPOR,FALSE,TRUE,FALSE,c5dacb307705350e33bd4ad598eb8010,/down/originals/2020-1/51620_2019.pdf,2352aedf22264cd0db0c2d2495b2238b,TRUE,5,NA,Get Brexit done. Unleash Britain's potential,FALSE,51620_201912
Homes for the Future.,H,NA,687,51620,201912,english,MARPOR,FALSE,TRUE,FALSE,c5dacb307705350e33bd4ad598eb8010,/down/originals/2020-1/51620_2019.pdf,2352aedf22264cd0db0c2d2495b2238b,TRUE,5,NA,Get Brexit done. Unleash Britain's potential,FALSE,51620_201912
"We will encourage innovative design and technology to make housing more affordable, accessible, and suitable for disabled people",503,NA,688,51620,201912,english,MARPOR,FALSE,TRUE,FALSE,c5dacb307705350e33bd4ad598eb8010,/down/originals/2020-1/51620_2019.pdf,2352aedf22264cd0db0c2d2495b2238b,TRUE,5,NA,Get Brexit done. Unleash Britain's potential,FALSE,51620_201912
and an ageing population.,706,NA,689,51620,201912,english,MARPOR,FALSE,TRUE,FALSE,c5dacb307705350e33bd4ad598eb8010,/down/originals/2020-1/51620_2019.pdf,2352aedf22264cd0db0c2d2495b2238b,TRUE,5,NA,Get Brexit done. Unleash Britain's potential,FALSE,51620_201912
The Green Belt.,H,NA,690,51620,201912,english,MARPOR,FALSE,TRUE,FALSE,c5dacb307705350e33bd4ad598eb8010,/down/originals/2020-1/51620_2019.pdf,2352aedf22264cd0db0c2d2495b2238b,TRUE,5,NA,Get Brexit done. Unleash Britain's potential,FALSE,51620_201912
We will protect and enhance the Green Belt.,501,NA,691,51620,201912,english,MARPOR,FALSE,TRUE,FALSE,c5dacb307705350e33bd4ad598eb8010,/down/originals/2020-1/51620_2019.pdf,2352aedf22264cd0db0c2d2495b2238b,TRUE,5,NA,Get Brexit done. Unleash Britain's potential,FALSE,51620_201912
"We will improve poor quality land,",501,NA,692,51620,201912,english,MARPOR,FALSE,TRUE,FALSE,c5dacb307705350e33bd4ad598eb8010,/down/originals/2020-1/51620_2019.pdf,2352aedf22264cd0db0c2d2495b2238b,TRUE,5,NA,Get Brexit done. Unleash Britain's potential,FALSE,51620_201912
increase biodiversity,501,NA,693,51620,201912,english,MARPOR,FALSE,TRUE,FALSE,c5dacb307705350e33bd4ad598eb8010,/down/originals/2020-1/51620_2019.pdf,2352aedf22264cd0db0c2d2495b2238b,TRUE,5,NA,Get Brexit done. Unleash Britain's potential,FALSE,51620_201912
and make our beautiful countryside more accessible for local community use.,501,NA,694,51620,201912,english,MARPOR,FALSE,TRUE,FALSE,c5dacb307705350e33bd4ad598eb8010,/down/originals/2020-1/51620_2019.pdf,2352aedf22264cd0db0c2d2495b2238b,TRUE,5,NA,Get Brexit done. Unleash Britain's potential,FALSE,51620_201912
"In order to safeguard our green spaces, we will continue to prioritise brownfield development, particularly for the regeneration of our cities and towns.",416.2,NA,695,51620,201912,english,MARPOR,FALSE,TRUE,FALSE,c5dacb307705350e33bd4ad598eb8010,/down/originals/2020-1/51620_2019.pdf,2352aedf22264cd0db0c2d2495b2238b,TRUE,5,NA,Get Brexit done. Unleash Britain's potential,FALSE,51620_201912
Make Britain the best place to start and grow a business,H,NA,696,51620,201912,english,MARPOR,FALSE,TRUE,FALSE,c5dacb307705350e33bd4ad598eb8010,/down/originals/2020-1/51620_2019.pdf,2352aedf22264cd0db0c2d2495b2238b,TRUE,5,NA,Get Brexit done. Unleash Britain's potential,FALSE,51620_201912
We want Britain to be the best country in the world to start and grow a business,601.1,NA,697,51620,201912,english,MARPOR,FALSE,TRUE,FALSE,c5dacb307705350e33bd4ad598eb8010,/down/originals/2020-1/51620_2019.pdf,2352aedf22264cd0db0c2d2495b2238b,TRUE,5,NA,Get Brexit done. Unleash Britain's potential,FALSE,51620_201912
– a place where entrepreneurs know they can build on their ideas and find success.,401,NA,698,51620,201912,english,MARPOR,FALSE,TRUE,FALSE,c5dacb307705350e33bd4ad598eb8010,/down/originals/2020-1/51620_2019.pdf,2352aedf22264cd0db0c2d2495b2238b,TRUE,5,NA,Get Brexit done. Unleash Britain's potential,FALSE,51620_201912
Not only because businesses are good for society – creating the jobs that put bread on the table,401,NA,699,51620,201912,english,MARPOR,FALSE,TRUE,FALSE,c5dacb307705350e33bd4ad598eb8010,/down/originals/2020-1/51620_2019.pdf,2352aedf22264cd0db0c2d2495b2238b,TRUE,5,NA,Get Brexit done. Unleash Britain's potential,FALSE,51620_201912
", and generating the tax revenue that funds our vital public services.",401,NA,700,51620,201912,english,MARPOR,FALSE,TRUE,FALSE,c5dacb307705350e33bd4ad598eb8010,/down/originals/2020-1/51620_2019.pdf,2352aedf22264cd0db0c2d2495b2238b,TRUE,5,NA,Get Brexit done. Unleash Britain's potential,FALSE,51620_201912
"But because we believe that we should do everything we can to support those who want to start their own company, strike out on their own, and have an idea that grows into a world-leading business.",401,NA,701,51620,201912,english,MARPOR,FALSE,TRUE,FALSE,c5dacb307705350e33bd4ad598eb8010,/down/originals/2020-1/51620_2019.pdf,2352aedf22264cd0db0c2d2495b2238b,TRUE,5,NA,Get Brexit done. Unleash Britain's potential,FALSE,51620_201912
Our mission as Conservatives is to give everyone across the country the opportunity to fulfil their potential.,401,NA,702,51620,201912,english,MARPOR,FALSE,TRUE,FALSE,c5dacb307705350e33bd4ad598eb8010,/down/originals/2020-1/51620_2019.pdf,2352aedf22264cd0db0c2d2495b2238b,TRUE,5,NA,Get Brexit done. Unleash Britain's potential,FALSE,51620_201912
We have many strengths.,601.1,NA,703,51620,201912,english,MARPOR,FALSE,TRUE,FALSE,c5dacb307705350e33bd4ad598eb8010,/down/originals/2020-1/51620_2019.pdf,2352aedf22264cd0db0c2d2495b2238b,TRUE,5,NA,Get Brexit done. Unleash Britain's potential,FALSE,51620_201912
We are a highly competitive economy,401,NA,704,51620,201912,english,MARPOR,FALSE,TRUE,FALSE,c5dacb307705350e33bd4ad598eb8010,/down/originals/2020-1/51620_2019.pdf,2352aedf22264cd0db0c2d2495b2238b,TRUE,5,NA,Get Brexit done. Unleash Britain's potential,FALSE,51620_201912
with a strong education system,506,NA,705,51620,201912,english,MARPOR,FALSE,TRUE,FALSE,c5dacb307705350e33bd4ad598eb8010,/down/originals/2020-1/51620_2019.pdf,2352aedf22264cd0db0c2d2495b2238b,TRUE,5,NA,Get Brexit done. Unleash Britain's potential,FALSE,51620_201912
and well-respected regulatory framework.,403,NA,706,51620,201912,english,MARPOR,FALSE,TRUE,FALSE,c5dacb307705350e33bd4ad598eb8010,/down/originals/2020-1/51620_2019.pdf,2352aedf22264cd0db0c2d2495b2238b,TRUE,5,NA,Get Brexit done. Unleash Britain's potential,FALSE,51620_201912
We have more world-class universities than anywhere in Europe.,601.1,NA,707,51620,201912,english,MARPOR,FALSE,TRUE,FALSE,c5dacb307705350e33bd4ad598eb8010,/down/originals/2020-1/51620_2019.pdf,2352aedf22264cd0db0c2d2495b2238b,TRUE,5,NA,Get Brexit done. Unleash Britain's potential,FALSE,51620_201912
"We are a magnet for talent, and home to more innovative and successful new companies than anywhere on the continent",401,NA,708,51620,201912,english,MARPOR,FALSE,TRUE,FALSE,c5dacb307705350e33bd4ad598eb8010,/down/originals/2020-1/51620_2019.pdf,2352aedf22264cd0db0c2d2495b2238b,TRUE,5,NA,Get Brexit done. Unleash Britain's potential,FALSE,51620_201912
– especially in the technology sector.,411,NA,709,51620,201912,english,MARPOR,FALSE,TRUE,FALSE,c5dacb307705350e33bd4ad598eb8010,/down/originals/2020-1/51620_2019.pdf,2352aedf22264cd0db0c2d2495b2238b,TRUE,5,NA,Get Brexit done. Unleash Britain's potential,FALSE,51620_201912
"In areas such as tech, financial services, law and the creative industries we lead the world –",411,NA,710,51620,201912,english,MARPOR,FALSE,TRUE,FALSE,c5dacb307705350e33bd4ad598eb8010,/down/originals/2020-1/51620_2019.pdf,2352aedf22264cd0db0c2d2495b2238b,TRUE,5,NA,Get Brexit done. Unleash Britain's potential,FALSE,51620_201912
