text,cmp_code,eu_code,pos,party,date,language,source,has_eu_code,is_primary_doc,may_contradict_core_dataset,md5sum_text,url_original,md5sum_original,annotations,handbook,is_copy_of,title,translation_en,id
Strengthen legal rights and obligations for couples by introducing mixed-sex civil partnerships and extending rights to cohabiting couples.,604,NA,867,51421,201706,english,MARPOR,FALSE,TRUE,FALSE,7e0fa07c4380e4f616ae65fceaae5460,/down/originals/2018-2/51421_2017.pdf,9eddba3e7bb1b24dce8eeb7d5c3dbfae,TRUE,5,NA,Change Britain´s future. Liberal Democrat manifesto 2017,FALSE,51421_201706
"Extend protection of gender reassignment in equality law to explicitly cover gender identity and expression,",503,NA,868,51421,201706,english,MARPOR,FALSE,TRUE,FALSE,7e0fa07c4380e4f616ae65fceaae5460,/down/originals/2018-2/51421_2017.pdf,9eddba3e7bb1b24dce8eeb7d5c3dbfae,TRUE,5,NA,Change Britain´s future. Liberal Democrat manifesto 2017,FALSE,51421_201706
"and streamline and simplify the Gender Recognition Act 2004 to allow individuals to change their legal gender without unnecessary bureaucratic hurdles, for example the intrusive medical tests currently required.",503,NA,869,51421,201706,english,MARPOR,FALSE,TRUE,FALSE,7e0fa07c4380e4f616ae65fceaae5460,/down/originals/2018-2/51421_2017.pdf,9eddba3e7bb1b24dce8eeb7d5c3dbfae,TRUE,5,NA,Change Britain´s future. Liberal Democrat manifesto 2017,FALSE,51421_201706
"Remove the spousal veto,",503,NA,870,51421,201706,english,MARPOR,FALSE,TRUE,FALSE,7e0fa07c4380e4f616ae65fceaae5460,/down/originals/2018-2/51421_2017.pdf,9eddba3e7bb1b24dce8eeb7d5c3dbfae,TRUE,5,NA,Change Britain´s future. Liberal Democrat manifesto 2017,FALSE,51421_201706
"and abolish remaining marriage inequalities in areas such as pensions, hospital visitation rights and custody of children in the event of bereavement.",604,NA,871,51421,201706,english,MARPOR,FALSE,TRUE,FALSE,7e0fa07c4380e4f616ae65fceaae5460,/down/originals/2018-2/51421_2017.pdf,9eddba3e7bb1b24dce8eeb7d5c3dbfae,TRUE,5,NA,Change Britain´s future. Liberal Democrat manifesto 2017,FALSE,51421_201706
"Develop a government-wide plan to tackle BAME inequalities,",503,NA,872,51421,201706,english,MARPOR,FALSE,TRUE,FALSE,7e0fa07c4380e4f616ae65fceaae5460,/down/originals/2018-2/51421_2017.pdf,9eddba3e7bb1b24dce8eeb7d5c3dbfae,TRUE,5,NA,Change Britain´s future. Liberal Democrat manifesto 2017,FALSE,51421_201706
and review the Equality and Human Rights Commission to determine whether it is effectively fulfilling its role and whether its funding is adequate.,503,NA,873,51421,201706,english,MARPOR,FALSE,TRUE,FALSE,7e0fa07c4380e4f616ae65fceaae5460,/down/originals/2018-2/51421_2017.pdf,9eddba3e7bb1b24dce8eeb7d5c3dbfae,TRUE,5,NA,Change Britain´s future. Liberal Democrat manifesto 2017,FALSE,51421_201706
"Increase accessibility to public places and transport by making more stations wheelchair accessible, improving the legislative framework governing blue badges, setting up a benchmarking standard for accessible cities, and bringing into effect the provisions of the 2010 Equality Act on discrimination by private hire vehicles and taxis.",503,NA,874,51421,201706,english,MARPOR,FALSE,TRUE,FALSE,7e0fa07c4380e4f616ae65fceaae5460,/down/originals/2018-2/51421_2017.pdf,9eddba3e7bb1b24dce8eeb7d5c3dbfae,TRUE,5,NA,Change Britain´s future. Liberal Democrat manifesto 2017,FALSE,51421_201706
Address period poverty by providing free sanitary products to girls at school.,504,NA,875,51421,201706,english,MARPOR,FALSE,TRUE,FALSE,7e0fa07c4380e4f616ae65fceaae5460,/down/originals/2018-2/51421_2017.pdf,9eddba3e7bb1b24dce8eeb7d5c3dbfae,TRUE,5,NA,Change Britain´s future. Liberal Democrat manifesto 2017,FALSE,51421_201706
Outlaw caste discrimination.,503,NA,876,51421,201706,english,MARPOR,FALSE,TRUE,FALSE,7e0fa07c4380e4f616ae65fceaae5460,/down/originals/2018-2/51421_2017.pdf,9eddba3e7bb1b24dce8eeb7d5c3dbfae,TRUE,5,NA,Change Britain´s future. Liberal Democrat manifesto 2017,FALSE,51421_201706
Enshrine the UN Convention on the Rights of the Child in UK law.,201.2,NA,877,51421,201706,english,MARPOR,FALSE,TRUE,FALSE,7e0fa07c4380e4f616ae65fceaae5460,/down/originals/2018-2/51421_2017.pdf,9eddba3e7bb1b24dce8eeb7d5c3dbfae,TRUE,5,NA,Change Britain´s future. Liberal Democrat manifesto 2017,FALSE,51421_201706
7.2 Liberty,H,NA,878,51421,201706,english,MARPOR,FALSE,TRUE,FALSE,7e0fa07c4380e4f616ae65fceaae5460,/down/originals/2018-2/51421_2017.pdf,9eddba3e7bb1b24dce8eeb7d5c3dbfae,TRUE,5,NA,Change Britain´s future. Liberal Democrat manifesto 2017,FALSE,51421_201706
Liberal Democrats believe that we should all be free from an overreaching state,201.1,NA,879,51421,201706,english,MARPOR,FALSE,TRUE,FALSE,7e0fa07c4380e4f616ae65fceaae5460,/down/originals/2018-2/51421_2017.pdf,9eddba3e7bb1b24dce8eeb7d5c3dbfae,TRUE,5,NA,Change Britain´s future. Liberal Democrat manifesto 2017,FALSE,51421_201706
and that the individual freedoms guaranteed by the European Convention on Human Rights (ECHR) and the Human Rights Act are central to a free and democratic society.,201.2,NA,880,51421,201706,english,MARPOR,FALSE,TRUE,FALSE,7e0fa07c4380e4f616ae65fceaae5460,/down/originals/2018-2/51421_2017.pdf,9eddba3e7bb1b24dce8eeb7d5c3dbfae,TRUE,5,NA,Change Britain´s future. Liberal Democrat manifesto 2017,FALSE,51421_201706
"For that reason, the Liberal Democrats will: Oppose any attempt to withdraw from the ECHR or abolish or water down the Human Rights Act.",201.2,NA,881,51421,201706,english,MARPOR,FALSE,TRUE,FALSE,7e0fa07c4380e4f616ae65fceaae5460,/down/originals/2018-2/51421_2017.pdf,9eddba3e7bb1b24dce8eeb7d5c3dbfae,TRUE,5,NA,Change Britain´s future. Liberal Democrat manifesto 2017,FALSE,51421_201706
"Introduce a digital bill of rights that protects people’s powers over their own information,",201.1,NA,882,51421,201706,english,MARPOR,FALSE,TRUE,FALSE,7e0fa07c4380e4f616ae65fceaae5460,/down/originals/2018-2/51421_2017.pdf,9eddba3e7bb1b24dce8eeb7d5c3dbfae,TRUE,5,NA,Change Britain´s future. Liberal Democrat manifesto 2017,FALSE,51421_201706
"supports individuals over large corporations,",201.1,NA,883,51421,201706,english,MARPOR,FALSE,TRUE,FALSE,7e0fa07c4380e4f616ae65fceaae5460,/down/originals/2018-2/51421_2017.pdf,9eddba3e7bb1b24dce8eeb7d5c3dbfae,TRUE,5,NA,Change Britain´s future. Liberal Democrat manifesto 2017,FALSE,51421_201706
and preserves the neutrality of the internet.,201.1,NA,884,51421,201706,english,MARPOR,FALSE,TRUE,FALSE,7e0fa07c4380e4f616ae65fceaae5460,/down/originals/2018-2/51421_2017.pdf,9eddba3e7bb1b24dce8eeb7d5c3dbfae,TRUE,5,NA,Change Britain´s future. Liberal Democrat manifesto 2017,FALSE,51421_201706
"In light of the press’s failure to engage in effective self-regulation, seek to ensure delivery of independent self-regulation,",202.1,NA,885,51421,201706,english,MARPOR,FALSE,TRUE,FALSE,7e0fa07c4380e4f616ae65fceaae5460,/down/originals/2018-2/51421_2017.pdf,9eddba3e7bb1b24dce8eeb7d5c3dbfae,TRUE,5,NA,Change Britain´s future. Liberal Democrat manifesto 2017,FALSE,51421_201706
and commence part two of the Leveson inquiry as soon as practicable.,202.1,NA,886,51421,201706,english,MARPOR,FALSE,TRUE,FALSE,7e0fa07c4380e4f616ae65fceaae5460,/down/originals/2018-2/51421_2017.pdf,9eddba3e7bb1b24dce8eeb7d5c3dbfae,TRUE,5,NA,Change Britain´s future. Liberal Democrat manifesto 2017,FALSE,51421_201706
"End the ministerial veto on release of information under the Freedom of Information Act,",202.1,NA,887,51421,201706,english,MARPOR,FALSE,TRUE,FALSE,7e0fa07c4380e4f616ae65fceaae5460,/down/originals/2018-2/51421_2017.pdf,9eddba3e7bb1b24dce8eeb7d5c3dbfae,TRUE,5,NA,Change Britain´s future. Liberal Democrat manifesto 2017,FALSE,51421_201706
and take steps to reduce the proportion of FOI requests where information is withheld by government departments.,202.1,NA,888,51421,201706,english,MARPOR,FALSE,TRUE,FALSE,7e0fa07c4380e4f616ae65fceaae5460,/down/originals/2018-2/51421_2017.pdf,9eddba3e7bb1b24dce8eeb7d5c3dbfae,TRUE,5,NA,Change Britain´s future. Liberal Democrat manifesto 2017,FALSE,51421_201706
"Order Ofcom to launch an immediate full assessment of media plurality in the UK, including a review of the ‘fit and proper persons test’ and whether the communications regulator, and the Competition and Markets Authority, have appropriate powers to deal with concentrations of power in the digital economy.",403,NA,889,51421,201706,english,MARPOR,FALSE,TRUE,FALSE,7e0fa07c4380e4f616ae65fceaae5460,/down/originals/2018-2/51421_2017.pdf,9eddba3e7bb1b24dce8eeb7d5c3dbfae,TRUE,5,NA,Change Britain´s future. Liberal Democrat manifesto 2017,FALSE,51421_201706
7.3 Crime and policing,H,NA,890,51421,201706,english,MARPOR,FALSE,TRUE,FALSE,7e0fa07c4380e4f616ae65fceaae5460,/down/originals/2018-2/51421_2017.pdf,9eddba3e7bb1b24dce8eeb7d5c3dbfae,TRUE,5,NA,Change Britain´s future. Liberal Democrat manifesto 2017,FALSE,51421_201706
"After years of reduction in traditional crime we have seen an increase, particularly in violent crime, since 2015.",605.1,NA,891,51421,201706,english,MARPOR,FALSE,TRUE,FALSE,7e0fa07c4380e4f616ae65fceaae5460,/down/originals/2018-2/51421_2017.pdf,9eddba3e7bb1b24dce8eeb7d5c3dbfae,TRUE,5,NA,Change Britain´s future. Liberal Democrat manifesto 2017,FALSE,51421_201706
"At the same time police forces are under pressure from reduced funding, with less money available for the community policing we all value.",605.1,NA,892,51421,201706,english,MARPOR,FALSE,TRUE,FALSE,7e0fa07c4380e4f616ae65fceaae5460,/down/originals/2018-2/51421_2017.pdf,9eddba3e7bb1b24dce8eeb7d5c3dbfae,TRUE,5,NA,Change Britain´s future. Liberal Democrat manifesto 2017,FALSE,51421_201706
"For these reasons Liberal Democrats will: Increase community policing in England and Wales by giving an additional £300 million a year to local police forces to reverse the increase in violent crime,",605.1,NA,893,51421,201706,english,MARPOR,FALSE,TRUE,FALSE,7e0fa07c4380e4f616ae65fceaae5460,/down/originals/2018-2/51421_2017.pdf,9eddba3e7bb1b24dce8eeb7d5c3dbfae,TRUE,5,NA,Change Britain´s future. Liberal Democrat manifesto 2017,FALSE,51421_201706
boost community confidence,605.1,NA,894,51421,201706,english,MARPOR,FALSE,TRUE,FALSE,7e0fa07c4380e4f616ae65fceaae5460,/down/originals/2018-2/51421_2017.pdf,9eddba3e7bb1b24dce8eeb7d5c3dbfae,TRUE,5,NA,Change Britain´s future. Liberal Democrat manifesto 2017,FALSE,51421_201706
and increase the flow of community intelligence.,605.1,NA,895,51421,201706,english,MARPOR,FALSE,TRUE,FALSE,7e0fa07c4380e4f616ae65fceaae5460,/down/originals/2018-2/51421_2017.pdf,9eddba3e7bb1b24dce8eeb7d5c3dbfae,TRUE,5,NA,Change Britain´s future. Liberal Democrat manifesto 2017,FALSE,51421_201706
"Maintain, as part of our fight against hard Brexit, cross-border co-operation in combatting serious organised crime, including international fraud and child sexual exploitation, by retaining the European Arrest Warrant, membership of Europol and access to EU information databases.",605.1,NA,896,51421,201706,english,MARPOR,FALSE,TRUE,FALSE,7e0fa07c4380e4f616ae65fceaae5460,/down/originals/2018-2/51421_2017.pdf,9eddba3e7bb1b24dce8eeb7d5c3dbfae,TRUE,5,NA,Change Britain´s future. Liberal Democrat manifesto 2017,FALSE,51421_201706
End the 1 % cap on police pay rises.,605.1,NA,897,51421,201706,english,MARPOR,FALSE,TRUE,FALSE,7e0fa07c4380e4f616ae65fceaae5460,/down/originals/2018-2/51421_2017.pdf,9eddba3e7bb1b24dce8eeb7d5c3dbfae,TRUE,5,NA,Change Britain´s future. Liberal Democrat manifesto 2017,FALSE,51421_201706
"Require all front-line officers to wear body cameras on duty, protecting the public from abuse of power and police officers from malicious accusations.",605.1,NA,898,51421,201706,english,MARPOR,FALSE,TRUE,FALSE,7e0fa07c4380e4f616ae65fceaae5460,/down/originals/2018-2/51421_2017.pdf,9eddba3e7bb1b24dce8eeb7d5c3dbfae,TRUE,5,NA,Change Britain´s future. Liberal Democrat manifesto 2017,FALSE,51421_201706
Resource BAME staff associations such as the National Black Police Association to increase ethnic diversity and BAME participation in the police.,503,NA,899,51421,201706,english,MARPOR,FALSE,TRUE,FALSE,7e0fa07c4380e4f616ae65fceaae5460,/down/originals/2018-2/51421_2017.pdf,9eddba3e7bb1b24dce8eeb7d5c3dbfae,TRUE,5,NA,Change Britain´s future. Liberal Democrat manifesto 2017,FALSE,51421_201706
Provide government funding for a national rape crisis helpline with increased opening hours and advertisement.,605.1,NA,900,51421,201706,english,MARPOR,FALSE,TRUE,FALSE,7e0fa07c4380e4f616ae65fceaae5460,/down/originals/2018-2/51421_2017.pdf,9eddba3e7bb1b24dce8eeb7d5c3dbfae,TRUE,5,NA,Change Britain´s future. Liberal Democrat manifesto 2017,FALSE,51421_201706
End the anomaly that forces Police Scotland and the Scottish Fire and Rescue Service to pay VAT on their purchases.,605.1,NA,901,51421,201706,english,MARPOR,FALSE,TRUE,FALSE,7e0fa07c4380e4f616ae65fceaae5460,/down/originals/2018-2/51421_2017.pdf,9eddba3e7bb1b24dce8eeb7d5c3dbfae,TRUE,5,NA,Change Britain´s future. Liberal Democrat manifesto 2017,FALSE,51421_201706
"Replace Police and Crime Commissioners, elected at great expense in elections with very low turnout, with accountable police boards made up of local councillors.",605.1,NA,902,51421,201706,english,MARPOR,FALSE,TRUE,FALSE,7e0fa07c4380e4f616ae65fceaae5460,/down/originals/2018-2/51421_2017.pdf,9eddba3e7bb1b24dce8eeb7d5c3dbfae,TRUE,5,NA,Change Britain´s future. Liberal Democrat manifesto 2017,FALSE,51421_201706
"Build on the success of crime maps to use data more effectively to reduce crime and improve policing, including exploring the feasibility of mandatory reporting of fraud losses by individual credit and debit-card providers.",605.1,NA,903,51421,201706,english,MARPOR,FALSE,TRUE,FALSE,7e0fa07c4380e4f616ae65fceaae5460,/down/originals/2018-2/51421_2017.pdf,9eddba3e7bb1b24dce8eeb7d5c3dbfae,TRUE,5,NA,Change Britain´s future. Liberal Democrat manifesto 2017,FALSE,51421_201706
7.4 Criminal justice,H,NA,904,51421,201706,english,MARPOR,FALSE,TRUE,FALSE,7e0fa07c4380e4f616ae65fceaae5460,/down/originals/2018-2/51421_2017.pdf,9eddba3e7bb1b24dce8eeb7d5c3dbfae,TRUE,5,NA,Change Britain´s future. Liberal Democrat manifesto 2017,FALSE,51421_201706
The criminal courts need modernising.,605.2,NA,905,51421,201706,english,MARPOR,FALSE,TRUE,FALSE,7e0fa07c4380e4f616ae65fceaae5460,/down/originals/2018-2/51421_2017.pdf,9eddba3e7bb1b24dce8eeb7d5c3dbfae,TRUE,5,NA,Change Britain´s future. Liberal Democrat manifesto 2017,FALSE,51421_201706
There are too many people in prison.,605.2,NA,906,51421,201706,english,MARPOR,FALSE,TRUE,FALSE,7e0fa07c4380e4f616ae65fceaae5460,/down/originals/2018-2/51421_2017.pdf,9eddba3e7bb1b24dce8eeb7d5c3dbfae,TRUE,5,NA,Change Britain´s future. Liberal Democrat manifesto 2017,FALSE,51421_201706
Our reoffending rates are terrible,605.1,NA,907,51421,201706,english,MARPOR,FALSE,TRUE,FALSE,7e0fa07c4380e4f616ae65fceaae5460,/down/originals/2018-2/51421_2017.pdf,9eddba3e7bb1b24dce8eeb7d5c3dbfae,TRUE,5,NA,Change Britain´s future. Liberal Democrat manifesto 2017,FALSE,51421_201706
"and our prisons, many old and squalid, are in crisis – overcrowded and woefully understaffed, with drug abuse, violence, suicide and self-harm endemic.",605.1,NA,908,51421,201706,english,MARPOR,FALSE,TRUE,FALSE,7e0fa07c4380e4f616ae65fceaae5460,/down/originals/2018-2/51421_2017.pdf,9eddba3e7bb1b24dce8eeb7d5c3dbfae,TRUE,5,NA,Change Britain´s future. Liberal Democrat manifesto 2017,FALSE,51421_201706
"That’s why Liberal Democrats will: Introduce a Victims’ Bill of Rights that will create a single point of contact for victims in the criminal justice system,",605.1,NA,909,51421,201706,english,MARPOR,FALSE,TRUE,FALSE,7e0fa07c4380e4f616ae65fceaae5460,/down/originals/2018-2/51421_2017.pdf,9eddba3e7bb1b24dce8eeb7d5c3dbfae,TRUE,5,NA,Change Britain´s future. Liberal Democrat manifesto 2017,FALSE,51421_201706
"increase victims’ access to information about their cases,",605.1,NA,910,51421,201706,english,MARPOR,FALSE,TRUE,FALSE,7e0fa07c4380e4f616ae65fceaae5460,/down/originals/2018-2/51421_2017.pdf,9eddba3e7bb1b24dce8eeb7d5c3dbfae,TRUE,5,NA,Change Britain´s future. Liberal Democrat manifesto 2017,FALSE,51421_201706
and give victims the right to request restorative justice rather than a prison sentence.,605.2,NA,911,51421,201706,english,MARPOR,FALSE,TRUE,FALSE,7e0fa07c4380e4f616ae65fceaae5460,/down/originals/2018-2/51421_2017.pdf,9eddba3e7bb1b24dce8eeb7d5c3dbfae,TRUE,5,NA,Change Britain´s future. Liberal Democrat manifesto 2017,FALSE,51421_201706
"Introduce a presumption against short prison sentences and increase the use of tough, non-custodial punishments including weekend and evening custody, curfews, community service and GPS tagging.",605.2,NA,912,51421,201706,english,MARPOR,FALSE,TRUE,FALSE,7e0fa07c4380e4f616ae65fceaae5460,/down/originals/2018-2/51421_2017.pdf,9eddba3e7bb1b24dce8eeb7d5c3dbfae,TRUE,5,NA,Change Britain´s future. Liberal Democrat manifesto 2017,FALSE,51421_201706
"Promote community justice panels and restorative justice that brings victims and wrongdoers together to resolve conflict, reduce harm and encourage rehabilitation.",605.2,NA,913,51421,201706,english,MARPOR,FALSE,TRUE,FALSE,7e0fa07c4380e4f616ae65fceaae5460,/down/originals/2018-2/51421_2017.pdf,9eddba3e7bb1b24dce8eeb7d5c3dbfae,TRUE,5,NA,Change Britain´s future. Liberal Democrat manifesto 2017,FALSE,51421_201706
"Extend the responsibility of the Youth Justice Board to all offenders under 21, giving it the power to commission mental-health services.",605.2,NA,914,51421,201706,english,MARPOR,FALSE,TRUE,FALSE,7e0fa07c4380e4f616ae65fceaae5460,/down/originals/2018-2/51421_2017.pdf,9eddba3e7bb1b24dce8eeb7d5c3dbfae,TRUE,5,NA,Change Britain´s future. Liberal Democrat manifesto 2017,FALSE,51421_201706
Establish a Women’s Justice Board with a remit to meet the special needs of women offenders.,706,NA,915,51421,201706,english,MARPOR,FALSE,TRUE,FALSE,7e0fa07c4380e4f616ae65fceaae5460,/down/originals/2018-2/51421_2017.pdf,9eddba3e7bb1b24dce8eeb7d5c3dbfae,TRUE,5,NA,Change Britain´s future. Liberal Democrat manifesto 2017,FALSE,51421_201706
"Transform prisons into places of rehabilitation, recovery, learning and work, with suitable treatment, education or work available to all prisoners;",605.2,NA,916,51421,201706,english,MARPOR,FALSE,TRUE,FALSE,7e0fa07c4380e4f616ae65fceaae5460,/down/originals/2018-2/51421_2017.pdf,9eddba3e7bb1b24dce8eeb7d5c3dbfae,TRUE,5,NA,Change Britain´s future. Liberal Democrat manifesto 2017,FALSE,51421_201706
"adopt a holistic approach to prisoners with multiple problems,",605.2,NA,917,51421,201706,english,MARPOR,FALSE,TRUE,FALSE,7e0fa07c4380e4f616ae65fceaae5460,/down/originals/2018-2/51421_2017.pdf,9eddba3e7bb1b24dce8eeb7d5c3dbfae,TRUE,5,NA,Change Britain´s future. Liberal Democrat manifesto 2017,FALSE,51421_201706
and ensure that courses started in custody can be completed on release.,411,NA,918,51421,201706,english,MARPOR,FALSE,TRUE,FALSE,7e0fa07c4380e4f616ae65fceaae5460,/down/originals/2018-2/51421_2017.pdf,9eddba3e7bb1b24dce8eeb7d5c3dbfae,TRUE,5,NA,Change Britain´s future. Liberal Democrat manifesto 2017,FALSE,51421_201706
"Review the investigation, prosecution, procedures and rules of evidence in cases of sexual and domestic violence.",605.1,NA,919,51421,201706,english,MARPOR,FALSE,TRUE,FALSE,7e0fa07c4380e4f616ae65fceaae5460,/down/originals/2018-2/51421_2017.pdf,9eddba3e7bb1b24dce8eeb7d5c3dbfae,TRUE,5,NA,Change Britain´s future. Liberal Democrat manifesto 2017,FALSE,51421_201706
"Ensure that trans prisoners are placed in prisons that reflect their gender identity, rather than their birth gender.",705,NA,920,51421,201706,english,MARPOR,FALSE,TRUE,FALSE,7e0fa07c4380e4f616ae65fceaae5460,/down/originals/2018-2/51421_2017.pdf,9eddba3e7bb1b24dce8eeb7d5c3dbfae,TRUE,5,NA,Change Britain´s future. Liberal Democrat manifesto 2017,FALSE,51421_201706
"Reduce the overrepresentation of individuals from a BAME background at every stage of the criminal justice system, taking into account the upcoming recommendations of the Lammy review.",503,NA,921,51421,201706,english,MARPOR,FALSE,TRUE,FALSE,7e0fa07c4380e4f616ae65fceaae5460,/down/originals/2018-2/51421_2017.pdf,9eddba3e7bb1b24dce8eeb7d5c3dbfae,TRUE,5,NA,Change Britain´s future. Liberal Democrat manifesto 2017,FALSE,51421_201706
"Secure further funding for criminal legal aid from sources other than the taxpayer, including insurance for company directors, and changes to restraint orders.",505,NA,922,51421,201706,english,MARPOR,FALSE,TRUE,FALSE,7e0fa07c4380e4f616ae65fceaae5460,/down/originals/2018-2/51421_2017.pdf,9eddba3e7bb1b24dce8eeb7d5c3dbfae,TRUE,5,NA,Change Britain´s future. Liberal Democrat manifesto 2017,FALSE,51421_201706
7.5 Civil and family justice,H,NA,923,51421,201706,english,MARPOR,FALSE,TRUE,FALSE,7e0fa07c4380e4f616ae65fceaae5460,/down/originals/2018-2/51421_2017.pdf,9eddba3e7bb1b24dce8eeb7d5c3dbfae,TRUE,5,NA,Change Britain´s future. Liberal Democrat manifesto 2017,FALSE,51421_201706
The justice system is under pressure.,605.1,NA,924,51421,201706,english,MARPOR,FALSE,TRUE,FALSE,7e0fa07c4380e4f616ae65fceaae5460,/down/originals/2018-2/51421_2017.pdf,9eddba3e7bb1b24dce8eeb7d5c3dbfae,TRUE,5,NA,Change Britain´s future. Liberal Democrat manifesto 2017,FALSE,51421_201706
"Brexit threatens international co-operation,",107,NA,925,51421,201706,english,MARPOR,FALSE,TRUE,FALSE,7e0fa07c4380e4f616ae65fceaae5460,/down/originals/2018-2/51421_2017.pdf,9eddba3e7bb1b24dce8eeb7d5c3dbfae,TRUE,5,NA,Change Britain´s future. Liberal Democrat manifesto 2017,FALSE,51421_201706
"the Conservatives have failed to defend the rule of law which is the cornerstone of our democracy,",202.1,NA,926,51421,201706,english,MARPOR,FALSE,TRUE,FALSE,7e0fa07c4380e4f616ae65fceaae5460,/down/originals/2018-2/51421_2017.pdf,9eddba3e7bb1b24dce8eeb7d5c3dbfae,TRUE,5,NA,Change Britain´s future. Liberal Democrat manifesto 2017,FALSE,51421_201706
and cuts to legal aid have denied effective access to justice to many.,201.2,NA,927,51421,201706,english,MARPOR,FALSE,TRUE,FALSE,7e0fa07c4380e4f616ae65fceaae5460,/down/originals/2018-2/51421_2017.pdf,9eddba3e7bb1b24dce8eeb7d5c3dbfae,TRUE,5,NA,Change Britain´s future. Liberal Democrat manifesto 2017,FALSE,51421_201706
"For these reasons Liberal Democrats will: Ensure that the UK retains international arrangements for jurisdiction, the recognition and enforcement of judgments and for family cases currently enjoyed under the EU Brussels I and Brussels II regulation and the Hague child abduction convention.",201.2,NA,928,51421,201706,english,MARPOR,FALSE,TRUE,FALSE,7e0fa07c4380e4f616ae65fceaae5460,/down/originals/2018-2/51421_2017.pdf,9eddba3e7bb1b24dce8eeb7d5c3dbfae,TRUE,5,NA,Change Britain´s future. Liberal Democrat manifesto 2017,FALSE,51421_201706
"Conduct an urgent and comprehensive review of the effects of the Legal Aid, Sentencing and Punishment of Offenders Act on access to justice, particularly funding for social welfare appeals, and domestic violence and exceptional cases.",201.2,NA,929,51421,201706,english,MARPOR,FALSE,TRUE,FALSE,7e0fa07c4380e4f616ae65fceaae5460,/down/originals/2018-2/51421_2017.pdf,9eddba3e7bb1b24dce8eeb7d5c3dbfae,TRUE,5,NA,Change Britain´s future. Liberal Democrat manifesto 2017,FALSE,51421_201706
"Reverse the massive increases in court and tribunal fees, which prevent many from pursuing good cases.",201.2,NA,930,51421,201706,english,MARPOR,FALSE,TRUE,FALSE,7e0fa07c4380e4f616ae65fceaae5460,/down/originals/2018-2/51421_2017.pdf,9eddba3e7bb1b24dce8eeb7d5c3dbfae,TRUE,5,NA,Change Britain´s future. Liberal Democrat manifesto 2017,FALSE,51421_201706
Continue to modernise and simplify court procedures.,303,NA,931,51421,201706,english,MARPOR,FALSE,TRUE,FALSE,7e0fa07c4380e4f616ae65fceaae5460,/down/originals/2018-2/51421_2017.pdf,9eddba3e7bb1b24dce8eeb7d5c3dbfae,TRUE,5,NA,Change Britain´s future. Liberal Democrat manifesto 2017,FALSE,51421_201706
"Protect our system of judicial review from further attack, retaining government accountability for unlawful action,",202.1,NA,932,51421,201706,english,MARPOR,FALSE,TRUE,FALSE,7e0fa07c4380e4f616ae65fceaae5460,/down/originals/2018-2/51421_2017.pdf,9eddba3e7bb1b24dce8eeb7d5c3dbfae,TRUE,5,NA,Change Britain´s future. Liberal Democrat manifesto 2017,FALSE,51421_201706
and offer a staunch defence of our judiciary and the rule of law.,202.1,NA,933,51421,201706,english,MARPOR,FALSE,TRUE,FALSE,7e0fa07c4380e4f616ae65fceaae5460,/down/originals/2018-2/51421_2017.pdf,9eddba3e7bb1b24dce8eeb7d5c3dbfae,TRUE,5,NA,Change Britain´s future. Liberal Democrat manifesto 2017,FALSE,51421_201706
7.6 Terrorism and violent extremism,H,NA,934,51421,201706,english,MARPOR,FALSE,TRUE,FALSE,7e0fa07c4380e4f616ae65fceaae5460,/down/originals/2018-2/51421_2017.pdf,9eddba3e7bb1b24dce8eeb7d5c3dbfae,TRUE,5,NA,Change Britain´s future. Liberal Democrat manifesto 2017,FALSE,51421_201706
"As recent events across Europe – and at the heart of our own democracy – have shown, terrorism and violent extremism threaten us all.",104,NA,935,51421,201706,english,MARPOR,FALSE,TRUE,FALSE,7e0fa07c4380e4f616ae65fceaae5460,/down/originals/2018-2/51421_2017.pdf,9eddba3e7bb1b24dce8eeb7d5c3dbfae,TRUE,5,NA,Change Britain´s future. Liberal Democrat manifesto 2017,FALSE,51421_201706
"As liberals, we must have an effective security policy",104,NA,936,51421,201706,english,MARPOR,FALSE,TRUE,FALSE,7e0fa07c4380e4f616ae65fceaae5460,/down/originals/2018-2/51421_2017.pdf,9eddba3e7bb1b24dce8eeb7d5c3dbfae,TRUE,5,NA,Change Britain´s future. Liberal Democrat manifesto 2017,FALSE,51421_201706
"which is also accountable, community and evidencebased,",202.1,NA,937,51421,201706,english,MARPOR,FALSE,TRUE,FALSE,7e0fa07c4380e4f616ae65fceaae5460,/down/originals/2018-2/51421_2017.pdf,9eddba3e7bb1b24dce8eeb7d5c3dbfae,TRUE,5,NA,Change Britain´s future. Liberal Democrat manifesto 2017,FALSE,51421_201706
