text,cmp_code,eu_code,pos,party,date,language,source,has_eu_code,is_primary_doc,may_contradict_core_dataset,md5sum_text,url_original,md5sum_original,annotations,handbook,is_copy_of,title,translation_en,id
slashing energy bills,412,NA,578,51421,201706,english,MARPOR,FALSE,TRUE,FALSE,7e0fa07c4380e4f616ae65fceaae5460,/down/originals/2018-2/51421_2017.pdf,9eddba3e7bb1b24dce8eeb7d5c3dbfae,TRUE,5,NA,Change Britain´s future. Liberal Democrat manifesto 2017,FALSE,51421_201706
"and carbon emissions,",501,NA,579,51421,201706,english,MARPOR,FALSE,TRUE,FALSE,7e0fa07c4380e4f616ae65fceaae5460,/down/originals/2018-2/51421_2017.pdf,9eddba3e7bb1b24dce8eeb7d5c3dbfae,TRUE,5,NA,Change Britain´s future. Liberal Democrat manifesto 2017,FALSE,51421_201706
creating thousands of jobs,701,NA,580,51421,201706,english,MARPOR,FALSE,TRUE,FALSE,7e0fa07c4380e4f616ae65fceaae5460,/down/originals/2018-2/51421_2017.pdf,9eddba3e7bb1b24dce8eeb7d5c3dbfae,TRUE,5,NA,Change Britain´s future. Liberal Democrat manifesto 2017,FALSE,51421_201706
and helping end the fuel poverty crisis once and for all.,504,NA,581,51421,201706,english,MARPOR,FALSE,TRUE,FALSE,7e0fa07c4380e4f616ae65fceaae5460,/down/originals/2018-2/51421_2017.pdf,9eddba3e7bb1b24dce8eeb7d5c3dbfae,TRUE,5,NA,Change Britain´s future. Liberal Democrat manifesto 2017,FALSE,51421_201706
"We will: Pass a new Green Buildings Act to set new energy-efficiency targets, including a long-term ambition for every home in England to reach at least an energy rating of Band C by 2035.",501,NA,582,51421,201706,english,MARPOR,FALSE,TRUE,FALSE,7e0fa07c4380e4f616ae65fceaae5460,/down/originals/2018-2/51421_2017.pdf,9eddba3e7bb1b24dce8eeb7d5c3dbfae,TRUE,5,NA,Change Britain´s future. Liberal Democrat manifesto 2017,FALSE,51421_201706
"Ensure that at least four million homes are made highly energy efficient (Band C) by 2022, with priority given to fuel-poor households.",504,NA,583,51421,201706,english,MARPOR,FALSE,TRUE,FALSE,7e0fa07c4380e4f616ae65fceaae5460,/down/originals/2018-2/51421_2017.pdf,9eddba3e7bb1b24dce8eeb7d5c3dbfae,TRUE,5,NA,Change Britain´s future. Liberal Democrat manifesto 2017,FALSE,51421_201706
"Restore the zero-carbon standard for new homes which was set by Liberal Democrats in government and since abandoned by the Conservatives, increasing the standard steadily and extending it to non-domestic buildings by 2022.",501,NA,584,51421,201706,english,MARPOR,FALSE,TRUE,FALSE,7e0fa07c4380e4f616ae65fceaae5460,/down/originals/2018-2/51421_2017.pdf,9eddba3e7bb1b24dce8eeb7d5c3dbfae,TRUE,5,NA,Change Britain´s future. Liberal Democrat manifesto 2017,FALSE,51421_201706
"Expand community energy schemes,",301,NA,585,51421,201706,english,MARPOR,FALSE,TRUE,FALSE,7e0fa07c4380e4f616ae65fceaae5460,/down/originals/2018-2/51421_2017.pdf,9eddba3e7bb1b24dce8eeb7d5c3dbfae,TRUE,5,NA,Change Britain´s future. Liberal Democrat manifesto 2017,FALSE,51421_201706
"encourage councils to develop community energy-saving projects and local electricity generation,",416.2,NA,586,51421,201706,english,MARPOR,FALSE,TRUE,FALSE,7e0fa07c4380e4f616ae65fceaae5460,/down/originals/2018-2/51421_2017.pdf,9eddba3e7bb1b24dce8eeb7d5c3dbfae,TRUE,5,NA,Change Britain´s future. Liberal Democrat manifesto 2017,FALSE,51421_201706
and promote city-scale demonstration projects in electric vehicles and clean energy.,416.2,NA,587,51421,201706,english,MARPOR,FALSE,TRUE,FALSE,7e0fa07c4380e4f616ae65fceaae5460,/down/originals/2018-2/51421_2017.pdf,9eddba3e7bb1b24dce8eeb7d5c3dbfae,TRUE,5,NA,Change Britain´s future. Liberal Democrat manifesto 2017,FALSE,51421_201706
"Continue to back new entrants to the energy market, aiming for at least 30% of the household market to be supplied by competitors to the ‘Big 6’ by 2022.",403,NA,588,51421,201706,english,MARPOR,FALSE,TRUE,FALSE,7e0fa07c4380e4f616ae65fceaae5460,/down/originals/2018-2/51421_2017.pdf,9eddba3e7bb1b24dce8eeb7d5c3dbfae,TRUE,5,NA,Change Britain´s future. Liberal Democrat manifesto 2017,FALSE,51421_201706
5.4 Protecting nature,NA,NA,589,51421,201706,english,MARPOR,FALSE,TRUE,FALSE,7e0fa07c4380e4f616ae65fceaae5460,/down/originals/2018-2/51421_2017.pdf,9eddba3e7bb1b24dce8eeb7d5c3dbfae,TRUE,5,NA,Change Britain´s future. Liberal Democrat manifesto 2017,FALSE,51421_201706
Britain’s natural environment is precious.,501,NA,590,51421,201706,english,MARPOR,FALSE,TRUE,FALSE,7e0fa07c4380e4f616ae65fceaae5460,/down/originals/2018-2/51421_2017.pdf,9eddba3e7bb1b24dce8eeb7d5c3dbfae,TRUE,5,NA,Change Britain´s future. Liberal Democrat manifesto 2017,FALSE,51421_201706
"The countryside, wildlife and urban green spaces are critical to health,",501,NA,591,51421,201706,english,MARPOR,FALSE,TRUE,FALSE,7e0fa07c4380e4f616ae65fceaae5460,/down/originals/2018-2/51421_2017.pdf,9eddba3e7bb1b24dce8eeb7d5c3dbfae,TRUE,5,NA,Change Britain´s future. Liberal Democrat manifesto 2017,FALSE,51421_201706
wellbeing,504,NA,592,51421,201706,english,MARPOR,FALSE,TRUE,FALSE,7e0fa07c4380e4f616ae65fceaae5460,/down/originals/2018-2/51421_2017.pdf,9eddba3e7bb1b24dce8eeb7d5c3dbfae,TRUE,5,NA,Change Britain´s future. Liberal Democrat manifesto 2017,FALSE,51421_201706
and a sense of community.,606.1,NA,593,51421,201706,english,MARPOR,FALSE,TRUE,FALSE,7e0fa07c4380e4f616ae65fceaae5460,/down/originals/2018-2/51421_2017.pdf,9eddba3e7bb1b24dce8eeb7d5c3dbfae,TRUE,5,NA,Change Britain´s future. Liberal Democrat manifesto 2017,FALSE,51421_201706
The quality of the environment also underpins key industries such as agriculture,703.1,NA,594,51421,201706,english,MARPOR,FALSE,TRUE,FALSE,7e0fa07c4380e4f616ae65fceaae5460,/down/originals/2018-2/51421_2017.pdf,9eddba3e7bb1b24dce8eeb7d5c3dbfae,TRUE,5,NA,Change Britain´s future. Liberal Democrat manifesto 2017,FALSE,51421_201706
and tourism.,408,NA,595,51421,201706,english,MARPOR,FALSE,TRUE,FALSE,7e0fa07c4380e4f616ae65fceaae5460,/down/originals/2018-2/51421_2017.pdf,9eddba3e7bb1b24dce8eeb7d5c3dbfae,TRUE,5,NA,Change Britain´s future. Liberal Democrat manifesto 2017,FALSE,51421_201706
We will:,NA,NA,596,51421,201706,english,MARPOR,FALSE,TRUE,FALSE,7e0fa07c4380e4f616ae65fceaae5460,/down/originals/2018-2/51421_2017.pdf,9eddba3e7bb1b24dce8eeb7d5c3dbfae,TRUE,5,NA,Change Britain´s future. Liberal Democrat manifesto 2017,FALSE,51421_201706
"Establish a £2 billion flood-prevention fund focused on providing support for small community and council-led schemes to reduce upstream flooding, and the knock-on effects in downstream and coastal areas,",301,NA,597,51421,201706,english,MARPOR,FALSE,TRUE,FALSE,7e0fa07c4380e4f616ae65fceaae5460,/down/originals/2018-2/51421_2017.pdf,9eddba3e7bb1b24dce8eeb7d5c3dbfae,TRUE,5,NA,Change Britain´s future. Liberal Democrat manifesto 2017,FALSE,51421_201706
"in addition to improving flood defences,",411,NA,598,51421,201706,english,MARPOR,FALSE,TRUE,FALSE,7e0fa07c4380e4f616ae65fceaae5460,/down/originals/2018-2/51421_2017.pdf,9eddba3e7bb1b24dce8eeb7d5c3dbfae,TRUE,5,NA,Change Britain´s future. Liberal Democrat manifesto 2017,FALSE,51421_201706
and introducing high standards for flood resilience for buildings and infrastructure in flood-risk areas.,411,NA,599,51421,201706,english,MARPOR,FALSE,TRUE,FALSE,7e0fa07c4380e4f616ae65fceaae5460,/down/originals/2018-2/51421_2017.pdf,9eddba3e7bb1b24dce8eeb7d5c3dbfae,TRUE,5,NA,Change Britain´s future. Liberal Democrat manifesto 2017,FALSE,51421_201706
"Pass a Nature Act to put the Natural Capital Committee (NCC) on a statutory footing,",501,NA,600,51421,201706,english,MARPOR,FALSE,TRUE,FALSE,7e0fa07c4380e4f616ae65fceaae5460,/down/originals/2018-2/51421_2017.pdf,9eddba3e7bb1b24dce8eeb7d5c3dbfae,TRUE,5,NA,Change Britain´s future. Liberal Democrat manifesto 2017,FALSE,51421_201706
"set legally binding natural capital targets, including on biodiversity, clean air and water,",501,NA,601,51421,201706,english,MARPOR,FALSE,TRUE,FALSE,7e0fa07c4380e4f616ae65fceaae5460,/down/originals/2018-2/51421_2017.pdf,9eddba3e7bb1b24dce8eeb7d5c3dbfae,TRUE,5,NA,Change Britain´s future. Liberal Democrat manifesto 2017,FALSE,51421_201706
and empower the NCC to recommend actions to meet these targets.,501,NA,602,51421,201706,english,MARPOR,FALSE,TRUE,FALSE,7e0fa07c4380e4f616ae65fceaae5460,/down/originals/2018-2/51421_2017.pdf,9eddba3e7bb1b24dce8eeb7d5c3dbfae,TRUE,5,NA,Change Britain´s future. Liberal Democrat manifesto 2017,FALSE,51421_201706
"Significantly increase the amount of accessible green space, including completion of the coastal path,",501,NA,603,51421,201706,english,MARPOR,FALSE,TRUE,FALSE,7e0fa07c4380e4f616ae65fceaae5460,/down/originals/2018-2/51421_2017.pdf,9eddba3e7bb1b24dce8eeb7d5c3dbfae,TRUE,5,NA,Change Britain´s future. Liberal Democrat manifesto 2017,FALSE,51421_201706
and create a new designation of national nature parks to protect up to one million acres of accessible green space valued by local communities.,501,NA,604,51421,201706,english,MARPOR,FALSE,TRUE,FALSE,7e0fa07c4380e4f616ae65fceaae5460,/down/originals/2018-2/51421_2017.pdf,9eddba3e7bb1b24dce8eeb7d5c3dbfae,TRUE,5,NA,Change Britain´s future. Liberal Democrat manifesto 2017,FALSE,51421_201706
"Protect and restore England’s lakes, rivers and wetlands, including through reform of water management and higher water-efficiency standards,",501,NA,605,51421,201706,english,MARPOR,FALSE,TRUE,FALSE,7e0fa07c4380e4f616ae65fceaae5460,/down/originals/2018-2/51421_2017.pdf,9eddba3e7bb1b24dce8eeb7d5c3dbfae,TRUE,5,NA,Change Britain´s future. Liberal Democrat manifesto 2017,FALSE,51421_201706
and establish a ‘blue belt’ of protected marine areas.,501,NA,606,51421,201706,english,MARPOR,FALSE,TRUE,FALSE,7e0fa07c4380e4f616ae65fceaae5460,/down/originals/2018-2/51421_2017.pdf,9eddba3e7bb1b24dce8eeb7d5c3dbfae,TRUE,5,NA,Change Britain´s future. Liberal Democrat manifesto 2017,FALSE,51421_201706
"Reverse the current sharp decline in the rate of woodland creation by aiming to plant a tree for every UK citizen over the next 10 years,",501,NA,607,51421,201706,english,MARPOR,FALSE,TRUE,FALSE,7e0fa07c4380e4f616ae65fceaae5460,/down/originals/2018-2/51421_2017.pdf,9eddba3e7bb1b24dce8eeb7d5c3dbfae,TRUE,5,NA,Change Britain´s future. Liberal Democrat manifesto 2017,FALSE,51421_201706
and protect remaining ancient woodlands.,501,NA,608,51421,201706,english,MARPOR,FALSE,TRUE,FALSE,7e0fa07c4380e4f616ae65fceaae5460,/down/originals/2018-2/51421_2017.pdf,9eddba3e7bb1b24dce8eeb7d5c3dbfae,TRUE,5,NA,Change Britain´s future. Liberal Democrat manifesto 2017,FALSE,51421_201706
Suspend the use of neonicotinoids until proven that their use in agriculture does not harm bees or other pollinators.,501,NA,609,51421,201706,english,MARPOR,FALSE,TRUE,FALSE,7e0fa07c4380e4f616ae65fceaae5460,/down/originals/2018-2/51421_2017.pdf,9eddba3e7bb1b24dce8eeb7d5c3dbfae,TRUE,5,NA,Change Britain´s future. Liberal Democrat manifesto 2017,FALSE,51421_201706
"Introduce stronger penalties for animal cruelty offences, increasing the maximum sentencing from six months to five years,",501,NA,610,51421,201706,english,MARPOR,FALSE,TRUE,FALSE,7e0fa07c4380e4f616ae65fceaae5460,/down/originals/2018-2/51421_2017.pdf,9eddba3e7bb1b24dce8eeb7d5c3dbfae,TRUE,5,NA,Change Britain´s future. Liberal Democrat manifesto 2017,FALSE,51421_201706
and bring in a ban on caged hens.,501,NA,611,51421,201706,english,MARPOR,FALSE,TRUE,FALSE,7e0fa07c4380e4f616ae65fceaae5460,/down/originals/2018-2/51421_2017.pdf,9eddba3e7bb1b24dce8eeb7d5c3dbfae,TRUE,5,NA,Change Britain´s future. Liberal Democrat manifesto 2017,FALSE,51421_201706
"Clamp down on illegal pet imports through legal identification requirements for online sales,",501,NA,612,51421,201706,english,MARPOR,FALSE,TRUE,FALSE,7e0fa07c4380e4f616ae65fceaae5460,/down/originals/2018-2/51421_2017.pdf,9eddba3e7bb1b24dce8eeb7d5c3dbfae,TRUE,5,NA,Change Britain´s future. Liberal Democrat manifesto 2017,FALSE,51421_201706
"and minimise the use of animals in scientific experimentation, including by funding research into alternatives.",501,NA,613,51421,201706,english,MARPOR,FALSE,TRUE,FALSE,7e0fa07c4380e4f616ae65fceaae5460,/down/originals/2018-2/51421_2017.pdf,9eddba3e7bb1b24dce8eeb7d5c3dbfae,TRUE,5,NA,Change Britain´s future. Liberal Democrat manifesto 2017,FALSE,51421_201706
"5.5 Farming, food and agriculture",H,NA,614,51421,201706,english,MARPOR,FALSE,TRUE,FALSE,7e0fa07c4380e4f616ae65fceaae5460,/down/originals/2018-2/51421_2017.pdf,9eddba3e7bb1b24dce8eeb7d5c3dbfae,TRUE,5,NA,Change Britain´s future. Liberal Democrat manifesto 2017,FALSE,51421_201706
"The vote to leave the EU puts farming and agricultural businesses in huge danger, threatening both cuts to the support which underpin farmers’ livelihoods and ability to manage the countryside,",703.1,NA,615,51421,201706,english,MARPOR,FALSE,TRUE,FALSE,7e0fa07c4380e4f616ae65fceaae5460,/down/originals/2018-2/51421_2017.pdf,9eddba3e7bb1b24dce8eeb7d5c3dbfae,TRUE,5,NA,Change Britain´s future. Liberal Democrat manifesto 2017,FALSE,51421_201706
and also tariffs on exports.,703.1,NA,616,51421,201706,english,MARPOR,FALSE,TRUE,FALSE,7e0fa07c4380e4f616ae65fceaae5460,/down/originals/2018-2/51421_2017.pdf,9eddba3e7bb1b24dce8eeb7d5c3dbfae,TRUE,5,NA,Change Britain´s future. Liberal Democrat manifesto 2017,FALSE,51421_201706
"For agricultural products outside the EU, tariffs average 22.3% – putting Britain’s £1 8 billion of food exports in danger.",703.1,NA,617,51421,201706,english,MARPOR,FALSE,TRUE,FALSE,7e0fa07c4380e4f616ae65fceaae5460,/down/originals/2018-2/51421_2017.pdf,9eddba3e7bb1b24dce8eeb7d5c3dbfae,TRUE,5,NA,Change Britain´s future. Liberal Democrat manifesto 2017,FALSE,51421_201706
"Our system must support farmers,",703.1,NA,618,51421,201706,english,MARPOR,FALSE,TRUE,FALSE,7e0fa07c4380e4f616ae65fceaae5460,/down/originals/2018-2/51421_2017.pdf,9eddba3e7bb1b24dce8eeb7d5c3dbfae,TRUE,5,NA,Change Britain´s future. Liberal Democrat manifesto 2017,FALSE,51421_201706
ensure food production,703.1,NA,619,51421,201706,english,MARPOR,FALSE,TRUE,FALSE,7e0fa07c4380e4f616ae65fceaae5460,/down/originals/2018-2/51421_2017.pdf,9eddba3e7bb1b24dce8eeb7d5c3dbfae,TRUE,5,NA,Change Britain´s future. Liberal Democrat manifesto 2017,FALSE,51421_201706
and protect the environment.,501,NA,620,51421,201706,english,MARPOR,FALSE,TRUE,FALSE,7e0fa07c4380e4f616ae65fceaae5460,/down/originals/2018-2/51421_2017.pdf,9eddba3e7bb1b24dce8eeb7d5c3dbfae,TRUE,5,NA,Change Britain´s future. Liberal Democrat manifesto 2017,FALSE,51421_201706
That’s why we will:,NA,NA,621,51421,201706,english,MARPOR,FALSE,TRUE,FALSE,7e0fa07c4380e4f616ae65fceaae5460,/down/originals/2018-2/51421_2017.pdf,9eddba3e7bb1b24dce8eeb7d5c3dbfae,TRUE,5,NA,Change Britain´s future. Liberal Democrat manifesto 2017,FALSE,51421_201706
"Continue our long campaign to reform agricultural subsidies – making sure British farming remains competitive and doesn’t lose out in the event of Britain leaving the EU, rebalancing away from direct subsidy and refocusing support towards the public benefits that come from effective land management including countryside protection, flood prevention, food production and climate-change mitigation.",703.1,NA,622,51421,201706,english,MARPOR,FALSE,TRUE,FALSE,7e0fa07c4380e4f616ae65fceaae5460,/down/originals/2018-2/51421_2017.pdf,9eddba3e7bb1b24dce8eeb7d5c3dbfae,TRUE,5,NA,Change Britain´s future. Liberal Democrat manifesto 2017,FALSE,51421_201706
"This would ensure that smaller farms are protected and move support away from large landowners,",703.1,NA,623,51421,201706,english,MARPOR,FALSE,TRUE,FALSE,7e0fa07c4380e4f616ae65fceaae5460,/down/originals/2018-2/51421_2017.pdf,9eddba3e7bb1b24dce8eeb7d5c3dbfae,TRUE,5,NA,Change Britain´s future. Liberal Democrat manifesto 2017,FALSE,51421_201706
while delivering a more localised agricultural policy.,416.2,NA,624,51421,201706,english,MARPOR,FALSE,TRUE,FALSE,7e0fa07c4380e4f616ae65fceaae5460,/down/originals/2018-2/51421_2017.pdf,9eddba3e7bb1b24dce8eeb7d5c3dbfae,TRUE,5,NA,Change Britain´s future. Liberal Democrat manifesto 2017,FALSE,51421_201706
"Encourage new and younger entrants to farming by championing different forms of ownership including longer tenancies, share farming and community ownership.",703.1,NA,625,51421,201706,english,MARPOR,FALSE,TRUE,FALSE,7e0fa07c4380e4f616ae65fceaae5460,/down/originals/2018-2/51421_2017.pdf,9eddba3e7bb1b24dce8eeb7d5c3dbfae,TRUE,5,NA,Change Britain´s future. Liberal Democrat manifesto 2017,FALSE,51421_201706
"Introduce a national food strategy to promote the production and consumption of healthy, sustainable and affordable food.",416.2,NA,626,51421,201706,english,MARPOR,FALSE,TRUE,FALSE,7e0fa07c4380e4f616ae65fceaae5460,/down/originals/2018-2/51421_2017.pdf,9eddba3e7bb1b24dce8eeb7d5c3dbfae,TRUE,5,NA,Change Britain´s future. Liberal Democrat manifesto 2017,FALSE,51421_201706
"Increase the powers of the Groceries Code Adjudicator and extend its remit to include businesses further up the supply chain, helping to ensure that farmers receive a fair price.",703.1,NA,627,51421,201706,english,MARPOR,FALSE,TRUE,FALSE,7e0fa07c4380e4f616ae65fceaae5460,/down/originals/2018-2/51421_2017.pdf,9eddba3e7bb1b24dce8eeb7d5c3dbfae,TRUE,5,NA,Change Britain´s future. Liberal Democrat manifesto 2017,FALSE,51421_201706
Continue to improve standards of animal health and welfare in agriculture by updating farm animal welfare codes and promoting the responsible stewardship of antibiotic drugs.,501,NA,628,51421,201706,english,MARPOR,FALSE,TRUE,FALSE,7e0fa07c4380e4f616ae65fceaae5460,/down/originals/2018-2/51421_2017.pdf,9eddba3e7bb1b24dce8eeb7d5c3dbfae,TRUE,5,NA,Change Britain´s future. Liberal Democrat manifesto 2017,FALSE,51421_201706
"Ensure that future trade deals require high safety, environmental and animal welfare standards for food imports, including clear and unambiguous country-of-origin labelling for meat and dairy products.",501,NA,629,51421,201706,english,MARPOR,FALSE,TRUE,FALSE,7e0fa07c4380e4f616ae65fceaae5460,/down/originals/2018-2/51421_2017.pdf,9eddba3e7bb1b24dce8eeb7d5c3dbfae,TRUE,5,NA,Change Britain´s future. Liberal Democrat manifesto 2017,FALSE,51421_201706
"Develop safe, effective, humane and evidence-based ways of controlling bovine TB, including by investing to produce workable vaccines.",501,NA,630,51421,201706,english,MARPOR,FALSE,TRUE,FALSE,7e0fa07c4380e4f616ae65fceaae5460,/down/originals/2018-2/51421_2017.pdf,9eddba3e7bb1b24dce8eeb7d5c3dbfae,TRUE,5,NA,Change Britain´s future. Liberal Democrat manifesto 2017,FALSE,51421_201706
"Despite reform, the Common Fisheries Policy has failed to deliver the economic or environmental objectives necessary",703.1,NA,631,51421,201706,english,MARPOR,FALSE,TRUE,FALSE,7e0fa07c4380e4f616ae65fceaae5460,/down/originals/2018-2/51421_2017.pdf,9eddba3e7bb1b24dce8eeb7d5c3dbfae,TRUE,5,NA,Change Britain´s future. Liberal Democrat manifesto 2017,FALSE,51421_201706
"and has suffered from being remote, overly centralised and bureaucratic.",303,NA,632,51421,201706,english,MARPOR,FALSE,TRUE,FALSE,7e0fa07c4380e4f616ae65fceaae5460,/down/originals/2018-2/51421_2017.pdf,9eddba3e7bb1b24dce8eeb7d5c3dbfae,TRUE,5,NA,Change Britain´s future. Liberal Democrat manifesto 2017,FALSE,51421_201706
"Hard Brexit and the loss of export markets threatens to further damage the industry, which has long suffered from being used as a bargaining chip by U K governments.",703.1,NA,633,51421,201706,english,MARPOR,FALSE,TRUE,FALSE,7e0fa07c4380e4f616ae65fceaae5460,/down/originals/2018-2/51421_2017.pdf,9eddba3e7bb1b24dce8eeb7d5c3dbfae,TRUE,5,NA,Change Britain´s future. Liberal Democrat manifesto 2017,FALSE,51421_201706
"Liberal Democrats would defend and maintain our fishing industry by not allowing fishing rights to be traded away against other policy areas,",703.1,NA,634,51421,201706,english,MARPOR,FALSE,TRUE,FALSE,7e0fa07c4380e4f616ae65fceaae5460,/down/originals/2018-2/51421_2017.pdf,9eddba3e7bb1b24dce8eeb7d5c3dbfae,TRUE,5,NA,Change Britain´s future. Liberal Democrat manifesto 2017,FALSE,51421_201706
and work with the industry and other stakeholders to develop a national plan for sustainable fisheries.,416.2,NA,635,51421,201706,english,MARPOR,FALSE,TRUE,FALSE,7e0fa07c4380e4f616ae65fceaae5460,/down/originals/2018-2/51421_2017.pdf,9eddba3e7bb1b24dce8eeb7d5c3dbfae,TRUE,5,NA,Change Britain´s future. Liberal Democrat manifesto 2017,FALSE,51421_201706
"5.6 Cutting waste, using resources wisely",H,NA,636,51421,201706,english,MARPOR,FALSE,TRUE,FALSE,7e0fa07c4380e4f616ae65fceaae5460,/down/originals/2018-2/51421_2017.pdf,9eddba3e7bb1b24dce8eeb7d5c3dbfae,TRUE,5,NA,Change Britain´s future. Liberal Democrat manifesto 2017,FALSE,51421_201706
Britain’s economy fails to make the most efficient use of natural resources.,416.2,NA,637,51421,201706,english,MARPOR,FALSE,TRUE,FALSE,7e0fa07c4380e4f616ae65fceaae5460,/down/originals/2018-2/51421_2017.pdf,9eddba3e7bb1b24dce8eeb7d5c3dbfae,TRUE,5,NA,Change Britain´s future. Liberal Democrat manifesto 2017,FALSE,51421_201706
"We aim to cut waste,",416.2,NA,638,51421,201706,english,MARPOR,FALSE,TRUE,FALSE,7e0fa07c4380e4f616ae65fceaae5460,/down/originals/2018-2/51421_2017.pdf,9eddba3e7bb1b24dce8eeb7d5c3dbfae,TRUE,5,NA,Change Britain´s future. Liberal Democrat manifesto 2017,FALSE,51421_201706
"increase recovery, reuse and recycling",416.2,NA,639,51421,201706,english,MARPOR,FALSE,TRUE,FALSE,7e0fa07c4380e4f616ae65fceaae5460,/down/originals/2018-2/51421_2017.pdf,9eddba3e7bb1b24dce8eeb7d5c3dbfae,TRUE,5,NA,Change Britain´s future. Liberal Democrat manifesto 2017,FALSE,51421_201706
"and move towards the so-called ‘circular economy’ in which resource use, waste and pollution are minimised and product lifetimes are extended.",416.2,NA,640,51421,201706,english,MARPOR,FALSE,TRUE,FALSE,7e0fa07c4380e4f616ae65fceaae5460,/down/originals/2018-2/51421_2017.pdf,9eddba3e7bb1b24dce8eeb7d5c3dbfae,TRUE,5,NA,Change Britain´s future. Liberal Democrat manifesto 2017,FALSE,51421_201706
"This will cut costs for consumers and businesses, and create new jobs and enterprises, helping to grow Britain’s economy.",410,NA,641,51421,201706,english,MARPOR,FALSE,TRUE,FALSE,7e0fa07c4380e4f616ae65fceaae5460,/down/originals/2018-2/51421_2017.pdf,9eddba3e7bb1b24dce8eeb7d5c3dbfae,TRUE,5,NA,Change Britain´s future. Liberal Democrat manifesto 2017,FALSE,51421_201706
"We will: Pass a Zero-Waste Act, including legally binding targets for reducing net consumption of key natural resources,",501,NA,642,51421,201706,english,MARPOR,FALSE,TRUE,FALSE,7e0fa07c4380e4f616ae65fceaae5460,/down/originals/2018-2/51421_2017.pdf,9eddba3e7bb1b24dce8eeb7d5c3dbfae,TRUE,5,NA,Change Britain´s future. Liberal Democrat manifesto 2017,FALSE,51421_201706
and introducing incentives for businesses to improve resource efficiency.,416.2,NA,643,51421,201706,english,MARPOR,FALSE,TRUE,FALSE,7e0fa07c4380e4f616ae65fceaae5460,/down/originals/2018-2/51421_2017.pdf,9eddba3e7bb1b24dce8eeb7d5c3dbfae,TRUE,5,NA,Change Britain´s future. Liberal Democrat manifesto 2017,FALSE,51421_201706
"Benefit consumers by promoting better product design to improve repairability, reuse and recycling.",416.2,NA,644,51421,201706,english,MARPOR,FALSE,TRUE,FALSE,7e0fa07c4380e4f616ae65fceaae5460,/down/originals/2018-2/51421_2017.pdf,9eddba3e7bb1b24dce8eeb7d5c3dbfae,TRUE,5,NA,Change Britain´s future. Liberal Democrat manifesto 2017,FALSE,51421_201706
Establish a statutory waste recycling target of 70% in England,501,NA,645,51421,201706,english,MARPOR,FALSE,TRUE,FALSE,7e0fa07c4380e4f616ae65fceaae5460,/down/originals/2018-2/51421_2017.pdf,9eddba3e7bb1b24dce8eeb7d5c3dbfae,TRUE,5,NA,Change Britain´s future. Liberal Democrat manifesto 2017,FALSE,51421_201706
and extend separate food waste collections to at least 90% of homes by 2022.,501,NA,646,51421,201706,english,MARPOR,FALSE,TRUE,FALSE,7e0fa07c4380e4f616ae65fceaae5460,/down/originals/2018-2/51421_2017.pdf,9eddba3e7bb1b24dce8eeb7d5c3dbfae,TRUE,5,NA,Change Britain´s future. Liberal Democrat manifesto 2017,FALSE,51421_201706
"Building on the success of our plastic bag charge, introduce a 5p charge on disposable coffee cups to reduce waste.",501,NA,647,51421,201706,english,MARPOR,FALSE,TRUE,FALSE,7e0fa07c4380e4f616ae65fceaae5460,/down/originals/2018-2/51421_2017.pdf,9eddba3e7bb1b24dce8eeb7d5c3dbfae,TRUE,5,NA,Change Britain´s future. Liberal Democrat manifesto 2017,FALSE,51421_201706
"Establish a coherent tax and regulatory framework for landfill, incineration and waste collection, including reinstating the landfill tax escalator and extending it to the lower rate, and consulting on the introduction of an incineration tax.",501,NA,648,51421,201706,english,MARPOR,FALSE,TRUE,FALSE,7e0fa07c4380e4f616ae65fceaae5460,/down/originals/2018-2/51421_2017.pdf,9eddba3e7bb1b24dce8eeb7d5c3dbfae,TRUE,5,NA,Change Britain´s future. Liberal Democrat manifesto 2017,FALSE,51421_201706
Work with local government to ensure these commitments are fully funded.,301,NA,649,51421,201706,english,MARPOR,FALSE,TRUE,FALSE,7e0fa07c4380e4f616ae65fceaae5460,/down/originals/2018-2/51421_2017.pdf,9eddba3e7bb1b24dce8eeb7d5c3dbfae,TRUE,5,NA,Change Britain´s future. Liberal Democrat manifesto 2017,FALSE,51421_201706
"To ensure the policies set out in this chapter are implemented, and to put the protection of the environment at the heart of policies across all areas of government, we will establish a Cabinet Committee on Sustainability, chaired by a cabinet minister,",416.2,NA,650,51421,201706,english,MARPOR,FALSE,TRUE,FALSE,7e0fa07c4380e4f616ae65fceaae5460,/down/originals/2018-2/51421_2017.pdf,9eddba3e7bb1b24dce8eeb7d5c3dbfae,TRUE,5,NA,Change Britain´s future. Liberal Democrat manifesto 2017,FALSE,51421_201706
"establish an Office for Environmental Responsibility to scrutinise the government’s efforts to meet its environmental targets,",501,NA,651,51421,201706,english,MARPOR,FALSE,TRUE,FALSE,7e0fa07c4380e4f616ae65fceaae5460,/down/originals/2018-2/51421_2017.pdf,9eddba3e7bb1b24dce8eeb7d5c3dbfae,TRUE,5,NA,Change Britain´s future. Liberal Democrat manifesto 2017,FALSE,51421_201706
